"Match ID","League","Start Date","Duration (s)","Duration (mm:ss)","Radiant Team","Team A","Team A Heroes","Team B","Team B Heroes","Winner"
"7187763505","15286","05 Jun 2023 09:45","2710","45:10","Team A","One Move","Bloodseeker  Juggernaut  Vengeful Spirit  Disruptor  Pangolier","Luna Galaxy","Lich  Batrider  Medusa  Ember Spirit  Mars","Team B"
"7187833978","15286","05 Jun 2023 10:59","3150","52:30","Team B","One Move","Bane  Bloodseeker  Enchantress  Batrider  Spirit Breaker","Luna Galaxy","Storm Spirit  Lich  Pugna  Ursa  Timbersaw","Team A"
"7187893827","15286","06 Jun 2023 12:20","2761","46:01","Team A","One Move","Bloodseeker  Mirana  Zeus  Shadow Demon  Timbersaw","Luna Galaxy","Lion  Witch Doctor  Tinker  Faceless Void  Batrider","Team A"
"7187909458","15350","06 Jun 2023 12:53","2103","35:03","Team A","ALPHA","Bloodseeker  Crystal Maiden  Storm Spirit  Windranger  Keeper of the Light","SAND KING GÓMEZ","Mirana  Clockwerk  Naga Siren  Magnus  Void Spirit","Team A"
"7188099933","15350","06 Jun 2023 06:38","2782","46:22","Team A","ALPHA","Bloodseeker  Enchantress  Keeper of the Light  Timbersaw  Ember Spirit","B8","Beastmaster  Dragon Knight  Skywrath Mage  Techies  Terrorblade","Team B"
"7188128242","15384","06 Jun 2023 07:19","1479","24:39","Team A","Limit","Bloodseeker  Vengeful Spirit  Silencer  Arc Warden  Pangolier","Big brain","Crystal Maiden  Lich  Faceless Void  Batrider  Magnus","Team A"
"7188207599","15384","06 Jun 2023 09:30","3053","50:53","Team A","Team Disillusion","Bloodseeker  Shadow Demon  Magnus  Techies  Ember Spirit","Team Zero","Tiny  Beastmaster  Silencer  Keeper of the Light  Arc Warden","Team B"
"7188520941","15336","06 Jun 2023 02:34","2048","34:08","Team A","Sibe Team","Bloodseeker  Pugna  Batrider  Spirit Breaker  Medusa","Natus Vincere","Windranger  Dark Seer  Silencer  Earth Spirit  Void Spirit","Team B"
"7188693532","15286","06 Jun 2023 04:22","2218","36:58","Team A","One Move","Bloodseeker  Batrider  Silencer  Underlord  Void Spirit","BetBoom Team","Crystal Maiden  Storm Spirit  Sven  Keeper of the Light  Legion Commander","Team B"
"7188899331","15286","06 Jun 2023 06:31","1750","29:10","Team A","One Move","Bloodseeker  Crystal Maiden  Morphling  Timbersaw  Skywrath Mage","BetBoom Team","Lich  Templar Assassin  Enchantress  Doom  Terrorblade","Team B"
"7189049673","15366","06 Jun 2023 08:27","1737","28:57","Team B","Qhali","Bloodseeker  Juggernaut  Techies  Oracle  Void Spirit","Universitario eSports","Puck  Lich  Keeper of the Light  Medusa  Magnus","Team B"
"7189230816","15269","06 Jun 2023 11:21","1228","20:28","Team B","noMERCY","Bane  Bloodseeker  Doom  Legion Commander  Techies","Lava Esports","Templar Assassin  Clockwerk  Batrider  Undying  Ember Spirit","Team B"
"7189522613","15375","07 Jun 2023 07:50","1579","26:19","Team A","Vision","Bloodseeker  Crystal Maiden  Windranger  Bounty Hunter  Underlord","Polaris Esports","Beastmaster  Luna  Shadow Demon  Visage  Dark Willow","Team B"
"7189618297","15375","07 Jun 2023 10:01","2614","43:34","Team A","UD VESSUWAN","Bloodseeker  Batrider  Shadow Demon  Rubick  Magnus","Neon Esports","Windranger  Venomancer  Brewmaster  Terrorblade  Void Spirit","Team B"
"7189731228","15375","07 Jun 2023 12:08","2437","40:37","Team B","Neon Esports","Bloodseeker  Windranger  Venomancer  Alchemist  Earth Spirit","UD VESSUWAN","Batrider  Undying  Underlord  Arc Warden  Void Spirit","Team B"
"7191302014","15336","08 Jun 2023 03:00","2732","45:32","Team A","NAVI Junior","Bloodseeker  Templar Assassin  Dark Seer  Spirit Breaker  Techies","Natus Vincere","Windranger  Chen  Doom  Shadow Demon  Void Spirit","Team B"
"7191429220","15336","08 Jun 2023 04:25","1807","30:07","Team B","Moneymakers","Bloodseeker  Puck  Lich  Shadow Demon  Legion Commander","Team Sexy","Juggernaut  Storm Spirit  Beastmaster  Batrider  Keeper of the Light","Team B"
"7191743800","15366","08 Jun 2023 08:04","2519","41:59","Team B","Los moticucos","Bloodseeker  Venomancer  Rubick  Monkey King  Void Spirit","x5 Gaming","Windranger  Witch Doctor  Batrider  Naga Siren  Techies","Team B"
"7192204873","15375","09 Jun 2023 07:00","1928","32:08","Team A","IHC","Bloodseeker  Disruptor  Skywrath Mage  Earth Spirit  Underlord","Geek Slate","Juggernaut  Storm Spirit  Pugna  Doom  Rubick","Team B"
"7192646349","15352","09 Jun 2023 02:57","2269","37:49","Team B","Ancient Tribe","Bloodseeker  Lich  Necrophos  Pugna  Doom","Nigma Galaxy","Witch Doctor  Beastmaster  Techies  Monkey King  Void Spirit","Team B"
"7193356912","15353","09 Jun 2023 11:55","2491","41:31","Team A","American goons","Bloodseeker  Batrider  Doom  Rubick  Timbersaw","GRIN Esports","Mirana  Wraith King  Magnus  Oracle  Void Spirit","Team A"
"7194372491","15336","10 Jun 2023 04:59","2520","42:00","Team A","cybercats","Bloodseeker  Phantom Lancer  Puck  Shadow Demon  Techies","Sibe Team","Windranger  Lich  Pugna  Templar Assassin  Doom","Team A"
"7195035679","15366","11 Jun 2023 03:18","3306","55:06","Team B","Los moticucos","Bloodseeker  Pugna  Rubick  Medusa  Dawnbreaker","NoPing Esports","Templar Assassin  Clockwerk  Dark Seer  Batrider  Pangolier","Team B"
"7195198947","15375","11 Jun 2023 07:00","1908","31:48","Team A","IHC","Bloodseeker  Techies  Underlord  Oracle  Pangolier","Polaris Esports","Windranger  Beastmaster  Venomancer  Terrorblade  Mars","Team A"
"7195522342","15439","11 Jun 2023 11:57","2123","35:23","Team B","TSM","Bloodseeker  Windranger  Lich  Medusa  Skywrath Mage","Team Spirit","Juggernaut  Mirana  Storm Spirit  Tidehunter  Techies","Team B"
"7195522876","15375","11 Jun 2023 11:57","2733","45:33","Team B","Geek Slate","Bloodseeker  Dark Seer  Batrider  Spirit Breaker  Timbersaw","UD VESSUWAN","Juggernaut  Lich  Viper  Rubick  Underlord","Team A"
"7195588301","15439","11 Jun 2023 12:52","1657","27:37","Team A","Tundra Esports","Bloodseeker  Batrider  Visage  Techies  Pangolier","Team Liquid","Queen of Pain  Venomancer  Lifestealer  Shadow Demon  Magnus","Team A"
"7195625923","15375","11 Jun 2023 01:12","3211","53:31","Team A","Vision","Bloodseeker  Queen of Pain  Techies  Oracle  Mars","Myth Avenue Gaming","Spirit Breaker  Rubick  Keeper of the Light  Terrorblade  Pangolier","Team A"
"7195637535","15439","11 Jun 2023 01:21","2037","33:57","Team B","Team Spirit","Bloodseeker  Lich  Timbersaw  Techies  Ember Spirit","TSM","Puck  Beastmaster  Rubick  Magnus  Oracle","Team B"
"7195773784","15352","11 Jun 2023 02:57","3923","1:05:23","Team B","LEVEL UP","Bloodseeker  Mirana  Enigma  Queen of Pain  Doom","Ancient Tribe","Beastmaster  Batrider  Skywrath Mage  Ember Spirit  Monkey King","Team A"
"7195985918","15439","11 Jun 2023 05:21","1755","29:15","Team B","Evil Geniuses","Bloodseeker  Death Prophet  Bounty Hunter  Magnus  Skywrath Mage","Team Liquid","Luna  Spirit Breaker  Visage  Techies  Void Spirit","Team A"
"7195993121","15439","11 Jun 2023 05:08","2607","43:27","Team A","Team Secret","Bane  Bloodseeker  Spirit Breaker  Shadow Demon  Void Spirit","TSM","Morphling  Witch Doctor  Beastmaster  Keeper of the Light  Magnus","Team A"
"7196102277","15439","11 Jun 2023 06:22","1801","30:01","Team A","Team Liquid","Axe  Bloodseeker  Storm Spirit  Pugna  Techies","Evil Geniuses","Tiny  Lich  Bounty Hunter  Brewmaster  Magnus","Team A"
"7196225623","15439","11 Jun 2023 07:55","2339","38:59","Team B","Gaimin Gladiators","Bloodseeker  Queen of Pain  Enchantress  Spirit Breaker  Medusa","9Pandas","Mirana  Morphling  Witch Doctor  Bounty Hunter  Timbersaw","Team A"
"7196248646","15352","11 Jun 2023 08:07","2782","46:22","Team A","Nigma Galaxy","Bloodseeker  Doom  Silencer  Techies  Ember Spirit","IVY","Mirana  Undying  Magnus  Abaddon  Void Spirit","Team A"
"7196433178","15352","11 Jun 2023 10:48","3284","54:44","Team B","KZ TEAM","Bloodseeker  Mirana  Vengeful Spirit  Ursa  Ember Spirit","Alliance","Batrider  Silencer  Skywrath Mage  Terrorblade  Void Spirit","Team B"
"7196661864","15353","12 Jun 2023 04:35","2788","46:28","Team A","Ravens","Bloodseeker  Clinkz  Omniknight  Techies  Pangolier","GRIN Esports","Batrider  Rubick  Magnus  Legion Commander  Snapfire","Team A"
"7197038591","15439","12 Jun 2023 12:50","2001","33:21","Team A","Team Spirit","Bloodseeker  Sniper  Batrider  Spirit Breaker  Winter Wyvern","Evil Geniuses","Venomancer  Shadow Demon  Medusa  Skywrath Mage  Legion Commander","Team B"
"7197053240","15336","12 Jun 2023 01:00","2629","43:49","Team A","Sibe Team","Bloodseeker  Lich  Batrider  Skywrath Mage  Void Spirit","NAVI Junior","Tidehunter  Magnus  Techies  Terrorblade  Oracle","Team B"
"7197159801","15439","12 Jun 2023 02:26","2558","42:38","Team B","BetBoom Team","Bloodseeker  Lich  Keeper of the Light  Ember Spirit  Underlord","OG","Spirit Breaker  Ogre Magi  Medusa  Techies  Void Spirit","Team B"
"7197160835","15439","12 Jun 2023 02:28","2527","42:07","Team B","beastcoast","Bloodseeker  Morphling  Pugna  Rubick  Underlord","Gaimin Gladiators","Doom  Silencer  Chaos Knight  Keeper of the Light  Ember Spirit","Team A"
"7197170408","15336","12 Jun 2023 02:28","1951","32:31","Team B","Sibe Team","Bloodseeker  Storm Spirit  Spirit Breaker  Silencer  Techies","NAVI Junior","Sven  Pugna  Batrider  Magnus  Void Spirit","Team B"
"7197382646","15439","12 Jun 2023 05:09","2387","39:47","Team B","Evil Geniuses","Bloodseeker  Viper  Bounty Hunter  Disruptor  Snapfire","Team Secret","Tidehunter  Lich  Batrider  Timbersaw  Monkey King","Team A"
"7197398842","15439","12 Jun 2023 04:55","2278","37:58","Team A","Tundra Esports","Bloodseeker  Tidehunter  Shadow Demon  Keeper of the Light  Timbersaw","PSG.LGD","Storm Spirit  Beastmaster  Venomancer  Templar Assassin  Techies","Team A"
"7197402650","15439","12 Jun 2023 05:08","2083","34:43","Team B","Team Spirit","Bloodseeker  Enchantress  Rubick  Winter Wyvern  Void Spirit","Team Liquid","Juggernaut  Silencer  Visage  Techies  Marci","Team B"
"7197501814","15439","12 Jun 2023 06:04","2194","36:34","Team B","Tundra Esports","Bloodseeker  Doom  Keeper of the Light  Oracle  Primal Beast","PSG.LGD","Windranger  Beastmaster  Io  Techies  Marci","Team B"
"7197508252","15439","12 Jun 2023 06:16","2234","37:14","Team A","Team Liquid","Bloodseeker  Pugna  Abaddon  Techies  Void Spirit","Team Spirit","Lich  Beastmaster  Faceless Void  Rubick  Snapfire","Team B"
"7197557486","15439","12 Jun 2023 06:46","1427","23:47","Team A","Talon","Bloodseeker  Doom  Silencer  Techies  Ember Spirit","TSM","Lich  Batrider  Visage  Monkey King  Void Spirit","Team A"
"7197710610","15439","12 Jun 2023 08:57","1425","23:45","Team B","Team Aster","Bloodseeker  Storm Spirit  Silencer  Io  Legion Commander","Gaimin Gladiators","Mirana  Lich  Lifestealer  Magnus  Void Spirit","Team B"
"7197781999","15353","12 Jun 2023 09:55","1747","29:07","Team A","CDUB Esports","Anti-Mage  Bloodseeker  Disruptor  Magnus  Timbersaw","Nexus Titans","Crystal Maiden  Pugna  Outworld Devourer  Medusa  Void Spirit","Team A"
"7197883505","15353","12 Jun 2023 11:55","3115","51:55","Team A","The Cut","Bloodseeker  Disruptor  Keeper of the Light  Magnus  Ember Spirit","American goons","Templar Assassin  Silencer  Rubick  Underlord  Void Spirit","Team B"
"7197976370","15353","13 Jun 2023 02:35","2192","36:32","Team B","American goons","Bloodseeker  Venomancer  Batrider  Spirit Breaker  Timbersaw","The Cut","Queen of Pain  Lifestealer  Clinkz  Silencer  Magnus","Team B"
"7198087629","15384","13 Jun 2023 06:09","3081","51:21","Team A","Team Disillusion","Bloodseeker  Batrider  Skywrath Mage  Underlord  Void Spirit","Supernova","Enchantress  Silencer  Magnus  Terrorblade  Pangolier","Team A"
"7198343539","15439","13 Jun 2023 11:56","2630","43:50","Team B","Team Liquid","Axe  Bloodseeker  Vengeful Spirit  Timbersaw  Phoenix","PSG.LGD","Lifestealer  Silencer  Skywrath Mage  Void Spirit  Mars","Team B"
"7198515116","15439","13 Jun 2023 02:35","1406","23:26","Team A","Gaimin Gladiators","Bloodseeker  Dark Seer  Rubick  Techies  Void Spirit","Entity","Beastmaster  Venomancer  Clockwerk  Lone Druid  Disruptor","Team A"
"7198565769","15439","13 Jun 2023 03:13","1808","30:08","Team A","OG","Bloodseeker  Storm Spirit  Spirit Breaker  Io  Snapfire","9Pandas","Windranger  Doom  Shadow Demon  Undying  Winter Wyvern","Team B"
"7198736156","15336","13 Jun 2023 05:00","2576","42:56","Team B","StoRm","Axe  Bloodseeker  Storm Spirit  Venomancer  Keeper of the Light","NAVI Junior","Juggernaut  Puck  Beastmaster  Batrider  Techies","Team B"
"7198748421","15439","13 Jun 2023 05:09","2286","38:06","Team A","TSM","Bane  Bloodseeker  Windranger  Beastmaster  Techies","PSG.LGD","Kunkka  Faceless Void  Enchantress  Keeper of the Light  Timbersaw","Team A"
"7198760061","15439","13 Jun 2023 05:27","1895","31:35","Team A","Tundra Esports","Bloodseeker  Mirana  Doom  Silencer  Void Spirit","Team Spirit","Juggernaut  Windranger  Lich  Spirit Breaker  Shadow Demon","Team A"
"7198866748","15439","13 Jun 2023 06:33","1723","28:43","Team A","Tundra Esports","Bloodseeker  Crystal Maiden  Batrider  Rubick  Void Spirit","Team Spirit","Mirana  Beastmaster  Shadow Demon  Abaddon  Ember Spirit","Team B"
"7198929185","15439","13 Jun 2023 07:26","1706","28:26","Team B","beastcoast","Bloodseeker  Kunkka  Venomancer  Templar Assassin  Skywrath Mage","Team Aster","Mirana  Doom  Keeper of the Light  Medusa  Void Spirit","Team B"
"7199005574","15439","13 Jun 2023 08:28","2092","34:52","Team B","9Pandas","Bloodseeker  Tinker  Batrider  Undying  Magnus","Shopify Rebellion","Beastmaster  Venomancer  Abaddon  Techies  Snapfire","Team A"
"7199075393","15439","13 Jun 2023 09:33","2496","41:36","Team B","Shopify Rebellion","Bloodseeker  Mirana  Pugna  Lycan  Void Spirit","9Pandas","Windranger  Ogre Magi  Undying  Timbersaw  Skywrath Mage","Team A"
"7199653917","15439","14 Jun 2023 11:55","2106","35:06","Team A","Talon","Bloodseeker  Morphling  Windranger  Spirit Breaker  Silencer","PSG.LGD","Phantom Lancer  Witch Doctor  Magnus  Techies  Ember Spirit","Team B"
"7199657284","15439","14 Jun 2023 11:55","2800","46:40","Team B","Evil Geniuses","Bloodseeker  Windranger  Centaur Warrunner  Skywrath Mage  Monkey King","Tundra Esports","Pugna  Doom  Medusa  Techies  Void Spirit","Team B"
"7199729347","15439","14 Jun 2023 01:14","1866","31:06","Team B","Evil Geniuses","Bloodseeker  Shadow Fiend  Pugna  Skywrath Mage  Dawnbreaker","Tundra Esports","Doom  Ursa  Shadow Demon  Techies  Void Spirit","Team A"
"7199837298","15439","14 Jun 2023 02:41","2936","48:56","Team A","Shopify Rebellion","Bloodseeker  Beastmaster  Batrider  Silencer  Techies","OG","Juggernaut  Venomancer  Rubick  Magnus  Timbersaw","Team B"
"7199958992","15439","14 Jun 2023 04:05","2589","43:09","Team B","Shopify Rebellion","Bloodseeker  Enchantress  Visage  Monkey King  Void Spirit","OG","Bane  Morphling  Windranger  Templar Assassin  Undying","Team A"
"7200429380","15352","14 Jun 2023 10:15","2380","39:40","Team B","LEVEL UP","Bloodseeker  Tidehunter  Venomancer  Spirit Breaker  Ember Spirit","Nigma Galaxy","Morphling  Pugna  Batrider  Disruptor  Timbersaw","Team B"
"7200874229","15384","15 Jun 2023 09:58","3124","52:04","Team B","Supernova","Bloodseeker  Templar Assassin  Shadow Demon  Techies  Void Spirit","Big brain","Crystal Maiden  Morphling  Windranger  Clockwerk  Timbersaw","Team B"
"7200969666","15439","15 Jun 2023 11:55","2138","35:38","Team A","Team Secret","Bloodseeker  Windranger  Shadow Demon  Techies  Pangolier","Tundra Esports","Juggernaut  Puck  Batrider  Spirit Breaker  Silencer","Team B"
"7201042502","15336","15 Jun 2023 01:01","2725","45:25","Team B","Moneymakers","Bloodseeker  Templar Assassin  Spirit Breaker  Techies  Underlord","Matreshka","Axe  Shadow Demon  Naga Siren  Timbersaw  Dark Willow","Team A"
"7201396530","15336","15 Jun 2023 05:22","3026","50:26","Team B","NAVI Junior","Bloodseeker  Tiny  Shadow Demon  Magnus  Techies","cybercats","Pugna  Batrider  Naga Siren  Visage  Void Spirit","Team B"
"7202221136","15375","16 Jun 2023 10:23","1669","27:49","Team A","Neon Esports","Bloodseeker  Storm Spirit  Windranger  Silencer  Pangolier","Geek Slate","Morphling  Dark Seer  Broodmother  Batrider  Spirit Breaker","Team B"
"7202441089","15439","16 Jun 2023 02:21","2212","36:52","Team A","9Pandas","Bloodseeker  Sniper  Pugna  Rubick  Timbersaw","Team Aster","Juggernaut  Lina  Beastmaster  Shadow Demon  Techies","Team A"
"7203198614","15353","16 Jun 2023 11:59","1594","26:34","Team B","Nexus Titans","Bloodseeker  Enchantress  Weaver  Spirit Breaker  Ember Spirit","The Cut","Zeus  Clinkz  Doom  Disruptor  Medusa","Team B"
"7203569147","15384","17 Jun 2023 09:01","2255","37:35","Team B","Holy Grail","Bloodseeker  Storm Spirit  Batrider  Silencer  Phoenix","Team Zero","Crystal Maiden  Morphling  Night Stalker  Techies  Void Spirit","Team B"
"7203700865","15384","17 Jun 2023 11:02","2430","40:30","Team A","Holy Grail","Bloodseeker  Beastmaster  Pugna  Dark Willow  Pangolier","Team Zero","Enchantress  Alchemist  Rubick  Timbersaw  Winter Wyvern","Team A"
"7204541793","15439","17 Jun 2023 09:25","3124","52:04","Team A","Evil Geniuses","Bloodseeker  Dark Seer  Undying  Skywrath Mage  Legion Commander","BetBoom Team","Death Prophet  Doom  Disruptor  Techies  Terrorblade","Team A"
"7204591909","15366","17 Jun 2023 09:57","2703","45:03","Team A","Lava Esports","Bloodseeker  Puck  Lycan  Rubick  Disruptor","NoPing Esports","Mirana  Storm Spirit  Undying  Timbersaw  Terrorblade","Team A"
"7204707310","15439","18 Jun 2023 12:00","2699","44:59","Team B","Evil Geniuses","Bloodseeker  Shadow Fiend  Bounty Hunter  Undying  Snapfire","BetBoom Team","Juggernaut  Lina  Doom  Disruptor  Techies","Team B"
"7204807564","15366","18 Jun 2023 02:23","1891","31:31","Team B","Qhali","Bloodseeker  Venomancer  Clinkz  Doom  Mars","Los moticucos","Phantom Assassin  Batrider  Rubick  Timbersaw  Techies","Team B"
"7205055697","15384","18 Jun 2023 08:04","3158","52:38","Team B","iG.Vitality","Bloodseeker  Lich  Doom  Techies  Ember Spirit","Big brain","Morphling  Silencer  Timbersaw  Tusk  Void Spirit","Team B"
"7205315055","15439","18 Jun 2023 12:04","3194","53:14","Team A","Gaimin Gladiators","Bloodseeker  Lion  Enchantress  Huskar  Underlord","Team Spirit","Mirana  Sniper  Lifestealer  Techies  Ember Spirit","Team A"
"7205399272","15375","18 Jun 2023 01:01","1290","21:30","Team A","Vision","Bloodseeker  Windranger  Spirit Breaker  Disruptor  Magnus","Geek Slate","Morphling  Lich  Broodmother  Doom  Undying","Team B"
"7205491497","14691","18 Jun 2023 02:12","1609","26:49","Team A","Trouble Makers Reborn","Bloodseeker  Lion  Shadow Demon  Legion Commander  Snapfire","Hot Headed Gaming","Juggernaut  Storm Spirit  Silencer  Rubick  Timbersaw","Team B"
"7206260619","15353","18 Jun 2023 11:56","3625","1:00:25","Team B","GRIN Esports","Bloodseeker  Lich  Beastmaster  Techies  Pangolier","Nexus Titans","Storm Spirit  Pugna  Broodmother  Disruptor  Mars","Team B"
"7206399237","15353","19 Jun 2023 04:02","1890","31:30","Team A","CDUB Esports","Bloodseeker  Tidehunter  Pugna  Rubick  Pangolier","American goons","Morphling  Venomancer  Disruptor  Timbersaw  Skywrath Mage","Team A"
"7206953918","15475","19 Jun 2023 03:17","2113","35:13","Team B","Twisted Minds","Bloodseeker  Batrider  Spirit Breaker  Techies  Winter Wyvern","Team Secret","Puck  Faceless Void  Chen  Rubick  Mars","Team B"
"7207020663","15439","19 Jun 2023 04:15","2839","47:19","Team B","PSG.LGD","Bloodseeker  Beastmaster  Undying  Snapfire  Primal Beast","Talon","Lich  Enchantress  Slark  Ember Spirit  Mars","Team A"
"7207488394","15353","19 Jun 2023 10:07","3129","52:09","Team B","CDUB Esports","Anti-Mage  Bloodseeker  Crystal Maiden  Lich  Pangolier","GRIN Esports","Enchantress  Naga Siren  Medusa  Legion Commander  Ember Spirit","Team A"
"7207536210","15439","19 Jun 2023 11:02","2148","35:48","Team A","Team Aster","Bloodseeker  Windranger  Enchantress  Doom  Rubick","Evil Geniuses","Morphling  Lion  Ogre Magi  Timbersaw  Snapfire","Team B"
"7207784284","15384","20 Jun 2023 06:04","4263","1:11:03","Team A","Holy Grail","Bloodseeker  Beastmaster  Pugna  Oracle  Primal Beast","iG.Vitality","Templar Assassin  Spirit Breaker  Chaos Knight  Timbersaw  Techies","Team B"
"7207979119","15439","20 Jun 2023 10:55","1956","32:36","Team B","Gaimin Gladiators","Bloodseeker  Leshrac  Undying  Rubick  Underlord","Talon","Juggernaut  Spirit Breaker  Keeper of the Light  Skywrath Mage  Pangolier","Team A"
"7208236451","14691","20 Jun 2023 02:53","2310","38:30","Team B","Hot Headed Gaming","Bloodseeker  Tinker  Bounty Hunter  Shadow Demon  Visage","Ancient Tribe","Lina  Alchemist  Medusa  Legion Commander  Techies","Team B"
"7208697537","15439","20 Jun 2023 08:30","2131","35:31","Team A","9Pandas","Bloodseeker  Storm Spirit  Pugna  Broodmother  Skywrath Mage","Evil Geniuses","Tiny  Spirit Breaker  Undying  Naga Siren  Keeper of the Light","Team B"
"7209145259","15375","21 Jun 2023 07:00","4375","1:12:55","Team A","UD VESSUWAN","Bloodseeker  Morphling  Spirit Breaker  Undying  Techies","Myth Avenue Gaming","Faceless Void  Rubick  Keeper of the Light  Magnus  Pangolier","Team B"
"7209326625","15375","21 Jun 2023 11:08","2953","49:13","Team A","IHC","Bloodseeker  Lion  Riki  Shadow Demon  Underlord","SPAWN Team","Puck  Silencer  Brewmaster  Naga Siren  Techies","Team A"
"7209916199","15439","21 Jun 2023 06:55","3888","1:04:48","Team A","Gaimin Gladiators","Bloodseeker  Templar Assassin  Broodmother  Rubick  Techies","Team Aster","Morphling  Puck  Dark Seer  Spirit Breaker  Undying","Team B"
"7209931337","14783","21 Jun 2023 06:59","2945","49:05","Team B","Lava Esports","Bloodseeker  Batrider  Disruptor  Timbersaw  Ember Spirit","noMERCY","Morphling  Puck  Venomancer  Pugna  Spirit Breaker","Team A"
"7210134665","14783","21 Jun 2023 09:59","2968","49:28","Team A","Vivo Keyd Stars","Bloodseeker  Storm Spirit  Medusa  Techies  Mars","NoPing Esports","Mirana  Morphling  Tidehunter  Shadow Demon  Ember Spirit","Team A"
"7210248284","15353","21 Jun 2023 11:59","2299","38:19","Team B","TiltedBoys","Bloodseeker  Enchantress  Doom  Rubick  Snapfire","Nexus Titans","Zeus  Pugna  Disruptor  Timbersaw  Monkey King","Team B"
"7210378401","15353","22 Jun 2023 03:51","3241","54:01","Team A","The Cut","Bloodseeker  Death Prophet  Clinkz  Ancient Apparition  Doom","Ravens","Axe  Mirana  Morphling  Timbersaw  Elder Titan","Team A"
"7210431738","15353","22 Jun 2023 05:12","2064","34:24","Team A","The Cut","Bloodseeker  Queen of Pain  Clinkz  Doom  Silencer","Ravens","Morphling  Pugna  Timbersaw  Monkey King  Pangolier","Team A"
"7210591120","15384","22 Jun 2023 09:00","1623","27:03","Team B","iG.Vitality","Bloodseeker  Lich  Beastmaster  Spirit Breaker  Timbersaw","Limit","Vengeful Spirit  Broodmother  Rubick  Slark  Void Spirit","Team A"
"7210821912","15439","22 Jun 2023 01:03","2626","43:46","Team A","9Pandas","Bloodseeker  Windranger  Lich  Enigma  Doom","BetBoom Team","Queen of Pain  Undying  Medusa  Legion Commander  Techies","Team A"
"7210824901","15475","22 Jun 2023 01:00","1324","22:04","Team A","Quest Esports","Bloodseeker  Faceless Void  Shadow Demon  Techies  Snapfire","dota enjoyer","Lich  Queen of Pain  Lycan  Naga Siren  Primal Beast","Team A"
"7210888098","15475","22 Jun 2023 01:54","1139","18:59","Team A","dota enjoyer","Bloodseeker  Lich  Dark Seer  Skywrath Mage  Pangolier","Quest Esports","Juggernaut  Tiny  Shadow Demon  Techies  Mars","Team B"
"7210923542","15439","22 Jun 2023 02:28","3670","1:01:10","Team A","Talon","Bloodseeker  Pugna  Templar Assassin  Batrider  Timbersaw","Team Spirit","Storm Spirit  Undying  Rubick  Slark  Magnus","Team A"
"7211050099","15336","22 Jun 2023 04:02","2302","38:22","Team A","StoRm","Bloodseeker  Puck  Batrider  Shadow Demon  Legion Commander","Team Sexy","Juggernaut  Storm Spirit  Tidehunter  Techies  Monkey King","Team B"
"7211155274","14691","22 Jun 2023 05:05","2820","47:00","Team B","Ancient Tribe","Bloodseeker  Crystal Maiden  Centaur Warrunner  Techies  Ember Spirit","Trouble Makers Reborn","Axe  Lich  Broodmother  Skywrath Mage  Void Spirit","Team A"
"7211268767","15475","22 Jun 2023 06:17","2080","34:40","Team B","Nigma Galaxy","Axe  Bloodseeker  Pugna  Undying  Keeper of the Light","Quest Esports","Juggernaut  Queen of Pain  Disruptor  Timbersaw  Techies","Team A"
"7211537953","14783","22 Jun 2023 10:01","1994","33:14","Team B","Infamous Gaming","Bloodseeker  Lion  Enchantress  Broodmother  Pangolier","The Cut","Clinkz  Spirit Breaker  Disruptor  Bristleback  Legion Commander","Team B"
"7211570260","15439","22 Jun 2023 10:38","1836","30:36","Team B","Gaimin Gladiators","Bloodseeker  Leshrac  Shadow Demon  Disruptor  Timbersaw","Evil Geniuses","Templar Assassin  Dark Seer  Batrider  Spirit Breaker  Silencer","Team B"
"7212229379","15470","23 Jun 2023 01:04","2907","48:27","Team A","Made in Philippines","Bloodseeker  Mirana  Techies  Ember Spirit  Underlord","Myth Avenue Gaming","Morphling  Batrider  Undying  Disruptor  Pangolier","Team A"
"7212315667","15375","23 Jun 2023 02:22","3038","50:38","Team A","IHC","Bloodseeker  Silencer  Shadow Demon  Ember Spirit  Mars","UD VESSUWAN","Storm Spirit  Broodmother  Batrider  Undying  Arc Warden","Team A"
"7212328717","15470","23 Jun 2023 02:26","1605","26:45","Team B","Made in Philippines","Bloodseeker  Queen of Pain  Rubick  Ember Spirit  Underlord","Myth Avenue Gaming","Ancient Apparition  Naga Siren  Techies  Monkey King  Pangolier","Team B"
"7212756212","15475","23 Jun 2023 07:24","2420","40:20","Team A","Team Secret","Bloodseeker  Enigma  Clinkz  Void Spirit  Mars","Nigma Galaxy","Beastmaster  Wraith King  Enchantress  Disruptor  Keeper of the Light","Team B"
"7212941688","15352","23 Jun 2023 09:53","2887","48:07","Team B","LEVEL UP","Bloodseeker  Queen of Pain  Batrider  Undying  Mars","Old G","Juggernaut  Venomancer  Enchantress  Spirit Breaker  Snapfire","Team B"
