"Match ID","League","Start Date","Duration (s)","Duration (mm:ss)","Radiant Team","Team A","Team A Heroes","Team B","Team B Heroes","Winner"
"7213051362","15353","23 Jun 2023 11:55","1689","28:09","Team B","CDUB Esports","Bloodseeker  Spirit Breaker  Shadow Demon  Ember Spirit  Snapfire","Wildcard","Juggernaut  Puck  Beastmaster  Skywrath Mage  Techies","Team B"
"7213656879","14691","24 Jun 2023 12:17","1679","27:59","Team A","RAM SQUAD","Bloodseeker  Queen of Pain  Spirit Breaker  Silencer  Timbersaw","Gen of Miracles","Lich  Broodmother  Shadow Demon  Void Spirit  Mars","Team B"
"7213972408","15439","24 Jun 2023 04:16","3072","51:12","Team A","Gaimin Gladiators","Bloodseeker  Beastmaster  Queen of Pain  Undying  Skywrath Mage","Talon","Lina  Batrider  Spirit Breaker  Abaddon  Elder Titan","Team A"
"7214300096","14783","24 Jun 2023 08:00","2579","42:59","Team A","Vivo Keyd Stars","Bloodseeker  Kunkka  Ancient Apparition  Spirit Breaker  Visage","Lava Esports","Morphling  Templar Assassin  Clockwerk  Broodmother  Snapfire","Team A"
"7215096250","15384","25 Jun 2023 12:00","2503","41:43","Team A","The last dark","Bloodseeker  Necrophos  Broodmother  Spirit Breaker  Snapfire","Team Zero","Tidehunter  Undying  Rubick  Naga Siren  Timbersaw","Team A"
"7215525382","15439","25 Jun 2023 04:54","2683","44:43","Team B","Gaimin Gladiators","Bloodseeker  Beastmaster  Dragon Knight  Undying  Techies","BetBoom Team","Enchantress  Disruptor  Legion Commander  Ember Spirit  Terrorblade","Team A"
"7215645607","15439","25 Jun 2023 06:10","2256","37:36","Team B","Gaimin Gladiators","Bloodseeker  Beastmaster  Leshrac  Undying  Techies","BetBoom Team","Juggernaut  Tidehunter  Lich  Enchantress  Snapfire","Team B"
"7215744447","15439","25 Jun 2023 07:21","1708","28:28","Team B","BetBoom Team","Bloodseeker  Storm Spirit  Lich  Pugna  Legion Commander","Gaimin Gladiators","Mirana  Shadow Fiend  Dragon Knight  Undying  Underlord","Team A"
"7215906831","15439","25 Jun 2023 09:31","2083","34:43","Team A","BetBoom Team","Bloodseeker  Lich  Doom  Techies  Ember Spirit","Gaimin Gladiators","Pugna  Huskar  Broodmother  Undying  Medusa","Team B"
"7216201343","15353","26 Jun 2023 04:07","2264","37:44","Team B","TiltedBoys","Bloodseeker  Windranger  Templar Assassin  Doom  Rubick","American goons","Batrider  Silencer  Medusa  Techies  Pangolier","Team B"
"7216765309","14691","26 Jun 2023 03:11","2038","33:58","Team A","Team Sexy","Bloodseeker  Storm Spirit  Tidehunter  Pugna  Enchantress","Ancient Tribe","Lion  Dark Seer  Undying  Medusa  Timbersaw","Team B"
"7216943673","14691","26 Jun 2023 05:02","1386","23:06","Team B","Hot Headed Gaming","Bloodseeker  Beastmaster  Pugna  Timbersaw  Techies","Gen of Miracles","Clockwerk  Clinkz  Shadow Demon  Monkey King  Mars","Team B"
"7217184825","15336","26 Jun 2023 08:05","1431","23:51","Team B","StoRm","Bloodseeker  Queen of Pain  Broodmother  Disruptor  Techies","Natus Vincere","Axe  Storm Spirit  Weaver  Undying  Keeper of the Light","Team B"
"7217398788","15353","26 Jun 2023 11:16","1787","29:47","Team A","Nexus Titans","Bloodseeker  Faceless Void  Enchantress  Techies  Pangolier","American goons","Mirana  Storm Spirit  Lion  Medusa  Timbersaw","Team B"
"7217792305","15470","27 Jun 2023 10:00","5080","1:24:40","Team A","IHC","Bloodseeker  Doom  Spirit Breaker  Silencer  Pangolier","Geek Slate","Storm Spirit  Pugna  Clockwerk  Dark Seer  Terrorblade","Team B"
"7218701393","15352","27 Jun 2023 10:16","2017","33:37","Team B","Nigma Galaxy","Bloodseeker  Beastmaster  Pugna  Silencer  Outworld Devourer","Alliance","Enigma  Jakiro  Spirit Breaker  Timbersaw  Terrorblade","Team A"
"7218759589","15366","27 Jun 2023 11:08","1651","27:31","Team A","Vivo Keyd Stars","Bloodseeker  Leshrac  Enchantress  Underlord  Dark Willow","Lava Esports","Morphling  Tidehunter  Spirit Breaker  Snapfire  Dawnbreaker","Team A"
"7219046453","15375","28 Jun 2023 07:02","2185","36:25","Team B","Vision","Bloodseeker  Puck  Spirit Breaker  Lycan  Techies","IHC","Juggernaut  Batrider  Shadow Demon  Magnus  Ember Spirit","Team B"
"7219089929","15375","28 Jun 2023 08:08","2067","34:27","Team A","IHC","Bloodseeker  Tiny  Silencer  Dark Willow  Primal Beast","Vision","Storm Spirit  Beastmaster  Pugna  Alchemist  Skywrath Mage","Team A"
"7219419474","15352","28 Jun 2023 02:13","3546","59:06","Team B","Nigma Galaxy","Bloodseeker  Necrophos  Dark Seer  Undying  Techies","LEVEL UP","Mirana  Windranger  Batrider  Naga Siren  Primal Beast","Team B"
"7219677215","14691","28 Jun 2023 05:01","1883","31:23","Team B","Gen of Miracles","Bloodseeker  Pugna  Spirit Breaker  Underlord  Muerta","KZ TEAM","Morphling  Invoker  Undying  Legion Commander  Techies","Team B"
"7220062661","15353","28 Jun 2023 10:00","1312","21:52","Team B","TiltedBoys","Bloodseeker  Lich  Dragon Knight  Timbersaw  Techies","American goons","Storm Spirit  Venomancer  Faceless Void  Pugna  Rubick","Team B"
"7220127112","14783","28 Jun 2023 11:01","1093","18:13","Team B","SAND KING GÓMEZ","Bloodseeker  Lich  Doom  Magnus  Skywrath Mage","Infamous Gaming","Enchantress  Bounty Hunter  Rubick  Terrorblade  Snapfire","Team B"
"7220383275","15438","29 Jun 2023 06:34","1472","24:32","Team A","9Pandas","Bloodseeker  Dark Seer  Elder Titan  Techies  Ember Spirit","Gaimin Gladiators","Lion  Leshrac  Broodmother  Ursa  Io","Team B"
"7220422250","15438","29 Jun 2023 07:31","2505","41:45","Team A","nouns","Bloodseeker  Broodmother  Chen  Timbersaw  Techies","PSG.LGD","Beastmaster  Faceless Void  Keeper of the Light  Skywrath Mage  Snapfire","Team A"
"7220465818","15438","29 Jun 2023 08:34","2936","48:56","Team B","Team Spirit","Bloodseeker  Storm Spirit  Pugna  Disruptor  Mars","Tundra Esports","Lion  Dark Seer  Enchantress  Ursa  Timbersaw","Team A"
"7220562084","15438","29 Jun 2023 10:43","1914","31:54","Team B","BetBoom Team","Bloodseeker  Crystal Maiden  Storm Spirit  Pugna  Underlord","Azure Ray","Enchantress  Alchemist  Skywrath Mage  Legion Commander  Ember Spirit","Team A"
"7220606698","15438","29 Jun 2023 11:40","8199","2:16:39","Team A","Gaimin Gladiators","Bloodseeker  Dark Seer  Chen  Timbersaw  Techies","Quest Esports","Silencer  Shadow Demon  Medusa  Underlord  Snapfire","Team B"
"7220611149","15438","29 Jun 2023 11:42","2495","41:35","Team B","BetBoom Team","Bloodseeker  Dark Seer  Silencer  Shadow Demon  Ember Spirit","Azure Ray","Pugna  Batrider  Naga Siren  Legion Commander  Pangolier","Team B"
"7221672412","15438","30 Jun 2023 04:59","2443","40:43","Team A","Shopify Rebellion","Bloodseeker  Enigma  Tinker  Undying  Techies","Tundra Esports","Morphling  Lion  Tidehunter  Faceless Void  Phoenix","Team B"
"7221887238","15438","30 Jun 2023 10:40","2111","35:11","Team A","BetBoom Team","Bloodseeker  Tidehunter  Lich  Pugna  Ember Spirit","Evil Geniuses","Storm Spirit  Spirit Breaker  Alchemist  Silencer  Snapfire","Team A"
"7222984853","15438","01 Jul 2023 04:00","3002","50:02","Team A","Tundra Esports","Bloodseeker  Tidehunter  Dragon Knight  Skywrath Mage  Snapfire","Blacklist Rivalry","Storm Spirit  Enigma  Pugna  Rubick  Terrorblade","Team A"
"7223052578","15438","01 Jul 2023 05:29","1914","31:54","Team B","Shopify Rebellion","Bloodseeker  Storm Spirit  Silencer  Techies  Underlord","Execration","Pugna  Dark Seer  Skywrath Mage  Abaddon  Ember Spirit","Team B"
"7223093787","15438","01 Jul 2023 06:26","2849","47:29","Team B","BetBoom Team","Bloodseeker  Tidehunter  Lich  Techies  Pangolier","PSG.LGD","Morphling  Storm Spirit  Spirit Breaker  Disruptor  Timbersaw","Team A"
"7224015459","14783","01 Jul 2023 07:14","2577","42:57","Team A","SAND KING GÓMEZ","Bloodseeker  Pugna  Broodmother  Rubick  Snapfire","The Cut","Tidehunter  Lich  Templar Assassin  Techies  Ember Spirit","Team B"
"7224107624","14783","01 Jul 2023 08:23","1513","25:13","Team A","The Cut","Bloodseeker  Tidehunter  Disruptor  Legion Commander  Techies","SAND KING GÓMEZ","Clockwerk  Magnus  Skywrath Mage  Ember Spirit  Muerta","Team B"
"7224523224","15438","02 Jul 2023 05:02","1199","19:59","Team B","Blacklist Rivalry","Bloodseeker  Doom  Skywrath Mage  Void Spirit  Snapfire","Team Aster","Pugna  Luna  Clockwerk  Leshrac  Broodmother","Team B"
"7224587359","15438","02 Jul 2023 06:23","1570","26:10","Team B","PSG.LGD","Bloodseeker  Broodmother  Batrider  Undying  Primal Beast","9Pandas","Templar Assassin  Enchantress  Spirit Breaker  Timbersaw  Legion Commander","Team A"
"7224643004","15438","02 Jul 2023 07:37","2503","41:43","Team B","Gaimin Gladiators","Bloodseeker  Broodmother  Batrider  Techies  Pangolier","nouns","Windranger  Pugna  Brewmaster  Shadow Demon  Naga Siren","Team A"
"7224728114","15438","02 Jul 2023 09:19","2527","42:07","Team A","Team Spirit","Bloodseeker  Silencer  Ember Spirit  Snapfire  Mars","Blacklist Rivalry","Tidehunter  Pugna  Luna  Dragon Knight  Techies","Team A"
"7224766675","15438","02 Jul 2023 09:51","1561","26:01","Team A","Tundra Esports","Bloodseeker  Tiny  Pugna  Medusa  Pangolier","Team Liquid","Phantom Lancer  Shadow Demon  Disruptor  Timbersaw  Mars","Team A"
"7224811817","15438","02 Jul 2023 10:29","3077","51:17","Team B","Team Spirit","Bloodseeker  Zeus  Lich  Batrider  Spirit Breaker","Blacklist Rivalry","Enigma  Clockwerk  Enchantress  Naga Siren  Primal Beast","Team B"
"7225996312","15438","03 Jul 2023 04:00","2517","41:57","Team A","Tundra Esports","Bloodseeker  Razor  Dark Seer  Batrider  Visage","Team Aster","Tidehunter  Leshrac  Undying  Naga Siren  Io","Team A"
"7226039329","15438","03 Jul 2023 05:11","2311","38:31","Team A","Tundra Esports","Bloodseeker  Lich  Enigma  Timbersaw  Snapfire","Team Aster","Leshrac  Batrider  Io  Monkey King  Mars","Team B"
"7226093818","15438","03 Jul 2023 06:42","3816","1:03:36","Team B","PSG.LGD","Bloodseeker  Storm Spirit  Pugna  Batrider  Doom","Quest Esports","Puck  Templar Assassin  Undying  Timbersaw  Snapfire","Team A"
"7226307937","15438","03 Jul 2023 11:55","2079","34:39","Team B","Blacklist Rivalry","Bloodseeker  Lich  Doom  Techies  Monkey King","Shopify Rebellion","Enchantress  Lycan  Skywrath Mage  Ember Spirit  Mars","Team B"
"7228674421","15438","05 Jul 2023 06:24","1998","33:18","Team B","Team Liquid","Bloodseeker  Storm Spirit  Tidehunter  Pugna  Techies","PSG.LGD","Windranger  Enigma  Broodmother  Silencer  Disruptor","Team A"
"7228949897","15058","05 Jul 2023 12:46","2752","45:52","Team A","UD VESSUWAN","Bloodseeker  Storm Spirit  Silencer  Brewmaster  Techies","VIETNAM","Drow Ranger  Beastmaster  Queen of Pain  Pugna  Batrider","Team A"
"7229279142","15438","05 Jul 2023 05:12","2290","38:10","Team A","Team Aster","Bloodseeker  Tidehunter  Leshrac  Batrider  Io","Quest Esports","Puck  Undying  Slark  Medusa  Techies","Team B"
"7229857152","15438","06 Jul 2023 04:00","2648","44:08","Team B","Team Spirit","Bloodseeker  Clockwerk  Dark Seer  Disruptor  Ember Spirit","PSG.LGD","Silencer  Phoenix  Mars  Marci  Primal Beast","Team A"
"7229895052","15438","06 Jul 2023 05:10","2557","42:37","Team A","Team Spirit","Bloodseeker  Razor  Clockwerk  Ember Spirit  Oracle","PSG.LGD","Huskar  Doom  Undying  Naga Siren  Techies","Team B"
"7229968960","15058","06 Jul 2023 07:18","2171","36:11","Team A","Gengar","Bloodseeker  Earthshaker  Mirana  Beastmaster  Ember Spirit","Vision","Morphling  Undying  Rubick  Underlord  Snapfire","Team A"
"7230015154","15058","06 Jul 2023 08:39","2311","38:31","Team A","Gengar","Bloodseeker  Lich  Broodmother  Rubick  Ember Spirit","Vision","Mirana  Dragon Knight  Spirit Breaker  Naga Siren  Techies","Team A"
"7230113893","15058","06 Jul 2023 10:54","2874","47:54","Team B","VIETNAM","Bloodseeker  Enigma  Enchantress  Spirit Breaker  Snapfire","Manta Esports","Queen of Pain  Disruptor  Naga Siren  Timbersaw  Techies","Team A"
"7230174706","15058","06 Jul 2023 12:05","2396","39:56","Team A","Manta Esports","Bloodseeker  Doom  Medusa  Techies  Ember Spirit","VIETNAM","Storm Spirit  Tidehunter  Pugna  Shadow Demon  Slark","Team B"
"7230293729","15438","06 Jul 2023 02:10","3141","52:21","Team A","Azure Ray","Bloodseeker  Puck  Tiny  Enigma  Pugna","BetBoom Team","Morphling  Templar Assassin  Clockwerk  Broodmother  Techies","Team A"
"7231262263","15058","07 Jul 2023 08:22","1680","28:00","Team B","Neon Esports","Bloodseeker  Templar Assassin  Dark Seer  Spirit Breaker  Rubick","Gengar","Lich  Faceless Void  Broodmother  Batrider  Snapfire","Team B"
"7231294937","15058","07 Jul 2023 09:12","2314","38:34","Team B","Yangon Galacticos","Bloodseeker  Lion  Tidehunter  Leshrac  Snapfire","UD VESSUWAN","Morphling  Storm Spirit  Batrider  Lycan  Rubick","Team A"
"7231514394","15438","07 Jul 2023 01:21","2770","46:10","Team A","Team Liquid","Bloodseeker  Necrophos  Pugna  Undying  Ember Spirit","Tundra Esports","Tiny  Dark Seer  Broodmother  Meepo  Visage","Team B"
"7231736314","15438","07 Jul 2023 04:16","1727","28:47","Team A","Gaimin Gladiators","Bloodseeker  Queen of Pain  Pugna  Doom  Snapfire","Quest Esports","Juggernaut  Tiny  Shadow Demon  Rubick  Timbersaw","Team B"
"7232498660","15438","08 Jul 2023 05:02","1402","23:22","Team A","Team Liquid","Bloodseeker  Tiny  Death Prophet  Silencer  Visage","9Pandas","Morphling  Templar Assassin  Dark Seer  Spirit Breaker  Rubick","Team A"
"7232833846","15438","08 Jul 2023 11:17","2062","34:22","Team A","Tundra Esports","Bloodseeker  Batrider  Spirit Breaker  Techies  Arc Warden","Gaimin Gladiators","Juggernaut  Windranger  Lion  Enchantress  Broodmother","Team B"
"7233761491","14783","08 Jul 2023 10:57","2567","42:47","Team B","Thunder Awaken","Bloodseeker  Broodmother  Undying  Medusa  Primal Beast","noMERCY","Pugna  Dark Seer  Alchemist  Shadow Demon  Pangolier","Team A"
"7234007802","15438","09 Jul 2023 05:00","2588","43:08","Team A","Team Liquid","Bloodseeker  Windranger  Leshrac  Io  Timbersaw","Tundra Esports","Sniper  Enchantress  Doom  Ursa  Rubick","Team A"
"7235226282","14783","09 Jul 2023 09:33","1791","29:51","Team A","Vivo Keyd Stars","Bloodseeker  Storm Spirit  Lion  Enchantress  Doom","noMERCY","Earthshaker  Morphling  Puck  Pugna  Underlord","Team B"
"7237988811","14783","11 Jul 2023 11:05","2507","41:47","Team A","Thunder Awaken","Bloodseeker  Lich  Leshrac  Enchantress  Doom","NoPing Esports","Beastmaster  Queen of Pain  Undying  Techies  Terrorblade","Team A"
"7247972025","15475","19 Jul 2023 11:00","1491","24:51","Team A","Xtreme Gaming","Bloodseeker  Batrider  Magnus  Ember Spirit  Dark Willow","9Pandas","Enigma  Broodmother  Doom  Spirit Breaker  Oracle","Team B"
"7248020937","15475","19 Jul 2023 11:57","2087","34:47","Team A","Xtreme Gaming","Bloodseeker  Storm Spirit  Shadow Demon  Snapfire  Mars","9Pandas","Windranger  Lion  Alchemist  Lycan  Undying","Team B"
"7248039044","15475","19 Jul 2023 12:17","2382","39:42","Team B","Team Secret","Bloodseeker  Tidehunter  Chen  Monkey King  Snapfire","beastcoast","Axe  Sven  Clinkz  Timbersaw  Phoenix","Team A"
"7248538199","15475","19 Jul 2023 06:37","2168","36:08","Team B","Xtreme Gaming","Bloodseeker  Storm Spirit  Venomancer  Silencer  Mars","beastcoast","Clockwerk  Dark Seer  Batrider  Disruptor  Terrorblade","Team A"
"7248630757","15475","19 Jul 2023 07:55","2252","37:32","Team B","Xtreme Gaming","Bloodseeker  Pudge  Elder Titan  Ember Spirit  Snapfire","Quest Esports","Templar Assassin  Broodmother  Silencer  Rubick  Pangolier","Team A"
"7248654234","15475","19 Jul 2023 08:19","2472","41:12","Team B","TSM","Bloodseeker  Lich  Rubick  Visage  Snapfire","Team Liquid","Crystal Maiden  Templar Assassin  Timbersaw  Oracle  Monkey King","Team B"
"7248721077","15475","19 Jul 2023 09:20","2709","45:09","Team A","Team Secret","Bloodseeker  Rubick  Visage  Timbersaw  Monkey King","OG","Enigma  Venomancer  Templar Assassin  Clockwerk  Snapfire","Team B"
"7249315898","15475","20 Jul 2023 12:06","2071","34:31","Team A","Team Aster","Bloodseeker  Clockwerk  Broodmother  Outworld Devourer  Rubick","Team Liquid","Pudge  Enigma  Meepo  Techies  Mars","Team A"
"7249462665","15475","20 Jul 2023 02:36","2119","35:19","Team A","Team Secret","Bloodseeker  Lion  Chen  Timbersaw  Snapfire","9Pandas","Juggernaut  Clinkz  Doom  Shadow Demon  Rubick","Team B"
"7249735049","15475","20 Jul 2023 05:49","1776","29:36","Team B","Entity","Bloodseeker  Windranger  Clockwerk  Invoker  Disruptor","OG","Puck  Spirit Breaker  Rubick  Naga Siren  Keeper of the Light","Team B"
"7249839727","15475","20 Jul 2023 07:05","2829","47:09","Team A","Team Secret","Bloodseeker  Tiny  Venomancer  Dark Seer  Snapfire","Execration","Lion  Beastmaster  Faceless Void  Batrider  Elder Titan","Team B"
"7249933319","15475","20 Jul 2023 08:33","2236","37:16","Team A","Execration","Bloodseeker  Puck  Broodmother  Rubick  Elder Titan","Team Secret","Earthshaker  Enigma  Spirit Breaker  Naga Siren  Snapfire","Team B"
"7250010833","15475","20 Jul 2023 09:43","2237","37:17","Team A","Team Secret","Bloodseeker  Crystal Maiden  Batrider  Timbersaw  Snapfire","Execration","Templar Assassin  Dark Seer  Jakiro  Rubick  Monkey King","Team A"
"7250539605","15475","21 Jul 2023 11:00","2385","39:45","Team A","PSG.LGD","Bloodseeker  Lina  Batrider  Doom  Elder Titan","OG","Templar Assassin  Spirit Breaker  Timbersaw  Phoenix  Dark Willow","Team A"
"7250606256","15475","21 Jul 2023 12:26","2840","47:20","Team A","Team Spirit","Bloodseeker  Rubick  Winter Wyvern  Snapfire  Mars","Gaimin Gladiators","Lion  Beastmaster  Templar Assassin  Lifestealer  Enchantress","Team A"
"7250740268","15475","21 Jul 2023 02:34","1844","30:44","Team B","TSM","Bloodseeker  Broodmother  Shadow Demon  Rubick  Pangolier","Shopify Rebellion","Leshrac  Naga Siren  Io  Skywrath Mage  Legion Commander","Team B"
"7251243036","15475","21 Jul 2023 08:37","2522","42:02","Team B","BetBoom Team","Bloodseeker  Puck  Lich  Pugna  Doom","Shopify Rebellion","Beastmaster  Undying  Rubick  Medusa  Mars","Team A"
"7251927063","15475","22 Jul 2023 11:00","2525","42:05","Team B","Xtreme Gaming","Bloodseeker  Venomancer  Visage  Elder Titan  Ember Spirit","PSG.LGD","Lina  Clockwerk  Lifestealer  Undying  Timbersaw","Team A"
"7251929921","15475","22 Jul 2023 11:00","2131","35:31","Team B","Team Spirit","Bloodseeker  Queen of Pain  Silencer  Shadow Demon  Mars","Quest Esports","Phantom Lancer  Tidehunter  Enchantress  Rubick  Primal Beast","Team B"
"7251995865","15475","22 Jul 2023 12:10","2342","39:02","Team A","Team Spirit","Bloodseeker  Lion  Timbersaw  Oracle  Pangolier","Quest Esports","Mirana  Luna  Undying  Snapfire  Mars","Team B"
"7252001940","15475","22 Jul 2023 12:13","3008","50:08","Team B","Xtreme Gaming","Bloodseeker  Storm Spirit  Silencer  Skywrath Mage  Legion Commander","PSG.LGD","Dragon Knight  Enchantress  Disruptor  Medusa  Timbersaw","Team A"
"7252089037","15475","22 Jul 2023 01:33","2346","39:06","Team B","Team Aster","Bloodseeker  Tidehunter  Spirit Breaker  Winter Wyvern  Snapfire","Talon","Enchantress  Silencer  Meepo  Terrorblade  Primal Beast","Team A"
"7252197438","15475","22 Jul 2023 02:58","1508","25:08","Team B","TSM","Bloodseeker  Storm Spirit  Tidehunter  Io  Techies","Team Secret","Tiny  Lifestealer  Enchantress  Batrider  Primal Beast","Team B"
"7252253367","15475","22 Jul 2023 03:27","2606","43:26","Team B","Tundra Esports","Bloodseeker  Vengeful Spirit  Enchantress  Underlord  Pangolier","Shopify Rebellion","Templar Assassin  Leshrac  Io  Skywrath Mage  Legion Commander","Team B"
"7252308976","15475","22 Jul 2023 04:15","1867","31:07","Team A","Xtreme Gaming","Bloodseeker  Meepo  Skywrath Mage  Elder Titan  Ember Spirit","9Pandas","Juggernaut  Vengeful Spirit  Windranger  Enigma  Doom","Team A"
"7252626819","15475","22 Jul 2023 07:57","1906","31:46","Team A","Tundra Esports","Bloodseeker  Leshrac  Dark Seer  Io  Visage","Team Aster","Clockwerk  Rubick  Legion Commander  Monkey King  Snapfire","Team B"
"7252732224","15475","22 Jul 2023 09:28","1483","24:43","Team A","TSM","Bloodseeker  Storm Spirit  Silencer  Rubick  Underlord","Talon","Templar Assassin  Dark Seer  Batrider  Medusa  Elder Titan","Team B"
"7253931818","15475","23 Jul 2023 05:22","2448","40:48","Team B","Xtreme Gaming","Bloodseeker  Puck  Enigma  Doom  Silencer","Team Spirit","Faceless Void  Ancient Apparition  Timbersaw  Tusk  Ember Spirit","Team B"
"7255010550","15475","24 Jul 2023 02:46","2987","49:47","Team A","Team Secret","Bloodseeker  Enigma  Venomancer  Templar Assassin  Bounty Hunter","Tundra Esports","Broodmother  Chen  Terrorblade  Arc Warden  Snapfire","Team A"
"7255208670","15475","24 Jul 2023 04:58","2231","37:11","Team A","Evil Geniuses","Bloodseeker  Storm Spirit  Enchantress  Spirit Breaker  Timbersaw","9Pandas","Juggernaut  Witch Doctor  Broodmother  Batrider  Doom","Team B"
"7255260268","15534","24 Jul 2023 05:27","2847","47:27","Team A","HYDRA","Bloodseeker  Lich  Spirit Breaker  Pangolier  Snapfire","Infamous Gaming","Beastmaster  Venomancer  Rubick  Underlord  Monkey King","Team A"
"7255412458","15475","24 Jul 2023 07:38","2148","35:48","Team B","Tundra Esports","Bloodseeker  Enchantress  Broodmother  Batrider  Pangolier","Shopify Rebellion","Mirana  Tidehunter  Venomancer  Terrorblade  Snapfire","Team A"
"7256390936","15534","25 Jul 2023 03:48","1773","29:33","Team B","Neon Esports","Bloodseeker  Storm Spirit  Clockwerk  Silencer  Visage","One Move","Templar Assassin  Dark Seer  Batrider  Disruptor  Monkey King","Team B"
"7258005870","15475","26 Jul 2023 07:40","2574","42:54","Team A","Evil Geniuses","Bloodseeker  Enigma  Ancient Apparition  Snapfire  Primal Beast","Team Aster","Windranger  Lion  Dark Seer  Shadow Demon  Monkey King","Team B"
"7259078113","15534","27 Jul 2023 04:33","3500","58:20","Team A","HYDRA","Bloodseeker  Pugna  Templar Assassin  Clockwerk  Timbersaw","One Move","Storm Spirit  Lich  Naga Siren  Skywrath Mage  Underlord","Team A"
"7259645183","14783","28 Jul 2023 01:28","2699","44:59","Team A","x5 Gaming","Bloodseeker  Enigma  Ember Spirit  Phoenix  Primal Beast","Mad Kings Esports","Clockwerk  Alchemist  Shadow Demon  Rubick  Mars","Team A"
"7260418930","15475","28 Jul 2023 04:48","2112","35:12","Team A","Team Aster","Bloodseeker  Windranger  Batrider  Timbersaw  Elder Titan","9Pandas","Doom  Lycan  Meepo  Rubick  Oracle","Team A"
"7261279634","15058","29 Jul 2023 07:30","2248","37:28","Team A","Gengar","Bloodseeker  Lich  Ember Spirit  Snapfire  Mars","Yangon Galacticos","Lion  Beastmaster  Leshrac  Terrorblade  Oracle","Team B"
"7261513228","15475","29 Jul 2023 09:25","3685","1:01:25","Team B","9Pandas","Bloodseeker  Enigma  Doom  Invoker  Oracle","Talon","Windranger  Batrider  Rubick  Medusa  Legion Commander","Team B"
"7262210509","15475","29 Jul 2023 06:30","3045","50:45","Team A","Gaimin Gladiators","Bloodseeker  Tidehunter  Leshrac  Disruptor  Io","Talon","Razor  Undying  Keeper of the Light  Ember Spirit  Terrorblade","Team B"
"7262456668","14783","30 Jul 2023 12:09","1635","27:15","Team A","old schooL","Bloodseeker  Zeus  Spirit Breaker  Skywrath Mage  Dawnbreaker","AcatSuki","Juggernaut  Tiny  Shadow Demon  Timbersaw  Underlord","Team B"
"7262860877","15058","30 Jul 2023 09:06","1169","19:29","Team A","Gengar","Bloodseeker  Earthshaker  Queen of Pain  Silencer  Underlord","Neon Esports","Clockwerk  Dark Seer  Medusa  Skywrath Mage  Ember Spirit","Team B"
"7263702415","15475","30 Jul 2023 05:21","2793","46:33","Team B","Team Liquid","Bloodseeker  Tiny  Leshrac  Io  Visage","Team Spirit","Windranger  Dark Seer  Ancient Apparition  Troll Warlord  Tusk","Team B"
"7264663184","15472","31 Jul 2023 02:35","2857","47:37","Team A","Army Geniuses Mansion","Bloodseeker  Lion  Templar Assassin  Undying  Timbersaw","IHC","Venomancer  Shadow Demon  Slark  Snapfire  Primal Beast","Team B"
"7266522889","14783","01 Aug 2023 08:33","1780","29:40","Team A","Old School","Bloodseeker  Queen of Pain  Spirit Breaker  Rubick  Techies","Universitario eSports","Windranger  Enchantress  Naga Siren  Skywrath Mage  Mars","Team B"
"7267135759","15472","02 Aug 2023 10:59","1690","28:10","Team B","Made in Philippines","Bloodseeker  Dazzle  Batrider  Lycan  Snapfire","Vision","Queen of Pain  Clockwerk  Dark Seer  Rubick  Naga Siren","Team B"
"7267179189","15472","02 Aug 2023 11:57","2628","43:48","Team A","Made in Philippines","Bloodseeker  Visage  Skywrath Mage  Legion Commander  Snapfire","Vision","Windranger  Faceless Void  Dark Seer  Rubick  Elder Titan","Team B"
"7267355921","15472","02 Aug 2023 02:29","2857","47:37","Team A","IHC","Bloodseeker  Silencer  Shadow Demon  Timbersaw  Legion Commander","UD VESSUWAN","Lion  Lycan  Undying  Naga Siren  Ember Spirit","Team A"
"7267736696","14691","02 Aug 2023 06:50","1730","28:50","Team A","RAM SQUAD","Bloodseeker  Earthshaker  Queen of Pain  Clockwerk  Shadow Demon","Sibe Team","Faceless Void  Dark Seer  Clinkz  Batrider  Spirit Breaker","Team A"
"7268537049","15472","03 Aug 2023 12:04","2186","36:26","Team A","UD VESSUWAN","Bloodseeker  Templar Assassin  Batrider  Skywrath Mage  Legion Commander","Neon Esports","Dragon Knight  Lifestealer  Rubick  Ember Spirit  Snapfire","Team A"
"7268609847","15472","03 Aug 2023 01:10","2851","47:31","Team A","SPAWN Team","Bloodseeker  Necrophos  Silencer  Tusk  Snapfire","Vision","Windranger  Rubick  Disruptor  Naga Siren  Timbersaw","Team A"
"7268709975","15472","03 Aug 2023 02:29","1604","26:44","Team B","SPAWN Team","Bane  Bloodseeker  Tidehunter  Sniper  Rubick","Vision","Drow Ranger  Clockwerk  Legion Commander  Phoenix  Snapfire","Team A"
"7268859931","14691","03 Aug 2023 04:17","2149","35:49","Team A","Moneymakers","Bloodseeker  Dragon Knight  Shadow Demon  Naga Siren  Snapfire","Sibe Team","Puck  Sven  Pugna  Enchantress  Pangolier","Team B"
"7269822893","15472","04 Aug 2023 10:49","1788","29:48","Team A","IHC","Bloodseeker  Batrider  Spirit Breaker  Oracle  Pangolier","Neon Esports","Queen of Pain  Rubick  Medusa  Legion Commander  Techies","Team A"
