"Match ID","League","Start Date","Duration (s)","Duration (mm:ss)","Radiant Team","Team A","Team A Heroes","Team B","Team B Heroes","Winner"
"7168594573","15374","24 May 2023 08:04","2557","42:37","Team A","Execration","Omniknight  Disruptor  Keeper of the Light  Terrorblade  Pangolier","Army Geniuses Mansion","Venomancer  Pugna  Spirit Breaker  Ember Spirit  Arc Warden","Team B"
"7168686447","15377","24 May 2023 10:01","1816","30:16","Team B","Neon Esports","Night Stalker  Alchemist  Disruptor  Ember Spirit  Dark Willow","TeamKicked","Pugna  Spirit Breaker  Silencer  Terrorblade  Void Spirit","Team B"
"7168845594","15374","24 May 2023 01:00","3987","1:06:27","Team B","BOOM Esports","Phantom Lancer  Batrider  Disruptor  Keeper of the Light  Pangolier","BLEED","Windranger  Beastmaster  Queen of Pain  Silencer  Naga Siren","Team B"
"7169626992","15348","24 May 2023 10:02","2508","41:48","Team B","GateKept","Morphling  Disruptor  Legion Commander  Techies  Void Spirit","Fart Studios","Dragon Knight  Clockwerk  Clinkz  Batrider  Pangolier","Team B"
"7170284401","15335","25 May 2023 01:03","2795","46:35","Team A","BetBoom Team","Enchantress  Chaos Knight  Disruptor  Magnus  Pangolier","One Move","Queen of Pain  Lifestealer  Spirit Breaker  Techies  Phoenix","Team A"
"7170383000","15335","25 May 2023 02:17","2422","40:22","Team B","BetBoom Team","Juggernaut  Storm Spirit  Pugna  Disruptor  Underlord","One Move","Brewmaster  Undying  Naga Siren  Techies  Ember Spirit","Team A"
"7170836179","15365","25 May 2023 07:00","2524","42:04","Team B","Balrogs Esports™","Ursa  Rubick  Disruptor  Pangolier  Mars","INFINITY","Sven  Dark Seer  Bounty Hunter  Techies  Ember Spirit","Team B"
"7170938464","15365","25 May 2023 08:12","2384","39:44","Team B","INFINITY","Phantom Assassin  Spirit Breaker  Disruptor  Visage  Void Spirit","Balrogs Esports™","Medusa  Techies  Oracle  Monkey King  Mars","Team A"
"7170990358","15364","25 May 2023 08:58","2500","41:40","Team A","Block Roar Esports","Bloodseeker  Death Prophet  Disruptor  Magnus  Skywrath Mage","Chandogs","Queen of Pain  Pugna  Bounty Hunter  Visage  Slark","Team A"
"7171251472","15365","26 May 2023 02:18","1663","27:43","Team B","beastcoast","Disruptor  Magnus  Timbersaw  Skywrath Mage  Pangolier","Thunder Awaken","Sven  Doom  Rubick  Winter Wyvern  Void Spirit","Team A"
"7172840053","15350","27 May 2023 04:12","2895","48:15","Team B","ALPHA","Shadow Fiend  Storm Spirit  Beastmaster  Disruptor  Skywrath Mage","DogChamp","Bloodseeker  Lich  Leshrac  Clinkz  Doom","Team A"
"7172899103","15350","27 May 2023 05:29","2193","36:33","Team B","ALPHA","Bloodseeker  Disruptor  Timbersaw  Techies  Underlord","DogChamp","Doom  Magnus  Phoenix  Oracle  Void Spirit","Team B"
"7173572232","15335","27 May 2023 03:08","2643","44:03","Team B","Nemiga Gaming","Puck  Lifestealer  Dark Seer  Batrider  Disruptor","Team Spirit","Storm Spirit  Sven  Shadow Demon  Magnus  Techies","Team B"
"7173990888","15286","27 May 2023 07:00","2164","36:04","Team A","Balrogs Esports™","Windranger  Batrider  Spirit Breaker  Disruptor  Keeper of the Light","RAM SQUAD","Venomancer  Rubick  Medusa  Magnus  Pangolier","Team B"
"7174243062","15350","27 May 2023 10:04","2024","33:44","Team A","nouns","Morphling  Omniknight  Ogre Magi  Disruptor  Keeper of the Light","felt","Windranger  Batrider  Spirit Breaker  Naga Siren  Void Spirit","Team A"
"7174554043","15350","28 May 2023 04:37","2070","34:30","Team B","ALPHA","Shadow Fiend  Puck  Beastmaster  Rubick  Disruptor","B8","Queen of Pain  Clinkz  Magnus  Techies  Monkey King","Team B"
"7175202344","15286","28 May 2023 02:01","1431","23:51","Team A","nouns","Enchantress  Bounty Hunter  Disruptor  Magnus  Terrorblade","Gen of Miracles","Doom  Slark  Legion Commander  Techies  Oracle","Team A"
"7175325856","15383","28 May 2023 03:09","1703","28:23","Team B","Xtreme Gaming","Phantom Lancer  Windranger  Death Prophet  Spirit Breaker  Disruptor","Team Aster","Storm Spirit  Silencer  Io  Slark  Mars","Team B"
"7175974137","15365","28 May 2023 10:30","1337","22:17","Team A","INFINITY","Shadow Fiend  Sven  Dark Seer  Spirit Breaker  Disruptor","Mad Kings Esports","Puck  Death Prophet  Shadow Demon  Earth Spirit  Void Spirit","Team A"
"7176037225","15365","28 May 2023 11:17","2506","41:46","Team B","INFINITY","Templar Assassin  Batrider  Spirit Breaker  Disruptor  Visage","Mad Kings Esports","Bloodseeker  Doom  Invoker  Silencer  Dark Willow","Team A"
"7176524600","15374","29 May 2023 11:07","2159","35:59","Team B","BLEED","Alchemist  Disruptor  Magnus  Dark Willow  Pangolier","Blacklist Rivalry","Templar Assassin  Enchantress  Doom  Techies  Ember Spirit","Team B"
"7176911092","15351","29 May 2023 04:00","2340","39:00","Team B","Team Liquid","Faceless Void  Pugna  Disruptor  Medusa  Void Spirit","Tundra Esports","Bloodseeker  Lich  Enigma  Batrider  Timbersaw","Team A"
"7177023592","15351","29 May 2023 05:10","3465","57:45","Team B","Team Liquid","Bloodseeker  Queen of Pain  Spirit Breaker  Disruptor  Medusa","Tundra Esports","Faceless Void  Batrider  Slark  Techies  Dark Willow","Team B"
"7177172840","15351","29 May 2023 06:45","1558","25:58","Team B","Gaimin Gladiators","Beastmaster  Enchantress  Disruptor  Magnus  Void Spirit","OG","Tiny  Batrider  Slark  Abaddon  Techies","Team A"
"7177315467","14691","29 May 2023 08:35","1933","32:13","Team A","RAM SQUAD","Rubick  Disruptor  Magnus  Ember Spirit  Monkey King","Gen of Miracles","Tidehunter  Undying  Terrorblade  Dark Willow  Muerta","Team A"
"7177482884","15269","29 May 2023 10:49","1555","25:55","Team A","x5 Gaming","Windranger  Beastmaster  Venomancer  Disruptor  Monkey King","Balrogs Esports™","Shadow Fiend  Lich  Wraith King  Death Prophet  Spirit Breaker","Team A"
"7177574245","15269","30 May 2023 01:00","2808","46:48","Team A","Acatsuki","Tidehunter  Disruptor  Techies  Ember Spirit  Terrorblade","Lava Esports","Juggernaut  Silencer  Lycan  Keeper of the Light  Pangolier","Team B"
"7178090117","15335","30 May 2023 01:00","1897","31:37","Team A","UALEIKUMNIHAO","Puck  Sven  Doom  Rubick  Disruptor","Virtus.pro","Storm Spirit  Pugna  Alchemist  Timbersaw  Techies","Team B"
"7178353007","15335","30 May 2023 04:00","2302","38:22","Team A","BetBoom Team","Enchantress  Chaos Knight  Disruptor  Magnus  Void Spirit","Team Spirit","Tidehunter  Lich  Batrider  Troll Warlord  Techies","Team B"
"7178358152","15286","30 May 2023 04:00","1746","29:06","Team B","KZ TEAM","Disruptor  Keeper of the Light  Legion Commander  Ember Spirit  Terrorblade","SIBE team","Bloodseeker  Lich  Dark Willow  Pangolier  Muerta","Team A"
"7178746725","14691","30 May 2023 08:16","2566","42:46","Team B","nouns","Bloodseeker  Omniknight  Batrider  Doom  Disruptor","IVY","Crystal Maiden  Windranger  Timbersaw  Techies  Void Spirit","Team B"
"7178866775","15365","30 May 2023 09:59","1445","24:05","Team A","Thunder Awaken","Mirana  Beastmaster  Disruptor  Medusa  Pangolier","Acatsuki","Templar Assassin  Batrider  Doom  Undying  Tusk","Team A"
"7178868041","15269","30 May 2023 10:00","1609","26:49","Team A","Universitario eSports","Juggernaut  Beastmaster  Templar Assassin  Rubick  Disruptor","x5 Gaming","Witch Doctor  Magnus  Bristleback  Dark Willow  Void Spirit","Team B"
"7178919514","15365","30 May 2023 10:49","2256","37:36","Team B","Thunder Awaken","Windranger  Spirit Breaker  Disruptor  Naga Siren  Ember Spirit","Acatsuki","Bloodseeker  Venomancer  Doom  Skywrath Mage  Pangolier","Team A"
"7178925011","15269","30 May 2023 10:55","2267","37:47","Team A","x5 Gaming","Bane  Juggernaut  Spirit Breaker  Disruptor  Ember Spirit","Universitario eSports","Clinkz  Silencer  Medusa  Underlord  Void Spirit","Team A"
"7179006125","15365","31 May 2023 12:58","1248","20:48","Team A","beastcoast","Beastmaster  Clockwerk  Disruptor  Medusa  Ember Spirit","Balrogs Esports™","Clinkz  Doom  Timbersaw  Techies  Terrorblade","Team A"
"7179074431","15365","31 May 2023 03:10","1798","29:58","Team A","Balrogs Esports™","Witch Doctor  Spirit Breaker  Disruptor  Troll Warlord  Legion Commander","beastcoast","Morphling  Necrophos  Batrider  Alchemist  Tusk","Team B"
"7179267187","15374","31 May 2023 08:18","2092","34:52","Team B","Execration","Templar Assassin  Alchemist  Rubick  Disruptor  Underlord","Team SMG","Bloodseeker  Lich  Lone Druid  Techies  Pangolier","Team A"
"7180038252","15286","31 May 2023 06:40","2217","36:57","Team A","Alliance","Venomancer  Doom  Disruptor  Terrorblade  Void Spirit","RAM SQUAD","Queen of Pain  Batrider  Spirit Breaker  Naga Siren  Snapfire","Team B"
"7180222463","14691","31 May 2023 09:00","2554","42:34","Team B","UALEIKUMNIHAO","Storm Spirit  Pugna  Doom  Disruptor  Terrorblade","RAM SQUAD","Pudge  Riki  Undying  Medusa  Techies","Team A"
"7180291615","15269","31 May 2023 10:00","2130","35:30","Team B","Acatsuki","Shadow Fiend  Enchantress  Disruptor  Magnus  Legion Commander","noMERCY","Bloodseeker  Lich  Beastmaster  Batrider  Timbersaw","Team A"
"7180429643","15269","01 Jun 2023 01:00","1873","31:13","Team B","Balrogs Esports™","Death Prophet  Pugna  Templar Assassin  Clockwerk  Disruptor","Universitario eSports","Doom  Undying  Rubick  Magnus  Timbersaw","Team A"
"7180463677","15269","01 Jun 2023 02:02","2332","38:52","Team A","Balrogs Esports™","Clockwerk  Dark Seer  Disruptor  Magnus  Mars","Universitario eSports","Bloodseeker  Crystal Maiden  Tidehunter  Batrider  Spirit Breaker","Team A"
"7181035258","15335","01 Jun 2023 02:14","1905","31:45","Team A","HYDRA","Spirit Breaker  Disruptor  Visage  Medusa  Void Spirit","9Pandas","Lich  Naga Siren  Magnus  Timbersaw  Techies","Team B"
"7181117627","15286","01 Jun 2023 03:07","2332","38:52","Team B","ITB.Shuffle","Tinker  Dark Seer  Disruptor  Techies  Monkey King","nouns","Crystal Maiden  Sven  Keeper of the Light  Timbersaw  Primal Beast","Team B"
"7181627990","14691","01 Jun 2023 08:55","2865","47:45","Team A","UALEIKUMNIHAO","Storm Spirit  Viper  Spirit Breaker  Disruptor  Medusa","nouns","Earthshaker  Shadow Demon  Timbersaw  Techies  Ember Spirit","Team B"
"7181697009","15365","01 Jun 2023 09:59","2132","35:32","Team B","Acatsuki","Storm Spirit  Tidehunter  Disruptor  Keeper of the Light  Slark","Infamous Gaming","Crystal Maiden  Treant Protector  Magnus  Void Spirit  Muerta","Team B"
"7181875405","15269","02 Jun 2023 01:59","875","14:35","Team B","Balrogs Esports™","Phantom Lancer  Dark Seer  Disruptor  Oracle  Monkey King","Thunder Awaken","Venomancer  Batrider  Lone Druid  Techies  Terrorblade","Team B"
"7182345867","15374","02 Jun 2023 01:00","2249","37:29","Team A","Execration","Morphling  Shadow Demon  Disruptor  Underlord  Pangolier","Talon","Dark Seer  Silencer  Medusa  Techies  Void Spirit","Team A"
"7182424959","15286","02 Jun 2023 02:04","1800","30:00","Team A","Nemiga Gaming","Disruptor  Magnus  Skywrath Mage  Pangolier  Void Spirit","RAM SQUAD","Morphling  Puck  Venomancer  Pugna  Spirit Breaker","Team A"
"7182590939","15286","02 Jun 2023 04:00","2921","48:41","Team B","Moneymakers","Windranger  Sniper  Beastmaster  Templar Assassin  Disruptor","Virtus.pro","Bloodseeker  Queen of Pain  Enchantress  Doom  Techies","Team B"
"7182603586","14691","02 Jun 2023 04:04","2743","45:43","Team A","nouns","Morphling  Doom  Disruptor  Timbersaw  Skywrath Mage","KZ TEAM","Death Prophet  Ursa  Undying  Magnus  Techies","Team B"
"7182728678","15286","02 Jun 2023 05:15","1108","18:28","Team A","Moneymakers","Faceless Void  Pugna  Disruptor  Magnus  Timbersaw","Virtus.pro","Mirana  Spirit Breaker  Silencer  Monkey King  Void Spirit","Team B"
"7183009152","15351","02 Jun 2023 08:28","1836","30:36","Team A","OG","Bloodseeker  Batrider  Disruptor  Phoenix  Arc Warden","Entity","Phantom Lancer  Pugna  Dark Seer  Techies  Ember Spirit","Team A"
"7183123709","15269","02 Jun 2023 10:00","1789","29:49","Team B","Thunder Awaken","Disruptor  Timbersaw  Monkey King  Dark Willow  Mars","x5 Gaming","Bane  Windranger  Doom  Bristleback  Techies","Team A"
"7183235162","15350","02 Jun 2023 11:55","1440","24:00","Team A","ALPHA","Juggernaut  Undying  Disruptor  Magnus  Void Spirit","felt","Lich  Doom  Timbersaw  Techies  Terrorblade","Team B"
"7183541259","15383","03 Jun 2023 07:17","2960","49:20","Team A","Team Bright","Phantom Lancer  Spirit Breaker  Disruptor  Skywrath Mage  Void Spirit","Aster.Aries","Shadow Demon  Legion Commander  Techies  Ember Spirit  Terrorblade","Team B"
"7183706039","15383","03 Jun 2023 10:05","2748","45:48","Team B","Team Aster","Puck  Beastmaster  Clinkz  Disruptor  Medusa","INVICTUS GAMING","Dragon Knight  Enchantress  Batrider  Timbersaw  Terrorblade","Team A"
"7183908466","15335","03 Jun 2023 01:00","2339","38:59","Team A","Nemiga Gaming","Dark Seer  Batrider  Disruptor  Medusa  Timbersaw","Virtus.pro","Juggernaut  Queen of Pain  Spirit Breaker  Shadow Demon  Underlord","Team A"
"7184012668","15286","03 Jun 2023 02:19","2304","38:24","Team A","Ancient Tribe","Bloodseeker  Viper  Disruptor  Legion Commander  Techies","cybercats","Phantom Lancer  Windranger  Enchantress  Batrider  Magnus","Team B"
"7184215579","15335","03 Jun 2023 04:25","1390","23:10","Team B","BetBoom Team","Pugna  Doom  Disruptor  Troll Warlord  Void Spirit","UALEIKUMNIHAO","Sven  Beastmaster  Rubick  Techies  Pangolier","Team A"
"7184294220","15335","03 Jun 2023 05:12","1763","29:23","Team B","UALEIKUMNIHAO","Bloodseeker  Clinkz  Huskar  Broodmother  Disruptor","BetBoom Team","Crystal Maiden  Pudge  Enchantress  Medusa  Ember Spirit","Team B"
"7184715889","15269","03 Jun 2023 10:00","1900","31:40","Team B","Thunder Awaken","Windranger  Disruptor  Keeper of the Light  Monkey King  Pangolier","Universitario eSports","Crystal Maiden  Doom  Rubick  Medusa  Snapfire","Team A"
"7184892937","15269","04 Jun 2023 01:04","2134","35:34","Team A","noMERCY","Shadow Fiend  Disruptor  Magnus  Skywrath Mage  Pangolier","Vivo Keyd Stars","Lich  Spirit Breaker  Visage  Medusa  Timbersaw","Team B"
"7185852552","15286","04 Jun 2023 04:02","2588","43:08","Team B","One Move","Bloodseeker  Silencer  Disruptor  Slark  Void Spirit","nouns","Storm Spirit  Venomancer  Pugna  Batrider  Terrorblade","Team A"
"7186065142","15335","04 Jun 2023 06:01","1506","25:06","Team B","BetBoom Team","Enchantress  Disruptor  Magnus  Terrorblade  Pangolier","Nemiga Gaming","Axe  Windranger  Clinkz  Techies  Void Spirit","Team A"
"7186235946","15335","04 Jun 2023 08:07","2395","39:55","Team B","Virtus.pro","Tidehunter  Disruptor  Techies  Ember Spirit  Monkey King","9Pandas","Lich  Doom  Naga Siren  Skywrath Mage  Pangolier","Team A"
"7186589032","15365","05 Jun 2023 02:35","2794","46:34","Team B","beastcoast","Clockwerk  Meepo  Disruptor  Magnus  Ember Spirit","Evil Geniuses","Bounty Hunter  Doom  Rubick  Slark  Underlord","Team A"
"7186632014","15383","05 Jun 2023 04:00","2732","45:32","Team B","Team Bright","Puck  Venomancer  Spirit Breaker  Disruptor  Naga Siren","Aster.Aries","Faceless Void  Shadow Demon  Techies  Underlord  Void Spirit","Team B"
"7186669295","15350","05 Jun 2023 05:09","3229","53:49","Team B","felt","Windranger  Dark Seer  Disruptor  Techies  Void Spirit","B8","Storm Spirit  Sven  Lich  Keeper of the Light  Underlord","Team A"
"7186835502","15383","05 Jun 2023 09:21","1898","31:38","Team A","Xtreme Gaming","Puck  Faceless Void  Batrider  Disruptor  Timbersaw","Azure Ray","Silencer  Keeper of the Light  Slark  Abaddon  Pangolier","Team B"
"7186868834","15374","05 Jun 2023 10:03","2230","37:10","Team A","Execration","Phantom Lancer  Batrider  Spirit Breaker  Disruptor  Void Spirit","Blacklist Rivalry","Morphling  Tidehunter  Queen of Pain  Venomancer  Rubick","Team B"
"7186887182","15383","05 Jun 2023 10:33","3685","1:01:25","Team A","Team Aster","Bloodseeker  Windranger  Batrider  Disruptor  Slark","INVICTUS GAMING","Puck  Brewmaster  Techies  Oracle  Monkey King","Team B"
"7187048741","15383","05 Jun 2023 01:13","3045","50:45","Team A","Team Aster","Beastmaster  Shadow Demon  Disruptor  Monkey King  Snapfire","INVICTUS GAMING","Pugna  Medusa  Timbersaw  Winter Wyvern  Void Spirit","Team B"
"7187514531","15351","05 Jun 2023 06:21","2621","43:41","Team A","Entity","Doom  Disruptor  Magnus  Techies  Ember Spirit","Luna Galaxy","Beastmaster  Wraith King  Batrider  Silencer  Winter Wyvern","Team A"
"7187552726","15365","05 Jun 2023 06:56","855","14:15","Team B","Balrogs Esports™","Puck  Death Prophet  Clockwerk  Disruptor  Monkey King","Infamous Gaming","Mirana  Queen of Pain  Venomancer  Lifestealer  Spirit Breaker","Team B"
"7187649927","15286","05 Jun 2023 08:10","1603","26:43","Team A","BetBoom Team","Shadow Fiend  Disruptor  Magnus  Techies  Void Spirit","cybercats","Bloodseeker  Lich  Templar Assassin  Undying  Terrorblade","Team A"
"7187669754","15351","05 Jun 2023 08:25","2484","41:24","Team B","Entity","Morphling  Beastmaster  Batrider  Disruptor  Skywrath Mage","Luna Galaxy","Ancient Apparition  Chaos Knight  Magnus  Techies  Ember Spirit","Team A"
"7187763505","15286","05 Jun 2023 09:45","2710","45:10","Team A","One Move","Bloodseeker  Juggernaut  Vengeful Spirit  Disruptor  Pangolier","Luna Galaxy","Lich  Batrider  Medusa  Ember Spirit  Mars","Team B"
"7187839180","15365","05 Jun 2023 11:00","2631","43:51","Team B","beastcoast","Morphling  Tiny  Disruptor  Magnus  Phoenix","Evil Geniuses","Shadow Fiend  Batrider  Silencer  Earth Spirit  Monkey King","Team B"
"7187863779","15269","05 Jun 2023 11:34","2110","35:10","Team B","Acatsuki","Shadow Fiend  Dark Seer  Batrider  Chaos Knight  Disruptor","Lava Esports","Beastmaster  Queen of Pain  Shadow Demon  Rubick  Medusa","Team A"
"7188400366","15286","06 Jun 2023 01:00","1510","25:10","Team A","Nemiga Gaming","Doom  Disruptor  Slark  Techies  Void Spirit","Virtus.pro","Axe  Storm Spirit  Lich  Pugna  Alchemist","Team B"
"7189085468","15286","06 Jun 2023 08:58","2116","35:16","Team A","Nemiga Gaming","Juggernaut  Doom  Disruptor  Dark Willow  Primal Beast","BetBoom Team","Axe  Death Prophet  Spirit Breaker  Medusa  Techies","Team A"
"7189681341","15375","07 Jun 2023 11:10","1939","32:19","Team B","UD VESSUWAN","Phantom Lancer  Shadow Demon  Disruptor  Magnus  Pangolier","Neon Esports","Venomancer  Batrider  Slark  Skywrath Mage  Void Spirit","Team A"
"7189884474","15375","07 Jun 2023 02:23","1421","23:41","Team B","SPAWN Team","Windranger  Pugna  Spirit Breaker  Disruptor  Naga Siren","Myth Avenue Gaming","Bane  Batrider  Slark  Medusa  Magnus","Team A"
"7190513366","15269","07 Jun 2023 10:00","1467","24:27","Team A","x5 Gaming","Juggernaut  Batrider  Disruptor  Oracle  Void Spirit","Vivo Keyd Stars","Storm Spirit  Spirit Breaker  Naga Siren  Visage  Techies","Team B"
"7190575301","15269","07 Jun 2023 10:56","2275","37:55","Team B","x5 Gaming","Juggernaut  Shadow Demon  Disruptor  Magnus  Pangolier","Vivo Keyd Stars","Spirit Breaker  Medusa  Skywrath Mage  Void Spirit  Primal Beast","Team B"
"7192204873","15375","09 Jun 2023 07:00","1928","32:08","Team A","IHC","Bloodseeker  Disruptor  Skywrath Mage  Earth Spirit  Underlord","Geek Slate","Juggernaut  Storm Spirit  Pugna  Doom  Rubick","Team B"
"7193354866","15352","09 Jun 2023 11:51","2230","37:10","Team A","Alliance","Doom  Disruptor  Slark  Techies  Pangolier","ITB.Shuffle","Enigma  Pugna  Batrider  Arc Warden  Void Spirit","Team B"
"7194686643","15366","10 Jun 2023 08:20","2148","35:48","Team B","x5 Gaming","Juggernaut  Disruptor  Magnus  Techies  Void Spirit","Lava Esports","Dark Seer  Enchantress  Spirit Breaker  Medusa  Pangolier","Team B"
"7194759905","15366","10 Jun 2023 09:23","1641","27:21","Team A","Lava Esports","Juggernaut  Rubick  Disruptor  Magnus  Ember Spirit","x5 Gaming","Crystal Maiden  Undying  Keeper of the Light  Bristleback  Void Spirit","Team A"
"7194830591","15366","10 Jun 2023 10:35","1883","31:23","Team A","Universitario eSports","Batrider  Spirit Breaker  Disruptor  Keeper of the Light  Terrorblade","noMERCY","Death Prophet  Phantom Assassin  Clockwerk  Dark Seer  Oracle","Team B"
"7195736225","15375","11 Jun 2023 02:33","3276","54:36","Team A","Myth Avenue Gaming","Morphling  Batrider  Disruptor  Magnus  Void Spirit","Vision","Windranger  Dark Seer  Spirit Breaker  Slark  Oracle","Team B"
"7195865237","15439","11 Jun 2023 03:52","2240","37:20","Team B","beastcoast","Templar Assassin  Disruptor  Magnus  Abaddon  Earth Spirit","OG","Morphling  Enchantress  Batrider  Doom  Invoker","Team B"
"7196543727","15353","12 Jun 2023 01:05","2288","38:08","Team A","Wildcard","Juggernaut  Beastmaster  Disruptor  Keeper of the Light  Pangolier","TiltedBoys","Morphling  Undying  Rubick  Void Spirit  Mars","Team A"
"7196581770","15353","12 Jun 2023 02:10","1886","31:26","Team B","TiltedBoys","Bounty Hunter  Batrider  Disruptor  Slark  Ember Spirit","Wildcard","Mirana  Storm Spirit  Beastmaster  Shadow Demon  Magnus","Team B"
"7197158940","15439","12 Jun 2023 02:25","2694","44:54","Team A","Shopify Rebellion","Disruptor  Techies  Ember Spirit  Underlord  Terrorblade","Entity","Juggernaut  Beastmaster  Dark Seer  Silencer  Skywrath Mage","Team B"
"7197161670","15439","12 Jun 2023 02:25","1665","27:45","Team B","9Pandas","Slardar  Templar Assassin  Enchantress  Disruptor  Timbersaw","Team Aster","Mirana  Doom  Keeper of the Light  Void Spirit  Snapfire","Team B"
"7197268558","15439","12 Jun 2023 03:41","2317","38:37","Team A","OG","Weaver  Batrider  Doom  Disruptor  Void Spirit","BetBoom Team","Storm Spirit  Pugna  Spirit Breaker  Magnus  Terrorblade","Team B"
"7197382646","15439","12 Jun 2023 05:09","2387","39:47","Team B","Evil Geniuses","Bloodseeker  Viper  Bounty Hunter  Disruptor  Snapfire","Team Secret","Tidehunter  Lich  Batrider  Timbersaw  Monkey King","Team A"
"7197681967","15439","12 Jun 2023 08:26","2361","39:21","Team A","BetBoom Team","Shadow Fiend  Enchantress  Disruptor  Magnus  Terrorblade","9Pandas","Batrider  Doom  Rubick  Timbersaw  Abaddon","Team B"
"7197781999","15353","12 Jun 2023 09:55","1747","29:07","Team A","CDUB Esports","Anti-Mage  Bloodseeker  Disruptor  Magnus  Timbersaw","Nexus Titans","Crystal Maiden  Pugna  Outworld Devourer  Medusa  Void Spirit","Team A"
"7197883505","15353","12 Jun 2023 11:55","3115","51:55","Team A","The Cut","Bloodseeker  Disruptor  Keeper of the Light  Magnus  Ember Spirit","American goons","Templar Assassin  Silencer  Rubick  Underlord  Void Spirit","Team B"
"7198344928","15439","13 Jun 2023 11:55","3670","1:01:10","Team B","Team Spirit","Morphling  Beastmaster  Queen of Pain  Enchantress  Disruptor","Talon","Windranger  Clinkz  Rubick  Slark  Timbersaw","Team B"
"7198410033","15439","13 Jun 2023 01:07","2725","45:25","Team B","TSM","Batrider  Disruptor  Magnus  Abaddon  Void Spirit","Evil Geniuses","Morphling  Rubick  Techies  Underlord  Snapfire","Team A"
"7198515116","15439","13 Jun 2023 02:35","1406","23:26","Team B","Entity","Beastmaster  Venomancer  Clockwerk  Lone Druid  Disruptor","Gaimin Gladiators","Bloodseeker  Dark Seer  Rubick  Techies  Void Spirit","Team B"
"7198583881","15439","13 Jun 2023 03:30","2859","47:39","Team A","Entity","Beastmaster  Venomancer  Bounty Hunter  Disruptor  Muerta","Gaimin Gladiators","Morphling  Undying  Rubick  Medusa  Void Spirit","Team B"
"7198743566","15439","13 Jun 2023 05:09","2279","37:59","Team B","Team Secret","Tiny  Beastmaster  Undying  Disruptor  Medusa","Team Liquid","Bounty Hunter  Silencer  Magnus  Terrorblade  Void Spirit","Team A"
"7198946948","15439","13 Jun 2023 07:38","2952","49:12","Team B","BetBoom Team","Morphling  Tiny  Doom  Disruptor  Keeper of the Light","Entity","Bane  Pudge  Medusa  Winter Wyvern  Pangolier","Team A"
"7198959000","15439","13 Jun 2023 07:46","1356","22:36","Team A","Gaimin Gladiators","Beastmaster  Lifestealer  Enchantress  Disruptor  Timbersaw","OG","Storm Spirit  Windranger  Tidehunter  Faceless Void  Pugna","Team A"
"7199036146","15439","13 Jun 2023 08:59","2149","35:49","Team B","Entity","Anti-Mage  Shadow Demon  Disruptor  Magnus  Timbersaw","BetBoom Team","Tiny  Enchantress  Spirit Breaker  Medusa  Legion Commander","Team A"
"7199069620","15366","13 Jun 2023 09:15","2163","36:03","Team B","NoPing Esports","Disruptor  Techies  Ember Spirit  Terrorblade  Pangolier","x5 Gaming","Juggernaut  Batrider  Skywrath Mage  Oracle  Void Spirit","Team A"
"7199645467","15375","14 Jun 2023 11:35","1503","25:03","Team A","SPAWN Team","Storm Spirit  Pugna  Spirit Breaker  Disruptor  Naga Siren","Geek Slate","Morphling  Queen of Pain  Clockwerk  Shadow Demon  Timbersaw","Team B"
"7199684963","15375","14 Jun 2023 12:24","3227","53:47","Team B","Geek Slate","Axe  Alchemist  Disruptor  Skywrath Mage  Ember Spirit","SPAWN Team","Morphling  Windranger  Clockwerk  Silencer  Void Spirit","Team A"
"7199923587","15439","14 Jun 2023 03:42","2448","40:48","Team B","BetBoom Team","Phantom Lancer  Pugna  Doom  Disruptor  Pangolier","Gaimin Gladiators","Mirana  Lifestealer  Enchantress  Medusa  Void Spirit","Team A"
"7200429380","15352","14 Jun 2023 10:15","2380","39:40","Team A","Nigma Galaxy","Morphling  Pugna  Batrider  Disruptor  Timbersaw","LEVEL UP","Bloodseeker  Tidehunter  Venomancer  Spirit Breaker  Ember Spirit","Team A"
"7200614759","15353","15 Jun 2023 02:54","1882","31:22","Team B","American goons","Templar Assassin  Doom  Rubick  Disruptor  Void Spirit","Ravens","Mirana  Morphling  Witch Doctor  Magnus  Ember Spirit","Team B"
"7202260793","15375","16 Jun 2023 11:14","2680","44:40","Team B","Geek Slate","Morphling  Shadow Demon  Undying  Disruptor  Pangolier","Neon Esports","Storm Spirit  Lich  Enchantress  Doom  Alchemist","Team B"
"7202370881","15439","16 Jun 2023 01:14","2160","36:00","Team A","Team Aster","Morphling  Beastmaster  Venomancer  Faceless Void  Disruptor","9Pandas","Lina  Dark Seer  Batrider  Undying  Terrorblade","Team B"
"7202777399","15439","16 Jun 2023 05:59","3048","50:48","Team B","BetBoom Team","Doom  Disruptor  Techies  Ember Spirit  Monkey King","Gaimin Gladiators","Morphling  Broodmother  Undying  Hoodwink  Void Spirit","Team A"
