"Match ID","League","Start Date","Duration (s)","Duration (mm:ss)","Radiant Team","Team A","Team A Heroes","Team B","Team B Heroes","Winner"
"7116420936","15136","21 Apr 2023 02:36","3465","57:45","Team B","x5 Gaming","Puck  Clockwerk  Disruptor  Timbersaw  Abaddon","noMERCY","Medusa  Skywrath Mage  Legion Commander  Techies  Void Spirit","Team B"
"7116943970","15126","21 Apr 2023 10:00","1223","20:23","Team B","Vision","Disruptor  Visage  Terrorblade  Marci  Primal Beast","BOOM Esports","Earthshaker  Beastmaster  Templar Assassin  Enchantress  Bounty Hunter","Team B"
"7117458330","15088","21 Apr 2023 02:59","3444","57:24","Team A","Ancient Tribe","Mirana  Phantom Lancer  Puck  Doom  Disruptor","Alliance","Bane  Death Prophet  Luna  Rubick  Pangolier","Team A"
"7118560271","15087","22 Apr 2023 12:59","3466","57:46","Team A","Ravens","Templar Assassin  Disruptor  Tusk  Legion Commander  Snapfire","The Cut","Beastmaster  Treant Protector  Troll Warlord  Hoodwink  Void Spirit","Team A"
"7118661066","15087","22 Apr 2023 03:25","2448","40:48","Team A","ALPHA","Bloodseeker  Riki  Batrider  Meepo  Disruptor","SAND KING GÓMEZ","Phantom Assassin  Ogre Magi  Skywrath Mage  Void Spirit  Mars","Team A"
"7118748043","15128","22 Apr 2023 05:04","1655","27:35","Team B","Outsiders From CN","Storm Spirit  Death Prophet  Clockwerk  Disruptor  Naga Siren","We Own","Templar Assassin  Bounty Hunter  Ancient Apparition  Rubick  Dawnbreaker","Team A"
"7118795304","15128","22 Apr 2023 05:54","1343","22:23","Team B","We Own","Anti-Mage  Beastmaster  Queen of Pain  Disruptor  Hoodwink","Outsiders From CN","Shadow Fiend  Tiny  Ogre Magi  Rubick  Timbersaw","Team B"
"7119155871","15128","22 Apr 2023 10:42","2915","48:35","Team B","UD VESSUWAN","Morphling  Bounty Hunter  Doom  Disruptor  Pangolier","Hashtag.Reaper","Lion  Queen of Pain  Enchantress  Slark  Legion Commander","Team A"
"7119695715","15196","22 Apr 2023 03:52","3429","57:09","Team A","Tundra Esports","Doom  Disruptor  Naga Siren  Techies  Monkey King","Shopify Rebellion","Mirana  Puck  Alchemist  Legion Commander  Earth Spirit","Team A"
"7120196116","15196","22 Apr 2023 08:12","4600","1:16:40","Team B","Gaimin Gladiators","Templar Assassin  Enchantress  Doom  Disruptor  Terrorblade","Team Liquid","Necrophos  Chen  Dark Willow  Void Spirit  Muerta","Team B"
"7120410176","15136","22 Apr 2023 10:20","2593","43:13","Team A","NoLimitsGaming","Dragon Knight  Batrider  Disruptor  Tusk  Marci","x5 Gaming","Mirana  Puck  Weaver  Alchemist  Dawnbreaker","Team B"
"7120769506","15128","23 Apr 2023 05:11","1395","23:15","Team B","Dino Esports","Bloodseeker  Storm Spirit  Bounty Hunter  Disruptor  Primal Beast","MIRACLE ESPORT","Crystal Maiden  Nature's Prophet  Night Stalker  Hoodwink  Snapfire","Team A"
"7120803325","15128","23 Apr 2023 05:51","1343","22:23","Team B","MIRACLE ESPORT","Earthshaker  Zeus  Spectre  Disruptor  Muerta","Dino Esports","Pudge  Luna  Enchantress  Arc Warden  Dawnbreaker","Team B"
"7120859470","15141","23 Apr 2023 06:57","1872","31:12","Team A","Supernova","Dragon Knight  Invoker  Disruptor  Phoenix  Monkey King","Holy Grail","Queen of Pain  Dazzle  Bounty Hunter  Doom  Ursa","Team B"
"7121091529","15141","23 Apr 2023 10:20","1156","19:16","Team B","Team Disillusion","Bloodseeker  Mirana  Pudge  Templar Assassin  Disruptor","Team Bright","Clockwerk  Weaver  Brewmaster  Void Spirit  Muerta","Team B"
"7122028845","15196","23 Apr 2023 07:01","3420","57:00","Team A","Gaimin Gladiators","Puck  Rubick  Disruptor  Underlord  Muerta","Team Liquid","Riki  Chen  Slark  Phoenix  Pangolier","Team A"
"7122163122","15196","23 Apr 2023 08:29","1705","28:25","Team B","Gaimin Gladiators","Queen of Pain  Disruptor  Centaur Warrunner  Monkey King  Dark Willow","Team Liquid","Crystal Maiden  Storm Spirit  Sven  Rubick  Underlord","Team B"
"7122346594","15088","23 Apr 2023 10:36","1921","32:01","Team A","Old G","Disruptor  Keeper of the Light  Legion Commander  Ember Spirit  Muerta","ITB.Shuffle","Death Prophet  Clockwerk  Techies  Underlord  Dawnbreaker","Team A"
"7122413888","15088","23 Apr 2023 11:38","4077","1:07:57","Team A","Old G","Viper  Alchemist  Disruptor  Keeper of the Light  Legion Commander","ITB.Shuffle","Death Prophet  Rubick  Ember Spirit  Terrorblade  Monkey King","Team A"
"7122467503","15267","24 Apr 2023 12:50","2801","46:41","Team B","Hokori","Batrider  Disruptor  Tusk  Terrorblade  Muerta","Balrogs Esports™","Crystal Maiden  Storm Spirit  Templar Assassin  Underlord  Primal Beast","Team B"
"7122476857","15087","24 Apr 2023 12:56","1789","29:49","Team A","TiltedBoys","Storm Spirit  Doom  Ursa  Disruptor  Hoodwink","CDUB Esports","Wraith King  Clockwerk  Ancient Apparition  Legion Commander  Muerta","Team B"
"7122521967","15267","24 Apr 2023 02:10","2014","33:34","Team B","Mad Kings Esports","Earthshaker  Invoker  Disruptor  Medusa  Centaur Warrunner","Thunder Awaken","Leshrac  Chen  Doom  Alchemist  Earth Spirit","Team B"
"7122593344","15267","24 Apr 2023 04:11","1903","31:43","Team A","Thunder Awaken","Storm Spirit  Disruptor  Bristleback  Earth Spirit  Monkey King","Mad Kings Esports","Beastmaster  Jakiro  Alchemist  Rubick  Muerta","Team A"
"7122764667","15141","24 Apr 2023 08:14","2715","45:15","Team A","Big brain","Tidehunter  Bounty Hunter  Disruptor  Slark  Monkey King","Supernova","Mirana  Venomancer  Templar Assassin  Ember Spirit  Dark Willow","Team B"
"7123587850","15138","24 Apr 2023 06:04","2353","39:13","Team B","Moneymakers","Invoker  Disruptor  Naga Siren  Timbersaw  Primal Beast","Nemiga Gaming","Death Prophet  Clockwerk  Dark Seer  Bounty Hunter  Muerta","Team B"
"7123923335","15087","24 Apr 2023 09:53","4441","1:14:01","Team B","TiltedBoys","Phantom Lancer  Beastmaster  Disruptor  Ember Spirit  Snapfire","Ravens","Storm Spirit  Templar Assassin  Nature's Prophet  Undying  Earth Spirit","Team B"
"7124037387","15267","24 Apr 2023 11:38","2416","40:16","Team B","Ravens","Templar Assassin  Rubick  Disruptor  Underlord  Void Spirit","Infamous Gaming","Mirana  Alchemist  Centaur Warrunner  Skywrath Mage  Pangolier","Team A"
"7124083544","15267","25 Apr 2023 12:51","875","14:35","Team B","Ravens","Crystal Maiden  Doom  Disruptor  Slark  Void Spirit","Infamous Gaming","Mirana  Beastmaster  Meepo  Treant Protector  Muerta","Team A"
"7124115083","15267","25 Apr 2023 01:39","2199","36:39","Team B","Hokori","Bloodseeker  Mirana  Beastmaster  Batrider  Disruptor","Mad Kings Esports","Crystal Maiden  Weaver  Tusk  Ember Spirit  Monkey King","Team B"
"7124148968","15267","25 Apr 2023 02:44","2068","34:28","Team A","Hokori","Tidehunter  Huskar  Disruptor  Naga Siren  Hoodwink","Mad Kings Esports","Beastmaster  Enchantress  Bounty Hunter  Slark  Pangolier","Team A"
"7124188537","15267","25 Apr 2023 03:51","2162","36:02","Team B","Hokori","Storm Spirit  Tidehunter  Disruptor  Slark  Hoodwink","Mad Kings Esports","Enchantress  Legion Commander  Ember Spirit  Terrorblade  Snapfire","Team B"
"7124245416","15128","25 Apr 2023 05:19","2221","37:01","Team A","Team Virgo","Tiny  Necrophos  Spectre  Disruptor  Pangolier","Dino Esports","Shadow Fiend  Puck  Bounty Hunter  Rubick  Dawnbreaker","Team A"
"7124761494","15138","25 Apr 2023 03:00","2245","37:25","Team B","cybercats","Beastmaster  Alchemist  Disruptor  Keeper of the Light  Snapfire","UALEIKUMNIHAO","Death Prophet  Bounty Hunter  Doom  Rubick  Naga Siren","Team A"
"7124965163","14691","25 Apr 2023 04:42","3596","59:56","Team A","Please dont gank my carry","Puck  Disruptor  Timbersaw  Terrorblade  Oracle","Luna Galaxy","Bane  Mirana  Phantom Lancer  Riki  Doom","Team B"
"7125209990","15136","25 Apr 2023 07:03","2989","49:49","Team B","Lava Esports","Sven  Beastmaster  Rubick  Disruptor  Pangolier","Mad Kings Esports","Crystal Maiden  Dragon Knight  Monkey King  Void Spirit  Snapfire","Team B"
"7125542217","15267","25 Apr 2023 11:24","2919","48:39","Team A","Thunder Awaken","Bloodseeker  Storm Spirit  Rubick  Disruptor  Underlord","Hokori","Drow Ranger  Beastmaster  Undying  Tusk  Techies","Team B"
"7125590814","15267","26 Apr 2023 12:54","2444","40:44","Team B","Hokori","Doom  Disruptor  Abaddon  Dark Willow  Void Spirit","Thunder Awaken","Phantom Lancer  Death Prophet  Batrider  Earth Spirit  Oracle","Team B"
"7125813501","15126","26 Apr 2023 07:00","2026","33:46","Team A","BOOM Esports","Mirana  Nature's Prophet  Disruptor  Ember Spirit  Pangolier","UD VESSUWAN","Bloodseeker  Viper  Enchantress  Naga Siren  Tusk","Team A"
"7125857500","15126","26 Apr 2023 08:00","1653","27:33","Team B","BOOM Esports","Puck  Enchantress  Bounty Hunter  Disruptor  Muerta","UD VESSUWAN","Crystal Maiden  Storm Spirit  Lifestealer  Tusk  Dawnbreaker","Team A"
"7125860523","15128","26 Apr 2023 08:03","677","11:17","Team B","EV GaminG","Rubick  Disruptor  Naga Siren  Ember Spirit  Dawnbreaker","We Own","Shadow Fiend  Sven  Beastmaster  Ogre Magi  Skywrath Mage","Team A"
"7125949168","15126","26 Apr 2023 10:00","1709","28:29","Team B","Vision","Bounty Hunter  Disruptor  Visage  Ember Spirit  Muerta","IHC","Phantom Lancer  Omniknight  Brewmaster  Undying  Rubick","Team B"
"7126052070","15251","26 Apr 2023 12:00","1082","18:02","Team B","Evil Geniuses","Crystal Maiden  Pudge  Disruptor  Underlord  Void Spirit","Gaimin Gladiators","Beastmaster  Chen  Rubick  Pangolier  Muerta","Team B"
"7126110974","15251","26 Apr 2023 12:54","1328","22:08","Team A","Evil Geniuses","Bloodseeker  Leshrac  Dark Seer  Disruptor  Nyx Assassin","Gaimin Gladiators","Riki  Doom  Rubick  Io  Slark","Team A"
"7126120830","15138","26 Apr 2023 01:13","2232","37:12","Team B","Moneymakers","Vengeful Spirit  Doom  Disruptor  Slark  Medusa","NAVI Junior","Bloodseeker  Mirana  Beastmaster  Keeper of the Light  Oracle","Team A"
"7126226626","15251","26 Apr 2023 02:30","1916","31:56","Team B","Team Liquid","Night Stalker  Batrider  Disruptor  Nyx Assassin  Monkey King","Team Aster","Storm Spirit  Beastmaster  Pugna  Clockwerk  Terrorblade","Team B"
"7126242537","15251","26 Apr 2023 02:44","1268","21:08","Team B","Gaimin Gladiators","Viper  Clockwerk  Leshrac  Lone Druid  Disruptor","PSG.LGD","Storm Spirit  Dark Seer  Nyx Assassin  Io  Bristleback","Team A"
"7126289022","15126","26 Apr 2023 03:07","2856","47:36","Team B","Myth Avenue Gaming","Sven  Dark Seer  Bounty Hunter  Batrider  Disruptor","IHC","Mirana  Queen of Pain  Venomancer  Nyx Assassin  Troll Warlord","Team B"
"7126320840","15251","26 Apr 2023 03:32","1924","32:04","Team B","Team Aster","Leshrac  Alchemist  Disruptor  Troll Warlord  Techies","Team Liquid","Bloodseeker  Crystal Maiden  Io  Monkey King  Void Spirit","Team B"
"7126326529","15138","26 Apr 2023 03:28","1746","29:06","Team B","cybercats","Death Prophet  Dragon Knight  Bounty Hunter  Alchemist  Disruptor","No Sorry","Storm Spirit  Sven  Enchantress  Rubick  Centaur Warrunner","Team A"
"7126332974","15251","26 Apr 2023 03:45","2234","37:14","Team A","Evil Geniuses","Faceless Void  Disruptor  Legion Commander  Monkey King  Snapfire","Execration","Clockwerk  Batrider  Rubick  Underlord  Muerta","Team A"
"7126500262","15251","26 Apr 2023 05:15","1967","32:47","Team A","Shopify Rebellion","Storm Spirit  Luna  Brewmaster  Disruptor  Io","INVICTUS GAMING","Nyx Assassin  Troll Warlord  Timbersaw  Ember Spirit  Snapfire","Team A"
"7126598086","15251","26 Apr 2023 06:24","2277","37:57","Team B","Team Spirit","Viper  Rubick  Disruptor  Naga Siren  Underlord","Tundra Esports","Beastmaster  Venomancer  Enchantress  Alchemist  Slark","Team A"
"7126704159","15136","26 Apr 2023 07:33","1311","21:51","Team A","noMERCY","Phantom Lancer  Batrider  Doom  Disruptor  Skywrath Mage","NoPing Esports","Riki  Death Prophet  Pugna  Bounty Hunter  Medusa","Team B"
"7126722114","15251","26 Apr 2023 07:51","2651","44:11","Team A","OG","Templar Assassin  Disruptor  Underlord  Dark Willow  Void Spirit","Xtreme Gaming","Storm Spirit  Sven  Lion  Io  Timbersaw","Team A"
"7126746550","15251","26 Apr 2023 07:59","3360","56:00","Team B","Team Spirit","Shadow Fiend  Shadow Demon  Disruptor  Underlord  Monkey King","Shopify Rebellion","Crystal Maiden  Storm Spirit  Sven  Doom  Techies","Team B"
"7126823466","15251","26 Apr 2023 08:58","2038","33:58","Team A","beastcoast","Alchemist  Disruptor  Troll Warlord  Tusk  Snapfire","Team SMG","Mirana  Kunkka  Phoenix  Monkey King  Muerta","Team A"
"7126903399","15267","26 Apr 2023 10:02","2766","46:06","Team B","Vivo Keyd Stars","Death Prophet  Alchemist  Disruptor  Monkey King  Void Spirit","Infamous Gaming","Storm Spirit  Treant Protector  Rubick  Legion Commander  Muerta","Team B"
"7126920960","15087","26 Apr 2023 10:20","2948","49:08","Team A","Ravens","Bounty Hunter  Disruptor  Slark  Legion Commander  Ember Spirit","CDUB Esports","Wraith King  Doom  Techies  Pangolier  Snapfire","Team A"
"7126982132","15267","26 Apr 2023 11:24","2981","49:41","Team B","Infamous Gaming","Puck  Disruptor  Naga Siren  Skywrath Mage  Underlord","Vivo Keyd Stars","Enigma  Enchantress  Batrider  Slark  Earth Spirit","Team A"
"7126995270","15087","26 Apr 2023 11:47","1761","29:21","Team A","Ravens","Templar Assassin  Doom  Disruptor  Timbersaw  Earth Spirit","CDUB Esports","Wraith King  Alchemist  Skywrath Mage  Legion Commander  Dawnbreaker","Team B"
"7127293328","15128","27 Apr 2023 08:06","2214","36:54","Team B","Outsiders From CN","Meepo  Rubick  Disruptor  Terrorblade  Dawnbreaker","Manta Esports","Puck  Templar Assassin  Doom  Silencer  Tusk","Team A"
"7127474525","15251","27 Apr 2023 12:00","1772","29:32","Team B","Evil Geniuses","Sven  Death Prophet  Disruptor  Marci  Primal Beast","PSG.LGD","Mirana  Riki  Beastmaster  Ancient Apparition  Naga Siren","Team B"
"7127536763","15251","27 Apr 2023 01:00","2183","36:23","Team A","Evil Geniuses","Luna  Disruptor  Skywrath Mage  Legion Commander  Mars","PSG.LGD","Alchemist  Brewmaster  Undying  Rubick  Terrorblade","Team B"
"7127549430","15251","27 Apr 2023 01:10","1726","28:46","Team A","9Pandas","Beastmaster  Enchantress  Disruptor  Medusa  Ember Spirit","Team Liquid","Storm Spirit  Sven  Pugna  Doom  Oracle","Team B"
"7127562163","15251","27 Apr 2023 01:25","1550","25:50","Team B","Execration","Kunkka  Undying  Disruptor  Underlord  Muerta","Team Aster","Bloodseeker  Storm Spirit  Rubick  Io  Terrorblade","Team B"
"7127656604","15251","27 Apr 2023 02:33","2601","43:21","Team B","TSM","Storm Spirit  Riki  Pugna  Broodmother  Disruptor","Evil Geniuses","Anti-Mage  Dark Seer  Silencer  Rubick  Nyx Assassin","Team A"
"7127660778","15251","27 Apr 2023 02:33","1304","21:44","Team B","Gaimin Gladiators","Lone Druid  Rubick  Disruptor  Underlord  Pangolier","Execration","Crystal Maiden  Dark Seer  Bounty Hunter  Batrider  Slark","Team A"
"7127726063","15251","27 Apr 2023 03:25","1770","29:30","Team A","Gaimin Gladiators","Doom  Silencer  Disruptor  Magnus  Ember Spirit","Execration","Phantom Lancer  Storm Spirit  Rubick  Io  Centaur Warrunner","Team A"
"7127766342","15251","27 Apr 2023 03:43","1533","25:33","Team B","Evil Geniuses","Queen of Pain  Doom  Disruptor  Slark  Monkey King","TSM","Storm Spirit  Broodmother  Bounty Hunter  Rubick  Muerta","Team A"
"7127927613","15251","27 Apr 2023 05:15","3993","1:06:33","Team A","Talon","Bloodseeker  Batrider  Alchemist  Disruptor  Nyx Assassin","Xtreme Gaming","Sven  Pugna  Dragon Knight  Rubick  Underlord","Team B"
"7128022008","15251","27 Apr 2023 06:18","2606","43:26","Team A","Tundra Esports","Weaver  Alchemist  Disruptor  Keeper of the Light  Underlord","Shopify Rebellion","Lifestealer  Batrider  Chen  Skywrath Mage  Legion Commander","Team A"
"7128062737","15251","27 Apr 2023 06:42","2163","36:03","Team A","INVICTUS GAMING","Phantom Lancer  Disruptor  Keeper of the Light  Ember Spirit  Underlord","Team SMG","Crystal Maiden  Mirana  Kunkka  Slark  Timbersaw","Team B"
"7128171641","15251","27 Apr 2023 07:58","1567","26:07","Team A","Team Spirit","Crystal Maiden  Phantom Lancer  Doom  Disruptor  Underlord","INVICTUS GAMING","Kunkka  Luna  Enchantress  Visage  Monkey King","Team A"
"7128187321","15251","27 Apr 2023 08:13","1604","26:44","Team B","beastcoast","Faceless Void  Chen  Disruptor  Tusk  Phoenix","Shopify Rebellion","Crystal Maiden  Beastmaster  Wraith King  Keeper of the Light  Pangolier","Team B"
"7128263914","15251","27 Apr 2023 09:11","991","16:31","Team A","beastcoast","Alchemist  Disruptor  Troll Warlord  Earth Spirit  Snapfire","Shopify Rebellion","Crystal Maiden  Rubick  Timbersaw  Underlord  Terrorblade","Team B"
"7128286493","15251","27 Apr 2023 09:29","2812","46:52","Team B","Team SMG","Death Prophet  Enchantress  Disruptor  Slark  Muerta","Xtreme Gaming","Crystal Maiden  Alchemist  Keeper of the Light  Underlord  Pangolier","Team B"
"7128325881","15267","27 Apr 2023 10:00","2768","46:08","Team A","Acatsuki","Bloodseeker  Puck  Ancient Apparition  Disruptor  Centaur Warrunner","Vivo Keyd Stars","Sven  Leshrac  Rubick  Io  Primal Beast","Team A"
"7128411424","15267","27 Apr 2023 11:28","1665","27:45","Team A","Acatsuki","Drow Ranger  Clockwerk  Doom  Disruptor  Ember Spirit","Vivo Keyd Stars","Dragon Knight  Leshrac  Lycan  Io  Techies","Team A"
"7129095661","15251","28 Apr 2023 02:30","2830","47:10","Team B","PSG.LGD","Clockwerk  Batrider  Disruptor  Magnus  Muerta","Team Aster","Doom  Rubick  Keeper of the Light  Ember Spirit  Terrorblade","Team B"
"7129097240","15251","28 Apr 2023 02:30","3030","50:30","Team B","TSM","Phantom Lancer  Dragon Knight  Disruptor  Keeper of the Light  Underlord","Execration","Beastmaster  Weaver  Rubick  Void Spirit  Muerta","Team B"
"7129204830","15251","28 Apr 2023 03:52","2626","43:46","Team B","Execration","Doom  Disruptor  Naga Siren  Techies  Pangolier","TSM","Riki  Bounty Hunter  Rubick  Underlord  Muerta","Team B"
"7129470801","15251","28 Apr 2023 06:18","1265","21:05","Team B","Team SMG","Death Prophet  Disruptor  Slark  Earth Spirit  Muerta","Shopify Rebellion","Beastmaster  Rubick  Keeper of the Light  Terrorblade  Pangolier","Team B"
"7129488931","15251","28 Apr 2023 06:26","2961","49:21","Team B","INVICTUS GAMING","Storm Spirit  Pugna  Disruptor  Timbersaw  Monkey King","OG","Phantom Lancer  Silencer  Nyx Assassin  Keeper of the Light  Ember Spirit","Team A"
"7129509548","15251","28 Apr 2023 06:38","2056","34:16","Team B","Xtreme Gaming","Alchemist  Brewmaster  Disruptor  Tusk  Muerta","beastcoast","Tiny  Lich  Doom  Keeper of the Light  Terrorblade","Team B"
"7129558832","14691","28 Apr 2023 07:07","2984","49:44","Team A","Please dont gank my carry","Alchemist  Undying  Disruptor  Timbersaw  Pangolier","Luna Galaxy","Sven  Death Prophet  Silencer  Nyx Assassin  Underlord","Team A"
"7129627261","15251","28 Apr 2023 07:57","1546","25:46","Team B","Talon","Dark Seer  Alchemist  Disruptor  Naga Siren  Techies","Team SMG","Morphling  Tiny  Doom  Rubick  Skywrath Mage","Team A"
"7129709647","15251","28 Apr 2023 08:54","1916","31:56","Team B","Talon","Tidehunter  Dragon Knight  Disruptor  Naga Siren  Keeper of the Light","Team SMG","Mirana  Kunkka  Luna  Techies  Monkey King","Team A"
"7129716105","15251","28 Apr 2023 09:02","2528","42:08","Team A","INVICTUS GAMING","Anti-Mage  Death Prophet  Disruptor  Keeper of the Light  Timbersaw","Xtreme Gaming","Mirana  Storm Spirit  Slardar  Alchemist  Phoenix","Team B"
"7129716226","15251","28 Apr 2023 08:59","2032","33:52","Team B","Team Spirit","Axe  Phantom Lancer  Riki  Chen  Disruptor","beastcoast","Crystal Maiden  Rubick  Troll Warlord  Timbersaw  Tusk","Team A"
"7129967727","15267","29 Apr 2023 12:59","1231","20:31","Team B","Balrogs Esports™","Wraith King  Alchemist  Rubick  Disruptor  Dawnbreaker","Mad Kings Esports","Bloodseeker  Chen  Doom  Keeper of the Light  Primal Beast","Team B"
"7130540882","15251","29 Apr 2023 12:00","3403","56:43","Team B","Execration","Sven  Enchantress  Doom  Disruptor  Void Spirit","BetBoom Team","Crystal Maiden  Pudge  Riki  Venomancer  Terrorblade","Team A"
"7130634268","15251","29 Apr 2023 01:12","2623","43:43","Team B","PSG.LGD","Faceless Void  Alchemist  Brewmaster  Rubick  Disruptor","Team Liquid","Crystal Maiden  Clockwerk  Dark Seer  Terrorblade  Void Spirit","Team B"
"7130753434","15251","29 Apr 2023 02:36","2227","37:07","Team A","TSM","Lifestealer  Doom  Disruptor  Keeper of the Light  Pangolier","PSG.LGD","Mirana  Storm Spirit  Beastmaster  Clockwerk  Muerta","Team B"
"7131156650","15251","29 Apr 2023 06:34","2243","37:23","Team B","Xtreme Gaming","Bloodseeker  Doom  Disruptor  Ember Spirit  Phoenix","Tundra Esports","Crystal Maiden  Wraith King  Omniknight  Underlord  Snapfire","Team B"
"7131169560","15251","29 Apr 2023 06:43","2201","36:41","Team A","beastcoast","Disruptor  Slark  Legion Commander  Phoenix  Mars","OG","Crystal Maiden  Phantom Lancer  Keeper of the Light  Underlord  Void Spirit","Team B"
"7131430596","15251","29 Apr 2023 09:40","3811","1:03:31","Team B","Team Spirit","Bloodseeker  Crystal Maiden  Disruptor  Underlord  Pangolier","Xtreme Gaming","Jakiro  Ogre Magi  Keeper of the Light  Slark  Ember Spirit","Team A"
"7131794070","15128","30 Apr 2023 05:02","1933","32:13","Team A","Manta Esports","Venomancer  Bounty Hunter  Disruptor  Monkey King  Primal Beast","EV GaminG","Crystal Maiden  Beastmaster  Terrorblade  Hoodwink  Void Spirit","Team B"
"7132195720","15251","30 Apr 2023 12:00","1935","32:15","Team B","PSG.LGD","Mirana  Tiny  Disruptor  Naga Siren  Primal Beast","BetBoom Team","Bloodseeker  Crystal Maiden  Storm Spirit  Enchantress  Underlord","Team B"
"7132446244","15251","30 Apr 2023 02:45","2333","38:53","Team B","INVICTUS GAMING","Queen of Pain  Doom  Disruptor  Elder Titan  Muerta","beastcoast","Lich  Beastmaster  Keeper of the Light  Terrorblade  Mars","Team B"
"7132446872","15251","30 Apr 2023 02:45","2764","46:04","Team B","Talon","Disruptor  Naga Siren  Techies  Underlord  Void Spirit","Team Spirit","Anti-Mage  Crystal Maiden  Lich  Viper  Doom","Team B"
"7132789617","15251","30 Apr 2023 05:55","2740","45:40","Team A","Team Aster","Shadow Fiend  Pugna  Alchemist  Disruptor  Mars","Evil Geniuses","Bloodseeker  Crystal Maiden  Batrider  Keeper of the Light  Monkey King","Team A"
"7133019590","15251","30 Apr 2023 08:19","4262","1:11:02","Team B","Evil Geniuses","Storm Spirit  Bounty Hunter  Disruptor  Keeper of the Light  Slark","BetBoom Team","Crystal Maiden  Tiny  Pugna  Doom  Muerta","Team A"
"7134857060","15251","01 May 2023 10:06","2557","42:37","Team A","PSG.LGD","Bloodseeker  Storm Spirit  Ancient Apparition  Lycan  Disruptor","Tundra Esports","Mirana  Sven  Bounty Hunter  Doom  Void Spirit","Team B"
"7135506940","15251","02 May 2023 12:00","2265","37:45","Team B","Team Spirit","Doom  Ursa  Disruptor  Grimstroke  Void Spirit","Team Aster","Axe  Crystal Maiden  Windranger  Alchemist  Keeper of the Light","Team B"
"7136203597","15251","02 May 2023 08:20","1658","27:38","Team A","Evil Geniuses","Alchemist  Rubick  Disruptor  Centaur Warrunner  Legion Commander","Shopify Rebellion","Crystal Maiden  Doom  Troll Warlord  Techies  Ember Spirit","Team A"
"7136397265","15267","02 May 2023 11:01","2767","46:07","Team B","Thunder Awaken","Storm Spirit  Doom  Ursa  Disruptor  Skywrath Mage","Acatsuki","Bloodseeker  Crystal Maiden  Rubick  Tusk  Underlord","Team A"
"7136649312","15128","03 May 2023 05:59","1604","26:44","Team B","Hashtag.Reaper","Bloodseeker  Mirana  Disruptor  Magnus  Ember Spirit","EV GaminG","Crystal Maiden  Riki  Alchemist  Monkey King  Muerta","Team B"
"7136803153","15128","03 May 2023 09:10","1741","29:01","Team A","Manta Esports","Windranger  Bounty Hunter  Doom  Disruptor  Slark","Team Tough","Mirana  Storm Spirit  Riki  Io  Medusa","Team A"
"7136973650","15251","03 May 2023 12:00","1625","27:05","Team B","Talon","Dragon Knight  Disruptor  Keeper of the Light  Magnus  Terrorblade","PSG.LGD","Tinker  Alchemist  Brewmaster  Skywrath Mage  Abaddon","Team A"
"7137034774","15251","03 May 2023 12:58","4400","1:13:20","Team A","Talon","Venomancer  Disruptor  Naga Siren  Techies  Underlord","PSG.LGD","Sven  Ogre Magi  Keeper of the Light  Magnus  Timbersaw","Team A"
"7137946329","15267","04 May 2023 01:55","2110","35:10","Team A","Thunder Awaken","Disruptor  Keeper of the Light  Ember Spirit  Terrorblade  Dawnbreaker","Infamous Gaming","Enchantress  Alchemist  Rubick  Legion Commander  Monkey King","Team A"
"7139727701","15251","05 May 2023 12:00","3288","54:48","Team A","Team Aster","Mirana  Pugna  Disruptor  Slark  Underlord","Team Liquid","Beastmaster  Techies  Oracle  Monkey King  Void Spirit","Team B"
"7139830464","15251","05 May 2023 01:28","2131","35:31","Team A","Team Liquid","Lich  Queen of Pain  Alchemist  Disruptor  Underlord","Team Aster","Axe  Crystal Maiden  Bounty Hunter  Keeper of the Light  Terrorblade","Team A"
"7141402305","15251","06 May 2023 01:40","2125","35:25","Team A","OG","Phantom Lancer  Windranger  Batrider  Disruptor  Earth Spirit","Evil Geniuses","Bloodseeker  Queen of Pain  Silencer  Keeper of the Light  Monkey King","Team A"
"7141506538","15251","06 May 2023 02:48","1755","29:15","Team A","OG","Crystal Maiden  Windranger  Beastmaster  Faceless Void  Disruptor","Evil Geniuses","Kunkka  Bounty Hunter  Doom  Keeper of the Light  Monkey King","Team B"
"7141687549","15251","06 May 2023 04:20","2363","39:23","Team A","Gaimin Gladiators","Templar Assassin  Rubick  Disruptor  Ember Spirit  Underlord","9Pandas","Bloodseeker  Tiny  Enchantress  Bounty Hunter  Skywrath Mage","Team A"
"7144158066","15268","07 May 2023 11:19","1131","18:51","Team A","Mad Kings Esports","Morphling  Dragon Knight  Disruptor  Keeper of the Light  Ember Spirit","Vivo Keyd Stars","Storm Spirit  Pugna  Techies  Underlord  Monkey King","Team B"
"7144257364","15268","08 May 2023 01:21","3012","50:12","Team A","Hokori","Dark Seer  Disruptor  Keeper of the Light  Ember Spirit  Terrorblade","Acatsuki","Storm Spirit  Sven  Tidehunter  Pugna  Nyx Assassin","Team A"
