"Match ID","League","Start Date","Duration (s)","Duration (mm:ss)","Radiant Team","Team A","Team A Heroes","Team B","Team B Heroes","Winner"
"7203198614","15353","16 Jun 2023 11:59","1594","26:34","Team A","The Cut","Zeus  Clinkz  Doom  Disruptor  Medusa","Nexus Titans","Bloodseeker  Enchantress  Weaver  Spirit Breaker  Ember Spirit","Team A"
"7203231251","15353","17 Jun 2023 12:48","1836","30:36","Team A","The Cut","Zeus  Wraith King  Clinkz  Disruptor  Magnus","Nexus Titans","Morphling  Windranger  Undying  Skywrath Mage  Legion Commander","Team A"
"7204541793","15439","17 Jun 2023 09:25","3124","52:04","Team B","BetBoom Team","Death Prophet  Doom  Disruptor  Techies  Terrorblade","Evil Geniuses","Bloodseeker  Dark Seer  Undying  Skywrath Mage  Legion Commander","Team B"
"7204591909","15366","17 Jun 2023 09:57","2703","45:03","Team A","Lava Esports","Bloodseeker  Puck  Lycan  Rubick  Disruptor","NoPing Esports","Mirana  Storm Spirit  Undying  Timbersaw  Terrorblade","Team A"
"7204670117","15366","17 Jun 2023 11:08","2842","47:22","Team B","NoPing Esports","Luna  Disruptor  Keeper of the Light  Underlord  Void Spirit","Lava Esports","Enchantress  Batrider  Doom  Alchemist  Pangolier","Team B"
"7204707310","15439","18 Jun 2023 12:00","2699","44:59","Team A","BetBoom Team","Juggernaut  Lina  Doom  Disruptor  Techies","Evil Geniuses","Bloodseeker  Shadow Fiend  Bounty Hunter  Undying  Snapfire","Team A"
"7205399272","15375","18 Jun 2023 01:01","1290","21:30","Team A","Vision","Bloodseeker  Windranger  Spirit Breaker  Disruptor  Magnus","Geek Slate","Morphling  Lich  Broodmother  Doom  Undying","Team B"
"7205911690","15439","18 Jun 2023 06:40","2622","43:42","Team A","Evil Geniuses","Juggernaut  Dark Seer  Broodmother  Disruptor  Monkey King","PSG.LGD","Storm Spirit  Naga Siren  Techies  Phoenix  Mars","Team A"
"7206004050","15439","18 Jun 2023 07:51","1726","28:46","Team A","Evil Geniuses","Pugna  Templar Assassin  Doom  Disruptor  Void Spirit","PSG.LGD","Morphling  Windranger  Beastmaster  Undying  Techies","Team B"
"7206126600","15352","18 Jun 2023 09:34","2472","41:12","Team A","IVY","Enigma  Batrider  Rubick  Disruptor  Terrorblade","Alliance","Beastmaster  Faceless Void  Undying  Techies  Ember Spirit","Team B"
"7206260619","15353","18 Jun 2023 11:56","3625","1:00:25","Team A","Nexus Titans","Storm Spirit  Pugna  Broodmother  Disruptor  Mars","GRIN Esports","Bloodseeker  Lich  Beastmaster  Techies  Pangolier","Team A"
"7206399237","15353","19 Jun 2023 04:02","1890","31:30","Team B","American goons","Morphling  Venomancer  Disruptor  Timbersaw  Skywrath Mage","CDUB Esports","Bloodseeker  Tidehunter  Pugna  Rubick  Pangolier","Team B"
"7206431622","15353","19 Jun 2023 05:01","1923","32:03","Team A","American goons","Juggernaut  Disruptor  Timbersaw  Techies  Mars","CDUB Esports","Pugna  Lifestealer  Chen  Spirit Breaker  Ember Spirit","Team B"
"7206661832","15439","19 Jun 2023 10:57","2488","41:28","Team A","Gaimin Gladiators","Tidehunter  Disruptor  Techies  Ember Spirit  Monkey King","9Pandas","Axe  Morphling  Pugna  Batrider  Chaos Knight","Team A"
"7206735347","15439","19 Jun 2023 12:21","2320","38:40","Team A","9Pandas","Earthshaker  Juggernaut  Doom  Shadow Demon  Disruptor","Gaimin Gladiators","Axe  Mirana  Undying  Ember Spirit  Terrorblade","Team A"
"7207408009","15353","19 Jun 2023 08:56","2599","43:19","Team B","GRIN Esports","Sven  Tidehunter  Pugna  Disruptor  Timbersaw","CDUB Esports","Razor  Batrider  Spirit Breaker  Rubick  Ember Spirit","Team A"
"7207532027","14783","19 Jun 2023 10:51","1104","18:24","Team B","Lava Esports","Mirana  Templar Assassin  Lycan  Disruptor  Pangolier","Ravens","Axe  Morphling  Undying  Techies  Primal Beast","Team A"
"7207691832","15353","20 Jun 2023 03:20","2504","41:44","Team B","Wildcard","Puck  Doom  Lycan  Disruptor  Techies","American goons","Morphling  Enchantress  Undying  Underlord  Primal Beast","Team A"
"7208187024","15439","20 Jun 2023 02:25","2096","34:56","Team A","BetBoom Team","Storm Spirit  Faceless Void  Pugna  Doom  Disruptor","PSG.LGD","Crystal Maiden  Puck  Alchemist  Keeper of the Light  Timbersaw","Team A"
"7208503084","15439","20 Jun 2023 05:57","2016","33:36","Team B","9Pandas","Juggernaut  Lina  Doom  Disruptor  Techies","Evil Geniuses","Rubick  Medusa  Skywrath Mage  Legion Commander  Primal Beast","Team B"
"7208583936","15439","20 Jun 2023 07:03","3284","54:44","Team A","9Pandas","Morphling  Enigma  Doom  Disruptor  Ember Spirit","Evil Geniuses","Anti-Mage  Lina  Lion  Undying  Primal Beast","Team A"
"7208602659","14783","20 Jun 2023 07:08","1991","33:11","Team A","The Cut","Lina  Broodmother  Disruptor  Bristleback  Techies","NoPing Esports","Shadow Fiend  Pugna  Clockwerk  Underlord  Marci","Team A"
"7209310817","15439","21 Jun 2023 10:55","2240","37:20","Team A","BetBoom Team","Storm Spirit  Pugna  Enchantress  Disruptor  Monkey King","Talon","Puck  Batrider  Silencer  Slark  Underlord","Team A"
"7209931337","14783","21 Jun 2023 06:59","2945","49:05","Team B","Lava Esports","Bloodseeker  Batrider  Disruptor  Timbersaw  Ember Spirit","noMERCY","Morphling  Puck  Venomancer  Pugna  Spirit Breaker","Team A"
"7210035341","15439","21 Jun 2023 08:30","3157","52:37","Team A","Gaimin Gladiators","Queen of Pain  Faceless Void  Lycan  Undying  Disruptor","Team Aster","Storm Spirit  Templar Assassin  Rubick  Timbersaw  Snapfire","Team A"
"7210147383","15439","21 Jun 2023 10:06","1155","19:15","Team B","Team Spirit","Queen of Pain  Spirit Breaker  Disruptor  Visage  Slark","Evil Geniuses","Morphling  Puck  Broodmother  Skywrath Mage  Techies","Team A"
"7210193343","15439","21 Jun 2023 10:59","2439","40:39","Team B","Team Spirit","Queen of Pain  Faceless Void  Disruptor  Visage  Techies","Evil Geniuses","Dark Seer  Broodmother  Medusa  Skywrath Mage  Earth Spirit","Team A"
"7210248284","15353","21 Jun 2023 11:59","2299","38:19","Team A","Nexus Titans","Zeus  Pugna  Disruptor  Timbersaw  Monkey King","TiltedBoys","Bloodseeker  Enchantress  Doom  Rubick  Snapfire","Team A"
"7210335746","15353","22 Jun 2023 02:38","2414","40:14","Team A","TiltedBoys","Disruptor  Slark  Legion Commander  Techies  Ember Spirit","Nexus Titans","Zeus  Pugna  Batrider  Naga Siren  Void Spirit","Team A"
"7210697231","15439","22 Jun 2023 10:55","1914","31:54","Team A","9Pandas","Dark Seer  Broodmother  Disruptor  Techies  Ember Spirit","BetBoom Team","Doom  Rubick  Terrorblade  Oracle  Primal Beast","Team A"
"7211146493","15475","22 Jun 2023 05:02","2638","43:58","Team B","Quest Esports","Morphling  Puck  Doom  Undying  Disruptor","Nigma Galaxy","Lion  Wraith King  Chen  Keeper of the Light  Timbersaw","Team A"
"7211268767","15475","22 Jun 2023 06:17","2080","34:40","Team A","Quest Esports","Juggernaut  Queen of Pain  Disruptor  Timbersaw  Techies","Nigma Galaxy","Axe  Bloodseeker  Pugna  Undying  Keeper of the Light","Team B"
"7211341863","15439","22 Jun 2023 07:23","1790","29:50","Team A","PSG.LGD","Beastmaster  Undying  Disruptor  Medusa  Ember Spirit","Team Aster","Earthshaker  Enigma  Elder Titan  Techies  Terrorblade","Team A"
"7211537953","14783","22 Jun 2023 10:01","1994","33:14","Team A","The Cut","Clinkz  Spirit Breaker  Disruptor  Bristleback  Legion Commander","Infamous Gaming","Bloodseeker  Lion  Enchantress  Broodmother  Pangolier","Team A"
"7211570260","15439","22 Jun 2023 10:38","1836","30:36","Team B","Gaimin Gladiators","Bloodseeker  Leshrac  Shadow Demon  Disruptor  Timbersaw","Evil Geniuses","Templar Assassin  Dark Seer  Batrider  Spirit Breaker  Silencer","Team B"
"7211591284","14783","22 Jun 2023 10:54","1393","23:13","Team B","The Cut","Morphling  Zeus  Broodmother  Disruptor  Techies","Infamous Gaming","Enchantress  Skywrath Mage  Terrorblade  Snapfire  Primal Beast","Team B"
"7211624243","15439","22 Jun 2023 11:40","1540","25:40","Team A","Evil Geniuses","Sven  Dark Seer  Doom  Spirit Breaker  Disruptor","Gaimin Gladiators","Beastmaster  Faceless Void  Chen  Rubick  Timbersaw","Team B"
"7211629220","14783","22 Jun 2023 11:43","2079","34:39","Team B","The Cut","Lina  Clinkz  Spirit Breaker  Disruptor  Terrorblade","Infamous Gaming","Windranger  Faceless Void  Broodmother  Elder Titan  Techies","Team B"
"7211774420","15366","23 Jun 2023 04:04","2007","33:27","Team A","Lava Esports","Juggernaut  Broodmother  Disruptor  Pangolier  Snapfire","Los moticucos","Beastmaster  Batrider  Shadow Demon  Medusa  Timbersaw","Team B"
"7212229379","15470","23 Jun 2023 01:04","2907","48:27","Team B","Myth Avenue Gaming","Morphling  Batrider  Undying  Disruptor  Pangolier","Made in Philippines","Bloodseeker  Mirana  Techies  Ember Spirit  Underlord","Team B"
"7212242981","15375","23 Jun 2023 01:16","2268","37:48","Team B","UD VESSUWAN","Batrider  Brewmaster  Disruptor  Naga Siren  Ember Spirit","IHC","Morphling  Pugna  Alchemist  Magnus  Techies","Team B"
"7212375637","14691","23 Jun 2023 03:00","1602","26:42","Team B","RAM SQUAD","Juggernaut  Storm Spirit  Venomancer  Spirit Breaker  Disruptor","Ancient Tribe","Morphling  Dark Seer  Jakiro  Techies  Void Spirit","Team B"
"7212635947","15352","23 Jun 2023 05:54","2622","43:42","Team A","Nigma Galaxy","Morphling  Batrider  Chen  Spirit Breaker  Disruptor","KZ TEAM","Axe  Pugna  Viper  Skywrath Mage  Terrorblade","Team A"
"7212756212","15475","23 Jun 2023 07:24","2420","40:20","Team B","Nigma Galaxy","Beastmaster  Wraith King  Enchantress  Disruptor  Keeper of the Light","Team Secret","Bloodseeker  Enigma  Clinkz  Void Spirit  Mars","Team A"
"7213007410","14783","23 Jun 2023 10:57","1766","29:26","Team B","Ravens","Beastmaster  Disruptor  Naga Siren  Skywrath Mage  Ember Spirit","noMERCY","Vengeful Spirit  Clockwerk  Spirit Breaker  Medusa  Snapfire","Team B"
"7213229421","15353","24 Jun 2023 04:43","2034","33:54","Team A","The Cut","Windranger  Lifestealer  Doom  Disruptor  Techies","GRIN Esports","Sven  Lich  Beastmaster  Batrider  Timbersaw","Team B"
"7213284023","15384","24 Jun 2023 05:59","2023","33:43","Team A","Team Disillusion","Doom  Spirit Breaker  Lycan  Disruptor  Muerta","iG.Vitality","Morphling  Puck  Pugna  Undying  Legion Commander","Team A"
"7213701797","15384","24 Jun 2023 12:59","2287","38:07","Team B","Supernova","Juggernaut  Dark Seer  Enchantress  Broodmother  Disruptor","Team Zero","Crystal Maiden  Batrider  Naga Siren  Timbersaw  Void Spirit","Team B"
"7213711359","15470","24 Jun 2023 01:05","2743","45:43","Team A","Polaris Esports","Enigma  Clockwerk  Disruptor  Naga Siren  Snapfire","Geek Slate","Juggernaut  Queen of Pain  Venomancer  Pugna  Broodmother","Team B"
"7213812081","15470","24 Jun 2023 02:21","1816","30:16","Team A","Polaris Esports","Templar Assassin  Clockwerk  Disruptor  Legion Commander  Snapfire","Geek Slate","Storm Spirit  Pugna  Spirit Breaker  Naga Siren  Mars","Team B"
"7215525382","15439","25 Jun 2023 04:54","2683","44:43","Team A","BetBoom Team","Enchantress  Disruptor  Legion Commander  Ember Spirit  Terrorblade","Gaimin Gladiators","Bloodseeker  Beastmaster  Dragon Knight  Undying  Techies","Team B"
"7215615338","15352","25 Jun 2023 05:50","2705","45:05","Team A","Old G","Dark Seer  Spirit Breaker  Undying  Disruptor  Medusa","Ancient Tribe","Beastmaster  Pugna  Viper  Terrorblade  Snapfire","Team B"
"7217184825","15336","26 Jun 2023 08:05","1431","23:51","Team B","StoRm","Bloodseeker  Queen of Pain  Broodmother  Disruptor  Techies","Natus Vincere","Axe  Storm Spirit  Weaver  Undying  Keeper of the Light","Team B"
"7219467682","15375","28 Jun 2023 02:45","2131","35:31","Team B","Myth Avenue Gaming","Clockwerk  Leshrac  Disruptor  Naga Siren  Timbersaw","Neon Esports","Morphling  Undying  Rubick  Earth Spirit  Primal Beast","Team B"
"7220124032","15353","28 Jun 2023 10:59","2044","34:04","Team A","Ravens","Spirit Breaker  Rubick  Disruptor  Medusa  Ember Spirit","CDUB Esports","Juggernaut  Storm Spirit  Lion  Pugna  Elder Titan","Team A"
"7220175364","15353","29 Jun 2023 12:06","2151","35:51","Team B","The Cut","Sven  Queen of Pain  Broodmother  Disruptor  Skywrath Mage","Ravens","Beastmaster  Clinkz  Naga Siren  Techies  Void Spirit","Team B"
"7220221070","15353","29 Jun 2023 01:16","2447","40:47","Team B","CDUB Esports","Beastmaster  Pugna  Disruptor  Troll Warlord  Legion Commander","The Cut","Razor  Lion  Broodmother  Silencer  Bristleback","Team A"
"7220380359","15438","29 Jun 2023 06:25","2356","39:16","Team A","nouns","Storm Spirit  Pugna  Lycan  Disruptor  Terrorblade","PSG.LGD","Anti-Mage  Doom  Undying  Skywrath Mage  Ember Spirit","Team B"
"7220422125","15438","29 Jun 2023 07:32","893","14:53","Team B","9Pandas","Juggernaut  Tinker  Disruptor  Legion Commander  Techies","Gaimin Gladiators","Dark Seer  Enchantress  Rubick  Medusa  Ember Spirit","Team B"
"7220465818","15438","29 Jun 2023 08:34","2936","48:56","Team B","Team Spirit","Bloodseeker  Storm Spirit  Pugna  Disruptor  Mars","Tundra Esports","Lion  Dark Seer  Enchantress  Ursa  Timbersaw","Team A"
"7220548968","15438","29 Jun 2023 10:33","1835","30:35","Team B","Team Aster","Enigma  Templar Assassin  Disruptor  Timbersaw  Ember Spirit","INVICTUS GAMING","Anti-Mage  Omniknight  Batrider  Spirit Breaker  Undying","Team A"
"7220589856","15438","29 Jun 2023 11:19","2379","39:39","Team A","nouns","Anti-Mage  Windranger  Pugna  Disruptor  Visage","Evil Geniuses","Morphling  Undying  Rubick  Mars  Primal Beast","Team A"
"7221667905","15438","30 Jun 2023 04:51","2124","35:24","Team B","Execration","Morphling  Venomancer  Broodmother  Batrider  Disruptor","Team Liquid","Storm Spirit  Pugna  Dark Seer  Slark  Monkey King","Team B"
"7221673173","15438","30 Jun 2023 05:06","3420","57:00","Team A","beastcoast","Morphling  Disruptor  Timbersaw  Elder Titan  Ember Spirit","Blacklist Rivalry","Lina  Tidehunter  Clockwerk  Rubick  Muerta","Team A"
"7221725993","15438","30 Jun 2023 06:39","2290","38:10","Team A","nouns","Anti-Mage  Lycan  Disruptor  Keeper of the Light  Snapfire","BetBoom Team","Morphling  Kunkka  Doom  Undying  Rubick","Team B"
"7221808845","15438","30 Jun 2023 08:53","3031","50:31","Team B","Team Aster","Storm Spirit  Pugna  Disruptor  Underlord  Monkey King","Team Liquid","Mirana  Broodmother  Slark  Skywrath Mage  Ember Spirit","Team B"
"7223038899","15438","01 Jul 2023 05:07","1890","31:30","Team B","Team Spirit","Lion  Ursa  Disruptor  Visage  Pangolier","Team Liquid","Morphling  Windranger  Enchantress  Lycan  Timbersaw","Team B"
"7223088375","15438","01 Jul 2023 06:26","1801","30:01","Team B","Evil Geniuses","Broodmother  Brewmaster  Disruptor  Techies  Monkey King","9Pandas","Storm Spirit  Beastmaster  Pugna  Alchemist  Skywrath Mage","Team B"
"7223093787","15438","01 Jul 2023 06:26","2849","47:29","Team A","PSG.LGD","Morphling  Storm Spirit  Spirit Breaker  Disruptor  Timbersaw","BetBoom Team","Bloodseeker  Tidehunter  Lich  Techies  Pangolier","Team B"
"7223148170","15438","01 Jul 2023 07:40","1847","30:47","Team A","BetBoom Team","Juggernaut  Tidehunter  Enchantress  Disruptor  Ember Spirit","PSG.LGD","Clockwerk  Clinkz  Doom  Techies  Primal Beast","Team B"
"7223260756","15438","01 Jul 2023 09:46","2082","34:42","Team A","beastcoast","Batrider  Lycan  Shadow Demon  Disruptor  Naga Siren","Team Spirit","Morphling  Sand King  Lion  Spirit Breaker  Pangolier","Team B"
"7224107624","14783","01 Jul 2023 08:23","1513","25:13","Team A","The Cut","Bloodseeker  Tidehunter  Disruptor  Legion Commander  Techies","SAND KING GÓMEZ","Clockwerk  Magnus  Skywrath Mage  Ember Spirit  Muerta","Team B"
"7224477788","15438","02 Jul 2023 04:00","3110","51:50","Team A","Shopify Rebellion","Beastmaster  Disruptor  Medusa  Timbersaw  Techies","Team Spirit","Juggernaut  Storm Spirit  Tidehunter  Lich  Rubick","Team B"
"7224565202","15438","02 Jul 2023 06:00","1956","32:36","Team B","beastcoast","Shadow Fiend  Batrider  Doom  Disruptor  Timbersaw","INVICTUS GAMING","Venomancer  Faceless Void  Spirit Breaker  Brewmaster  Ember Spirit","Team A"
"7224766675","15438","02 Jul 2023 09:51","1561","26:01","Team B","Team Liquid","Phantom Lancer  Shadow Demon  Disruptor  Timbersaw  Mars","Tundra Esports","Bloodseeker  Tiny  Pugna  Medusa  Pangolier","Team B"
"7224840652","15438","02 Jul 2023 10:51","3214","53:34","Team B","BetBoom Team","Storm Spirit  Disruptor  Keeper of the Light  Underlord  Terrorblade","BLEED","Puck  Pugna  Enchantress  Lycan  Naga Siren","Team B"
"7224932229","15438","02 Jul 2023 12:12","2663","44:23","Team A","BetBoom Team","Axe  Storm Spirit  Disruptor  Keeper of the Light  Terrorblade","BLEED","Juggernaut  Puck  Enigma  Beastmaster  Pugna","Team B"
"7225542007","14783","02 Jul 2023 07:07","2325","38:45","Team B","The Cut","Tidehunter  Disruptor  Skywrath Mage  Ember Spirit  Terrorblade","noMERCY","Templar Assassin  Clockwerk  Rubick  Timbersaw  Pangolier","Team B"
"7228674421","15438","05 Jul 2023 06:24","1998","33:18","Team A","PSG.LGD","Windranger  Enigma  Broodmother  Silencer  Disruptor","Team Liquid","Bloodseeker  Storm Spirit  Tidehunter  Pugna  Techies","Team B"
"7229857152","15438","06 Jul 2023 04:00","2648","44:08","Team B","Team Spirit","Bloodseeker  Clockwerk  Dark Seer  Disruptor  Ember Spirit","PSG.LGD","Silencer  Phoenix  Mars  Marci  Primal Beast","Team A"
"7230010951","15438","06 Jul 2023 08:30","2178","36:18","Team A","beastcoast","Sven  Leshrac  Enchantress  Disruptor  Mars","Shopify Rebellion","Razor  Clockwerk  Broodmother  Rubick  Snapfire","Team A"
"7230113893","15058","06 Jul 2023 10:54","2874","47:54","Team A","Manta Esports","Queen of Pain  Disruptor  Naga Siren  Timbersaw  Techies","VIETNAM","Bloodseeker  Enigma  Enchantress  Spirit Breaker  Snapfire","Team B"
"7230914837","14783","06 Jul 2023 10:42","2494","41:34","Team B","noMERCY","Sven  Clockwerk  Disruptor  Visage  Pangolier","Infamous Gaming","Queen of Pain  Pugna  Dark Seer  Monkey King  Dark Willow","Team B"
"7231242153","15438","07 Jul 2023 07:54","3611","1:00:11","Team B","9Pandas","Morphling  Broodmother  Rubick  Disruptor  Keeper of the Light","beastcoast","Leshrac  Silencer  Medusa  Grimstroke  Mars","Team B"
"7231634088","15438","07 Jul 2023 03:05","2359","39:19","Team A","Gaimin Gladiators","Batrider  Doom  Disruptor  Naga Siren  Timbersaw","Quest Esports","Lina  Faceless Void  Broodmother  Techies  Phoenix","Team A"
"7233123840","15438","08 Jul 2023 03:21","2877","47:57","Team A","Team Liquid","Mirana  Morphling  Lycan  Disruptor  Ember Spirit","Quest Esports","Broodmother  Shadow Demon  Rubick  Terrorblade  Snapfire","Team A"
"7234263112","15438","09 Jul 2023 10:00","2888","48:08","Team A","Gaimin Gladiators","Dark Seer  Disruptor  Timbersaw  Techies  Terrorblade","Team Liquid","Juggernaut  Lich  Broodmother  Batrider  Ember Spirit","Team A"
"7235418298","14783","10 Jul 2023 01:04","1634","27:14","Team B","Mad Kings Esports","Bounty Hunter  Alchemist  Disruptor  Phoenix  Monkey King","Infamous Gaming","Lifestealer  Enchantress  Broodmother  Skywrath Mage  Ember Spirit","Team B"
"7236690605","14783","10 Jul 2023 11:27","2025","33:45","Team B","Thunder Awaken","Storm Spirit  Beastmaster  Pugna  Disruptor  Slark","NoPing Esports","Tiny  Luna  Leshrac  Batrider  Undying","Team A"
"7236738789","14783","11 Jul 2023 12:36","2060","34:20","Team B","Thunder Awaken","Morphling  Pudge  Undying  Disruptor  Snapfire","NoPing Esports","Mirana  Storm Spirit  Broodmother  Spirit Breaker  Naga Siren","Team A"
"7237731504","14783","11 Jul 2023 07:08","3374","56:14","Team B","noMERCY","Disruptor  Slark  Timbersaw  Techies  Primal Beast","NoPing Esports","Puck  Doom  Undying  Rubick  Medusa","Team B"
"7248385003","15475","19 Jul 2023 04:45","2200","36:40","Team A","Team Liquid","Razor  Faceless Void  Leshrac  Disruptor  Io","Virtus.pro","Shadow Fiend  Clockwerk  Batrider  Snapfire  Mars","Team A"
"7248392645","15475","19 Jul 2023 04:51","1264","21:04","Team A","Entity","Tidehunter  Death Prophet  Disruptor  Terrorblade  Primal Beast","TSM","Tinker  Dark Seer  Chen  Lycan  Snapfire","Team A"
"7248527564","15475","19 Jul 2023 06:28","1798","29:58","Team B","Entity","Morphling  Lion  Invoker  Disruptor  Primal Beast","TSM","Chen  Spirit Breaker  Visage  Terrorblade  Snapfire","Team B"
"7248538199","15475","19 Jul 2023 06:37","2168","36:08","Team A","beastcoast","Clockwerk  Dark Seer  Batrider  Disruptor  Terrorblade","Xtreme Gaming","Bloodseeker  Storm Spirit  Venomancer  Silencer  Mars","Team B"
"7249304747","15475","20 Jul 2023 11:58","2662","44:22","Team A","Entity","Shadow Fiend  Batrider  Disruptor  Ember Spirit  Mars","Execration","Storm Spirit  Beastmaster  Pugna  Clockwerk  Muerta","Team B"
"7249735049","15475","20 Jul 2023 05:49","1776","29:36","Team B","Entity","Bloodseeker  Windranger  Clockwerk  Invoker  Disruptor","OG","Puck  Spirit Breaker  Rubick  Naga Siren  Keeper of the Light","Team B"
"7251017908","15475","21 Jul 2023 05:52","1834","30:34","Team A","Gaimin Gladiators","Mirana  Broodmother  Disruptor  Underlord  Pangolier","PSG.LGD","Jakiro  Ursa  Spirit Breaker  Ember Spirit  Phoenix","Team A"
"7252001940","15475","22 Jul 2023 12:13","3008","50:08","Team A","PSG.LGD","Dragon Knight  Enchantress  Disruptor  Medusa  Timbersaw","Xtreme Gaming","Bloodseeker  Storm Spirit  Silencer  Skywrath Mage  Legion Commander","Team B"
"7252370103","15475","22 Jul 2023 04:56","3973","1:06:13","Team A","PSG.LGD","Luna  Dragon Knight  Batrider  Disruptor  Timbersaw","Team Spirit","Juggernaut  Storm Spirit  Lion  Beastmaster  Silencer","Team B"
"7252482083","15475","22 Jul 2023 06:12","3087","51:27","Team A","Quest Esports","Tidehunter  Rubick  Disruptor  Naga Siren  Void Spirit","Gaimin Gladiators","Lion  Beastmaster  Pugna  Broodmother  Pangolier","Team A"
"7253504806","15475","23 Jul 2023 12:16","2339","38:59","Team A","Team Spirit","Puck  Tidehunter  Broodmother  Disruptor  Snapfire","OG","Crystal Maiden  Razor  Storm Spirit  Beastmaster  Keeper of the Light","Team B"
"7253685856","15475","23 Jul 2023 02:49","2634","43:54","Team B","Team Aster","Tidehunter  Leshrac  Rubick  Disruptor  Terrorblade","TSM","Templar Assassin  Dark Seer  Batrider  Timbersaw  Elder Titan","Team B"
"7254038790","15475","23 Jul 2023 06:48","1882","31:22","Team A","Shopify Rebellion","Puck  Lycan  Disruptor  Keeper of the Light  Timbersaw","Talon","Storm Spirit  Tidehunter  Faceless Void  Batrider  Rubick","Team B"
"7254792846","15475","24 Jul 2023 11:00","2450","40:50","Team B","9Pandas","Night Stalker  Broodmother  Doom  Lycan  Disruptor","Team Spirit","Axe  Storm Spirit  Sven  Tiny  Ancient Apparition","Team A"
"7254796354","15475","24 Jul 2023 11:08","3268","54:28","Team B","Xtreme Gaming","Windranger  Meepo  Disruptor  Slark  Elder Titan","Evil Geniuses","Storm Spirit  Lich  Enigma  Keeper of the Light  Monkey King","Team B"
"7256390936","15534","25 Jul 2023 03:48","1773","29:33","Team A","One Move","Templar Assassin  Dark Seer  Batrider  Disruptor  Monkey King","Neon Esports","Bloodseeker  Storm Spirit  Clockwerk  Silencer  Visage","Team A"
"7257852466","15475","26 Jul 2023 05:40","3664","1:01:04","Team A","Gaimin Gladiators","Dark Seer  Disruptor  Medusa  Pangolier  Snapfire","Tundra Esports","Queen of Pain  Broodmother  Batrider  Ancient Apparition  Spirit Breaker","Team A"
"7258942295","15534","27 Jul 2023 03:01","1285","21:25","Team B","Thunder Awaken","Faceless Void  Doom  Disruptor  Skywrath Mage  Pangolier","Neon Esports","Enchantress  Lycan  Rubick  Abaddon  Primal Beast","Team B"
"7260006364","15475","28 Jul 2023 11:03","3043","50:43","Team A","Gaimin Gladiators","Juggernaut  Windranger  Rubick  Disruptor  Underlord","Quest Esports","Mirana  Queen of Pain  Terrorblade  Phoenix  Mars","Team A"
"7260749992","15475","28 Jul 2023 08:42","2318","38:38","Team A","Gaimin Gladiators","Undying  Disruptor  Medusa  Underlord  Pangolier","BetBoom Team","Morphling  Tidehunter  Elder Titan  Techies  Primal Beast","Team A"
"7260834118","15475","28 Jul 2023 09:50","2391","39:51","Team B","Gaimin Gladiators","Leshrac  Dark Seer  Undying  Disruptor  Medusa","BetBoom Team","Juggernaut  Storm Spirit  Tidehunter  Batrider  Techies","Team A"
"7261341460","15058","29 Jul 2023 08:40","1581","26:21","Team B","Yangon Galacticos","Storm Spirit  Broodmother  Disruptor  Keeper of the Light  Slark","Gengar","Puck  Beastmaster  Silencer  Troll Warlord  Skywrath Mage","Team B"
"7261721075","15475","29 Jul 2023 12:38","2966","49:26","Team B","Team Spirit","Lion  Beastmaster  Batrider  Disruptor  Naga Siren","Team Liquid","Dragon Knight  Undying  Medusa  Techies  Mars","Team B"
"7261735595","15058","29 Jul 2023 02:28","1614","26:54","Team A","Neon Esports","Juggernaut  Disruptor  Skywrath Mage  Legion Commander  Ember Spirit","Manta Esports","Dragon Knight  Silencer  Rubick  Slark  Primal Beast","Team A"
"7262210509","15475","29 Jul 2023 06:30","3045","50:45","Team A","Gaimin Gladiators","Bloodseeker  Tidehunter  Leshrac  Disruptor  Io","Talon","Razor  Undying  Keeper of the Light  Ember Spirit  Terrorblade","Team B"
"7265209090","14783","31 Jul 2023 09:10","3872","1:04:32","Team A","x5 Gaming","Windranger  Clockwerk  Disruptor  Pangolier  Snapfire","AcatSuki","Enigma  Spirit Breaker  Rubick  Timbersaw  Terrorblade","Team A"
"7265313390","14783","31 Jul 2023 10:43","2334","38:54","Team A","AcatSuki","Drow Ranger  Shadow Fiend  Beastmaster  Disruptor  Snapfire","x5 Gaming","Storm Spirit  Enigma  Spirit Breaker  Silencer  Abaddon","Team B"
"7265821143","15472","01 Aug 2023 11:25","2983","49:43","Team B","SPAWN Team","Lion  Broodmother  Disruptor  Slark  Timbersaw","Made in Philippines","Batrider  Undying  Medusa  Pangolier  Primal Beast","Team B"
"7266384094","14691","01 Aug 2023 06:39","1505","25:05","Team A","Sibe Team","Storm Spirit  Undying  Disruptor  Naga Siren  Underlord","Multicast","Queen of Pain  Pugna  Broodmother  Timbersaw  Techies","Team A"
