"Match ID","League","Start Date","Duration (s)","Duration (mm:ss)","Radiant Team","Team A","Team A Heroes","Team B","Team B Heroes","Winner"
"7179345657","15286","31 May 2023 10:00","2148","35:48","Team A","KZ TEAM","Storm Spirit  Pugna  Rubick  Medusa  Underlord","IVY","Mirana  Queen of Pain  Magnus  Winter Wyvern  Void Spirit","Team B"
"7179513968","15374","31 May 2023 12:55","2560","42:40","Team A","Talon","Enchantress  Doom  Shadow Demon  Terrorblade  Void Spirit","BOOM Esports","Mirana  Kunkka  Naga Siren  Medusa  Techies","Team B"
"7179582844","14691","31 May 2023 01:45","2595","43:15","Team B","UALEIKUMNIHAO","Storm Spirit  Enigma  Lifestealer  Enchantress  Spirit Breaker","KZ TEAM","Crystal Maiden  Mirana  Batrider  Void Spirit  Primal Beast","Team B"
"7179669869","15351","31 May 2023 02:54","2522","42:02","Team A","Entity","Shadow Fiend  Beastmaster  Undying  Techies  Pangolier","Luna Galaxy","Mirana  Lich  Faceless Void  Doom  Void Spirit","Team B"
"7179691698","15374","31 May 2023 03:08","1991","33:11","Team A","BLEED","Beastmaster  Silencer  Terrorblade  Dark Willow  Void Spirit","Army Geniuses Mansion","Mirana  Kunkka  Faceless Void  Pugna  Spirit Breaker","Team A"
"7180139494","14691","31 May 2023 08:00","2064","34:24","Team B","RAM SQUAD","Crystal Maiden  Morphling  Storm Spirit  Batrider  Shadow Demon","UALEIKUMNIHAO","Mirana  Ancient Apparition  Spirit Breaker  Medusa  Pangolier","Team B"
"7180487978","15350","01 Jun 2023 02:55","1926","32:06","Team B","SAND KING GÓMEZ","Morphling  Storm Spirit  Clockwerk  Rubick  Mars","felt","Mirana  Lich  Beastmaster  Magnus  Void Spirit","Team B"
"7180820744","15286","01 Jun 2023 10:57","1720","28:40","Team A","Sibe Team","Sven  Pugna  Magnus  Skywrath Mage  Ember Spirit","NAVI Junior","Mirana  Beastmaster  Terrorblade  Oracle  Void Spirit","Team A"
"7180946227","15335","01 Jun 2023 01:00","2736","45:36","Team A","9Pandas","Morphling  Windranger  Lich  Magnus  Void Spirit","HYDRA","Mirana  Undying  Ember Spirit  Underlord  Terrorblade","Team A"
"7181201498","15335","01 Jun 2023 04:00","2231","37:11","Team B","Team Spirit","Storm Spirit  Sven  Lich  Pugna  Underlord","One Move","Mirana  Brewmaster  Techies  Ember Spirit  Void Spirit","Team A"
"7181419727","14691","01 Jun 2023 06:15","2117","35:17","Team B","IVY","Storm Spirit  Pugna  Spirit Breaker  Naga Siren  Visage","KZ TEAM","Mirana  Bounty Hunter  Batrider  Shadow Demon  Void Spirit","Team A"
"7182054004","15374","02 Jun 2023 07:08","1757","29:17","Team A","Made in Philippines","Bloodseeker  Storm Spirit  Pugna  Spirit Breaker  Dark Willow","BLEED","Mirana  Medusa  Abaddon  Techies  Ember Spirit","Team B"
"7182176119","15374","02 Jun 2023 10:00","2179","36:19","Team A","Team SMG","Crystal Maiden  Doom  Alchemist  Keeper of the Light  Pangolier","BOOM Esports","Mirana  Sven  Magnus  Ember Spirit  Snapfire","Team A"
"7182637411","15351","02 Jun 2023 04:19","3857","1:04:17","Team A","Tundra Esports","Beastmaster  Queen of Pain  Venomancer  Keeper of the Light  Slark","Team Secret","Mirana  Batrider  Medusa  Magnus  Ember Spirit","Team A"
"7182728678","15286","02 Jun 2023 05:15","1108","18:28","Team A","Moneymakers","Faceless Void  Pugna  Disruptor  Magnus  Timbersaw","Virtus.pro","Mirana  Spirit Breaker  Silencer  Monkey King  Void Spirit","Team B"
"7182854433","14691","02 Jun 2023 06:34","1247","20:47","Team A","nouns","Venomancer  Enchantress  Bounty Hunter  Pangolier  Void Spirit","KZ TEAM","Mirana  Windranger  Batrider  Magnus  Terrorblade","Team B"
"7182925373","15351","02 Jun 2023 07:26","1857","30:57","Team B","Entity","Pudge  Venomancer  Spirit Breaker  Visage  Slark","OG","Mirana  Storm Spirit  Necrophos  Pugna  Medusa","Team B"
"7183172943","15351","02 Jun 2023 10:46","2809","46:49","Team A","Gaimin Gladiators","Batrider  Shadow Demon  Meepo  Medusa  Pangolier","Luna Galaxy","Anti-Mage  Mirana  Faceless Void  Silencer  Void Spirit","Team A"
"7183311378","15269","03 Jun 2023 01:46","2840","47:20","Team A","Vivo Keyd Stars","Storm Spirit  Pugna  Templar Assassin  Bounty Hunter  Doom","Acatsuki","Mirana  Puck  Silencer  Magnus  Underlord","Team A"
"7183476668","15383","03 Jun 2023 06:04","2315","38:35","Team A","Aster.Aries","Bane  Pudge  Shadow Demon  Void Spirit  Marci","Team Bright","Mirana  Phantom Lancer  Doom  Winter Wyvern  Pangolier","Team A"
"7183694762","15286","03 Jun 2023 10:02","3535","58:55","Team A","Sibe Team","Bloodseeker  Crystal Maiden  Storm Spirit  Pugna  Doom","KZ TEAM","Mirana  Puck  Leshrac  Undying  Underlord","Team B"
"7184007659","15383","03 Jun 2023 02:09","2666","44:26","Team B","PSG.LGD","Axe  Ursa  Techies  Oracle  Void Spirit","Xtreme Gaming","Mirana  Storm Spirit  Batrider  Timbersaw  Terrorblade","Team B"
"7184109708","15335","03 Jun 2023 03:21","1766","29:26","Team A","Nemiga Gaming","Enchantress  Doom  Rubick  Terrorblade  Pangolier","Virtus.pro","Mirana  Windranger  Beastmaster  Alchemist  Techies","Team B"
"7184181606","15286","03 Jun 2023 04:03","2819","46:59","Team A","StoRm","Storm Spirit  Silencer  Skywrath Mage  Legion Commander  Monkey King","Natus Vincere","Mirana  Riki  Magnus  Oracle  Void Spirit","Team B"
"7184474623","15286","03 Jun 2023 07:00","2918","48:38","Team A","Trouble Makers Reborn","Ursa  Skywrath Mage  Legion Commander  Ember Spirit  Grimstroke","Luna Galaxy","Mirana  Batrider  Lycan  Magnus  Timbersaw","Team B"
"7184628014","15350","03 Jun 2023 08:58","2138","35:38","Team B","DogChamp","Windranger  Lich  Techies  Underlord  Pangolier","Shopify Rebellion","Mirana  Shadow Fiend  Batrider  Void Spirit  Mars","Team B"
"7184794957","15350","03 Jun 2023 11:17","1631","27:11","Team A","DogChamp","Sven  Silencer  Timbersaw  Dark Willow  Void Spirit","Shopify Rebellion","Mirana  Windranger  Pugna  Magnus  Ember Spirit","Team B"
"7184900410","15350","04 Jun 2023 01:21","1822","30:22","Team B","TSM","Pudge  Venomancer  Timbersaw  Techies  Terrorblade","SAND KING GÓMEZ","Mirana  Magnus  Legion Commander  Monkey King  Void Spirit","Team A"
"7184935145","15269","04 Jun 2023 02:12","2008","33:28","Team B","noMERCY","Phantom Lancer  Windranger  Clockwerk  Underlord  Snapfire","Vivo Keyd Stars","Mirana  Morphling  Spirit Breaker  Treant Protector  Timbersaw","Team B"
"7184984447","15350","04 Jun 2023 03:42","1640","27:20","Team B","ALPHA","Bounty Hunter  Slark  Techies  Ember Spirit  Primal Beast","nouns","Mirana  Enigma  Batrider  Magnus  Void Spirit","Team B"
"7185980523","14691","04 Jun 2023 05:10","1680","28:00","Team A","IVY","Lich  Death Prophet  Timbersaw  Techies  Void Spirit","KZ TEAM","Mirana  Beastmaster  Pugna  Templar Assassin  Rubick","Team B"
"7186302717","15351","04 Jun 2023 08:57","2037","33:57","Team A","OG","Earthshaker  Templar Assassin  Bounty Hunter  Batrider  Medusa","Luna Galaxy","Anti-Mage  Mirana  Spirit Breaker  Naga Siren  Void Spirit","Team A"
"7186595763","15350","05 Jun 2023 02:55","2607","43:27","Team A","B8","Vengeful Spirit  Windranger  Beastmaster  Queen of Pain  Enchantress","felt","Bloodseeker  Mirana  Lich  Centaur Warrunner  Timbersaw","Team B"
"7186976751","15374","05 Jun 2023 12:06","1915","31:55","Team A","Execration","Bloodseeker  Puck  Windranger  Venomancer  Underlord","Blacklist Rivalry","Mirana  Storm Spirit  Pugna  Doom  Monkey King","Team B"
"7187064528","15335","05 Jun 2023 01:28","1475","24:35","Team B","Nemiga Gaming","Morphling  Tiny  Undying  Magnus  Techies","HYDRA","Mirana  Pugna  Doom  Arc Warden  Pangolier","Team B"
"7187134629","15335","05 Jun 2023 02:21","3051","50:51","Team B","One Move","Morphling  Windranger  Tidehunter  Rubick  Techies","HYDRA","Mirana  Lich  Magnus  Monkey King  Void Spirit","Team B"
"7187282133","15351","05 Jun 2023 03:56","2070","34:30","Team B","Team Liquid","Nyx Assassin  Slark  Techies  Winter Wyvern  Pangolier","Quest Esports","Mirana  Queen of Pain  Shadow Demon  Medusa  Mars","Team B"
"7187552726","15365","05 Jun 2023 06:56","855","14:15","Team B","Balrogs Esports™","Puck  Death Prophet  Clockwerk  Disruptor  Monkey King","Infamous Gaming","Mirana  Queen of Pain  Venomancer  Lifestealer  Spirit Breaker","Team B"
"7187604512","15351","05 Jun 2023 07:31","1622","27:02","Team B","Entity","Silencer  Legion Commander  Techies  Monkey King  Void Spirit","Luna Galaxy","Juggernaut  Mirana  Beastmaster  Batrider  Ember Spirit","Team B"
"7187893827","15286","06 Jun 2023 12:20","2761","46:01","Team B","Luna Galaxy","Lion  Witch Doctor  Tinker  Faceless Void  Batrider","One Move","Bloodseeker  Mirana  Zeus  Shadow Demon  Timbersaw","Team B"
"7187909458","15350","06 Jun 2023 12:53","2103","35:03","Team A","ALPHA","Bloodseeker  Crystal Maiden  Storm Spirit  Windranger  Keeper of the Light","SAND KING GÓMEZ","Mirana  Clockwerk  Naga Siren  Magnus  Void Spirit","Team A"
"7188079015","15384","06 Jun 2023 06:03","2824","47:04","Team B","Big brain","Batrider  Silencer  Earth Spirit  Arc Warden  Void Spirit","Limit","Mirana  Venomancer  Medusa  Magnus  Ember Spirit","Team A"
"7189212689","15366","06 Jun 2023 10:58","2002","33:22","Team A","Los moticucos","Shadow Fiend  Puck  Tidehunter  Techies  Oracle","Vivo Keyd Stars","Mirana  Kunkka  Batrider  Timbersaw  Monkey King","Team B"
"7189930896","15352","07 Jun 2023 03:00","1515","25:15","Team B","IVY","Queen of Pain  Shadow Demon  Medusa  Techies  Underlord","KZ TEAM","Mirana  Lycan  Rubick  Magnus  Void Spirit","Team B"
"7190444131","15352","07 Jun 2023 08:53","2724","45:24","Team B","Old G","Beastmaster  Enchantress  Shadow Demon  Monkey King  Muerta","ITB.Shuffle","Mirana  Morphling  Legion Commander  Techies  Ember Spirit","Team A"
"7190754891","15353","08 Jun 2023 04:08","1795","29:55","Team B","TiltedBoys","Lich  Clinkz  Ursa  Legion Commander  Void Spirit","Ravens","Mirana  Sven  Silencer  Magnus  Ember Spirit","Team B"
"7190787508","15353","08 Jun 2023 05:04","2605","43:25","Team A","Ravens","Clinkz  Oracle  Monkey King  Void Spirit  Mars","TiltedBoys","Mirana  Venomancer  Spirit Breaker  Slark  Pangolier","Team A"
"7191214837","15336","08 Jun 2023 01:55","2288","38:08","Team B","Natus Vincere","Beastmaster  Pugna  Chaos Knight  Techies  Ember Spirit","NAVI Junior","Mirana  Storm Spirit  Batrider  Doom  Slark","Team B"
"7191938868","15269","08 Jun 2023 11:12","2647","44:07","Team B","Vivo Keyd Stars","Storm Spirit  Pugna  Bounty Hunter  Naga Siren  Marci","Thunder Awaken","Mirana  Sven  Beastmaster  Ember Spirit  Oracle","Team B"
"7192078124","15366","09 Jun 2023 03:11","2161","36:01","Team A","Vivo Keyd Stars","Windranger  Lich  Templar Assassin  Spirit Breaker  Timbersaw","Qhali","Mirana  Storm Spirit  Death Prophet  Enchantress  Magnus","Team A"
"7192501432","15375","09 Jun 2023 01:01","1436","23:56","Team A","SPAWN Team","Morphling  Puck  Windranger  Spirit Breaker  Oracle","Vision","Mirana  Queen of Pain  Templar Assassin  Shadow Demon  Mars","Team A"
"7192744084","15352","09 Jun 2023 04:04","1458","24:18","Team A","Nigma Galaxy","Beastmaster  Wraith King  Silencer  Keeper of the Light  Techies","Ancient Tribe","Mirana  Tiny  Doom  Shadow Demon  Magnus","Team A"
"7192927167","15352","09 Jun 2023 05:56","2351","39:11","Team B","Old G","Pugna  Dark Seer  Batrider  Legion Commander  Marci","KZ TEAM","Mirana  Beastmaster  Ursa  Ember Spirit  Oracle","Team B"
"7193127163","15352","09 Jun 2023 08:19","1915","31:55","Team A","Old G","Phantom Lancer  Zeus  Batrider  Spirit Breaker  Phoenix","KZ TEAM","Mirana  Windranger  Ursa  Magnus  Oracle","Team B"
"7193356912","15353","09 Jun 2023 11:55","2491","41:31","Team A","American goons","Bloodseeker  Batrider  Doom  Rubick  Timbersaw","GRIN Esports","Mirana  Wraith King  Magnus  Oracle  Void Spirit","Team A"
"7195243135","15375","11 Jun 2023 07:55","2541","42:21","Team A","IHC","Broodmother  Rubick  Skywrath Mage  Earth Spirit  Underlord","Polaris Esports","Mirana  Venomancer  Doom  Medusa  Void Spirit","Team B"
"7195310179","15375","11 Jun 2023 09:00","2229","37:09","Team A","IHC","Windranger  Venomancer  Phoenix  Monkey King  Pangolier","Polaris Esports","Mirana  Doom  Alchemist  Oracle  Void Spirit","Team B"
"7195522342","15439","11 Jun 2023 11:57","2123","35:23","Team B","TSM","Bloodseeker  Windranger  Lich  Medusa  Skywrath Mage","Team Spirit","Juggernaut  Mirana  Storm Spirit  Tidehunter  Techies","Team B"
"7195716523","15439","11 Jun 2023 02:29","2529","42:09","Team B","Gaimin Gladiators","Faceless Void  Enchantress  Rubick  Visage  Timbersaw","Shopify Rebellion","Mirana  Shadow Fiend  Storm Spirit  Pugna  Magnus","Team A"
"7195773784","15352","11 Jun 2023 02:57","3923","1:05:23","Team A","Ancient Tribe","Beastmaster  Batrider  Skywrath Mage  Ember Spirit  Monkey King","LEVEL UP","Bloodseeker  Mirana  Enigma  Queen of Pain  Doom","Team B"
"7195823566","15439","11 Jun 2023 03:37","1875","31:15","Team A","Entity","Doom  Invoker  Undying  Skywrath Mage  Monkey King","9Pandas","Mirana  Pugna  Medusa  Timbersaw  Techies","Team B"
"7195848924","15439","11 Jun 2023 03:49","2363","39:23","Team B","Shopify Rebellion","Earthshaker  Beastmaster  Venomancer  Faceless Void  Shadow Demon","Gaimin Gladiators","Mirana  Dark Seer  Batrider  Abaddon  Void Spirit","Team A"
"7196148239","15352","11 Jun 2023 06:48","2996","49:56","Team A","Nigma Galaxy","Witch Doctor  Faceless Void  Pugna  Huskar  Timbersaw","IVY","Juggernaut  Mirana  Magnus  Oracle  Void Spirit","Team B"
"7196225623","15439","11 Jun 2023 07:55","2339","38:59","Team B","Gaimin Gladiators","Bloodseeker  Queen of Pain  Enchantress  Spirit Breaker  Medusa","9Pandas","Mirana  Morphling  Witch Doctor  Bounty Hunter  Timbersaw","Team A"
"7196248646","15352","11 Jun 2023 08:07","2782","46:22","Team A","Nigma Galaxy","Bloodseeker  Doom  Silencer  Techies  Ember Spirit","IVY","Mirana  Undying  Magnus  Abaddon  Void Spirit","Team A"
"7196311954","15439","11 Jun 2023 09:10","2059","34:19","Team B","9Pandas","Storm Spirit  Windranger  Beastmaster  Pugna  Undying","Gaimin Gladiators","Mirana  Rubick  Medusa  Timbersaw  Ember Spirit","Team B"
"7196334944","15352","11 Jun 2023 09:22","2928","48:48","Team A","Nigma Galaxy","Lich  Necrophos  Templar Assassin  Doom  Techies","IVY","Mirana  Naga Siren  Timbersaw  Oracle  Void Spirit","Team B"
"7196433178","15352","11 Jun 2023 10:48","3284","54:44","Team A","Alliance","Batrider  Silencer  Skywrath Mage  Terrorblade  Void Spirit","KZ TEAM","Bloodseeker  Mirana  Vengeful Spirit  Ursa  Ember Spirit","Team A"
"7196492827","15353","11 Jun 2023 11:54","2761","46:01","Team B","Wildcard","Drow Ranger  Invoker  Rubick  Magnus  Phoenix","TiltedBoys","Mirana  Morphling  Windranger  Legion Commander  Techies","Team B"
"7196581770","15353","12 Jun 2023 02:10","1886","31:26","Team B","TiltedBoys","Bounty Hunter  Batrider  Disruptor  Slark  Ember Spirit","Wildcard","Mirana  Storm Spirit  Beastmaster  Shadow Demon  Magnus","Team B"
"7196615728","15353","12 Jun 2023 03:11","3541","59:01","Team A","GRIN Esports","Windranger  Enchantress  Doom  Medusa  Techies","Ravens","Mirana  Storm Spirit  Pugna  Alchemist  Marci","Team A"
"7196985000","15439","12 Jun 2023 11:55","1372","22:52","Team A","Evil Geniuses","Storm Spirit  Windranger  Beastmaster  Templar Assassin  Skywrath Mage","Team Spirit","Mirana  Tidehunter  Silencer  Ember Spirit  Terrorblade","Team B"
"7197161670","15439","12 Jun 2023 02:25","1665","27:45","Team B","9Pandas","Slardar  Templar Assassin  Enchantress  Disruptor  Timbersaw","Team Aster","Mirana  Doom  Keeper of the Light  Void Spirit  Snapfire","Team B"
"7197642359","15439","12 Jun 2023 07:52","3423","57:03","Team B","Entity","Lich  Beastmaster  Venomancer  Faceless Void  Clockwerk","OG","Mirana  Enchantress  Spirit Breaker  Naga Siren  Pangolier","Team B"
"7197685988","15439","12 Jun 2023 08:33","2644","44:04","Team B","beastcoast","Earthshaker  Shadow Fiend  Templar Assassin  Enchantress  Timbersaw","Shopify Rebellion","Mirana  Doom  Silencer  Medusa  Void Spirit","Team B"
"7197710610","15439","12 Jun 2023 08:57","1425","23:45","Team B","Team Aster","Bloodseeker  Storm Spirit  Silencer  Io  Legion Commander","Gaimin Gladiators","Mirana  Lich  Lifestealer  Magnus  Void Spirit","Team B"
"7198093446","15353","13 Jun 2023 06:10","3418","56:58","Team B","Wildcard","Morphling  Undying  Techies  Underlord  Pangolier","GRIN Esports","Mirana  Windranger  Batrider  Doom  Medusa","Team A"
"7198760061","15439","13 Jun 2023 05:27","1895","31:35","Team B","Team Spirit","Juggernaut  Windranger  Lich  Spirit Breaker  Shadow Demon","Tundra Esports","Bloodseeker  Mirana  Doom  Silencer  Void Spirit","Team B"
"7198866748","15439","13 Jun 2023 06:33","1723","28:43","Team A","Tundra Esports","Bloodseeker  Crystal Maiden  Batrider  Rubick  Void Spirit","Team Spirit","Mirana  Beastmaster  Shadow Demon  Abaddon  Ember Spirit","Team B"
"7198929185","15439","13 Jun 2023 07:26","1706","28:26","Team B","beastcoast","Bloodseeker  Kunkka  Venomancer  Templar Assassin  Skywrath Mage","Team Aster","Mirana  Doom  Keeper of the Light  Medusa  Void Spirit","Team B"
"7198993402","15366","13 Jun 2023 08:08","2469","41:09","Team A","x5 Gaming","Witch Doctor  Beastmaster  Magnus  Timbersaw  Techies","NoPing Esports","Mirana  Sven  Doom  Shadow Demon  Ember Spirit","Team A"
"7199008625","15439","13 Jun 2023 08:26","2099","34:59","Team B","beastcoast","Clockwerk  Dark Seer  Enchantress  Medusa  Pangolier","Team Aster","Mirana  Faceless Void  Clinkz  Doom  Void Spirit","Team A"
"7199075393","15439","13 Jun 2023 09:33","2496","41:36","Team A","9Pandas","Windranger  Ogre Magi  Undying  Timbersaw  Skywrath Mage","Shopify Rebellion","Bloodseeker  Mirana  Pugna  Lycan  Void Spirit","Team B"
"7199198120","15366","13 Jun 2023 11:35","3574","59:34","Team B","Universitario eSports","Windranger  Clockwerk  Dark Seer  Techies  Ember Spirit","Los moticucos","Mirana  Beastmaster  Pugna  Alchemist  Void Spirit","Team A"
"7199583605","15375","14 Jun 2023 10:32","2136","35:36","Team B","Geek Slate","Storm Spirit  Pugna  Clockwerk  Dark Seer  Ursa","SPAWN Team","Mirana  Morphling  Spirit Breaker  Silencer  Ember Spirit","Team B"
"7199658675","15439","14 Jun 2023 11:55","3963","1:06:03","Team A","Team Liquid","Earthshaker  Clockwerk  Shadow Demon  Lone Druid  Medusa","TSM","Anti-Mage  Mirana  Batrider  Ember Spirit  Winter Wyvern","Team A"
"7199923587","15439","14 Jun 2023 03:42","2448","40:48","Team B","BetBoom Team","Phantom Lancer  Pugna  Doom  Disruptor  Pangolier","Gaimin Gladiators","Mirana  Lifestealer  Enchantress  Medusa  Void Spirit","Team A"
"7200008486","15439","14 Jun 2023 04:36","1777","29:37","Team B","Entity","Beastmaster  Meepo  Rubick  Medusa  Timbersaw","Team Aster","Anti-Mage  Mirana  Lich  Doom  Void Spirit","Team B"
"7200614759","15353","15 Jun 2023 02:54","1882","31:22","Team B","American goons","Templar Assassin  Doom  Rubick  Disruptor  Void Spirit","Ravens","Mirana  Morphling  Witch Doctor  Magnus  Ember Spirit","Team B"
"7200826634","15384","15 Jun 2023 09:00","1913","31:53","Team B","Big brain","Windranger  Venomancer  Dark Seer  Spirit Breaker  Void Spirit","Supernova","Mirana  Batrider  Shadow Demon  Abaddon  Ember Spirit","Team B"
"7201266707","15336","15 Jun 2023 04:02","3263","54:23","Team B","cybercats","Storm Spirit  Tidehunter  Batrider  Techies  Terrorblade","NAVI Junior","Mirana  Rubick  Naga Siren  Magnus  Void Spirit","Team B"
"7201801348","15366","15 Jun 2023 11:01","1467","24:27","Team A","Vivo Keyd Stars","Windranger  Clockwerk  Enchantress  Timbersaw  Abaddon","x5 Gaming","Mirana  Venomancer  Templar Assassin  Magnus  Ember Spirit","Team A"
"7202172088","15375","16 Jun 2023 09:20","1903","31:43","Team A","Myth Avenue Gaming","Storm Spirit  Pugna  Enchantress  Broodmother  Naga Siren","Polaris Esports","Mirana  Doom  Ember Spirit  Monkey King  Dark Willow","Team A"
"7202762633","15352","16 Jun 2023 05:55","2470","41:10","Team A","LEVEL UP","Storm Spirit  Bounty Hunter  Silencer  Medusa  Mars","KZ TEAM","Mirana  Leshrac  Batrider  Lycan  Ember Spirit","Team A"
"7203170282","15352","16 Jun 2023 11:29","4134","1:08:54","Team B","Ancient Tribe","Juggernaut  Beastmaster  Pugna  Skywrath Mage  Ember Spirit","IVY","Mirana  Storm Spirit  Chen  Doom  Medusa","Team A"
"7203339001","15353","17 Jun 2023 04:07","2269","37:49","Team B","Wildcard","Vengeful Spirit  Medusa  Skywrath Mage  Legion Commander  Pangolier","Ravens","Mirana  Batrider  Silencer  Magnus  Monkey King","Team A"
"7203693128","15439","17 Jun 2023 10:57","2175","36:15","Team B","9Pandas","Earthshaker  Juggernaut  Beastmaster  Pugna  Techies","Team Spirit","Mirana  Undying  Ember Spirit  Terrorblade  Primal Beast","Team A"
"7204591909","15366","17 Jun 2023 09:57","2703","45:03","Team A","Lava Esports","Bloodseeker  Puck  Lycan  Rubick  Disruptor","NoPing Esports","Mirana  Storm Spirit  Undying  Timbersaw  Terrorblade","Team A"
"7205218309","15384","18 Jun 2023 10:36","4000","1:06:40","Team A","The last dark","Juggernaut  Silencer  Magnus  Skywrath Mage  Void Spirit","Supernova","Mirana  Tidehunter  Alchemist  Shadow Demon  Ember Spirit","Team B"
"7205240824","15439","18 Jun 2023 10:56","2007","33:27","Team B","Team Spirit","Drow Ranger  Lich  Doom  Techies  Pangolier","Gaimin Gladiators","Mirana  Enchantress  Lycan  Ember Spirit  Terrorblade","Team B"
"7205256575","15375","18 Jun 2023 11:03","2176","36:16","Team A","Neon Esports","Phantom Lancer  Dark Seer  Undying  Rubick  Void Spirit","Polaris Esports","Mirana  Morphling  Kunkka  Venomancer  Spirit Breaker","Team A"
"7205310513","14691","18 Jun 2023 11:47","3249","54:09","Team A","RAM SQUAD","Morphling  Broodmother  Undying  Techies  Monkey King","Hot Headed Gaming","Mirana  Faceless Void  Rubick  Timbersaw  Mars","Team B"
"7205315055","15439","18 Jun 2023 12:04","3194","53:14","Team A","Gaimin Gladiators","Bloodseeker  Lion  Enchantress  Huskar  Underlord","Team Spirit","Mirana  Sniper  Lifestealer  Techies  Ember Spirit","Team A"
"7205410909","14691","18 Jun 2023 01:09","1361","22:41","Team B","RAM SQUAD","Morphling  Venomancer  Spirit Breaker  Lycan  Undying","Hot Headed Gaming","Mirana  Riki  Techies  Ember Spirit  Winter Wyvern","Team A"
"7205466050","15375","18 Jun 2023 01:52","1393","23:13","Team B","Geek Slate","Juggernaut  Storm Spirit  Pugna  Enchantress  Broodmother","Vision","Mirana  Venomancer  Lifestealer  Pangolier  Mars","Team A"
"7205846391","15352","18 Jun 2023 05:59","2103","35:03","Team B","Ancient Tribe","Night Stalker  Undying  Slark  Techies  Ember Spirit","KZ TEAM","Mirana  Tinker  Beastmaster  Shadow Demon  Skywrath Mage","Team B"
"7206035745","15352","18 Jun 2023 08:15","2701","45:01","Team A","KZ TEAM","Windranger  Enigma  Medusa  Skywrath Mage  Oracle","Ancient Tribe","Anti-Mage  Mirana  Tidehunter  Undying  Ember Spirit","Team A"
"7206735347","15439","19 Jun 2023 12:21","2320","38:40","Team A","9Pandas","Earthshaker  Juggernaut  Doom  Shadow Demon  Disruptor","Gaimin Gladiators","Axe  Mirana  Undying  Ember Spirit  Terrorblade","Team A"
"7207430344","14783","19 Jun 2023 09:15","1118","18:38","Team B","noMERCY","Storm Spirit  Pugna  Clockwerk  Dark Seer  Slark","NoPing Esports","Mirana  Luna  Silencer  Timbersaw  Void Spirit","Team A"
"7207532027","14783","19 Jun 2023 10:51","1104","18:24","Team A","Ravens","Axe  Morphling  Undying  Techies  Primal Beast","Lava Esports","Mirana  Templar Assassin  Lycan  Disruptor  Pangolier","Team B"
"7207730118","15353","20 Jun 2023 04:32","2171","36:11","Team A","Wildcard","Faceless Void  Batrider  Undying  Visage  Techies","American goons","Mirana  Morphling  Lion  Timbersaw  Ember Spirit","Team B"
"7208602079","14691","20 Jun 2023 07:07","1920","32:00","Team B","RAM SQUAD","Juggernaut  Queen of Pain  Venomancer  Shadow Demon  Undying","Trouble Makers Reborn","Mirana  Tinker  Batrider  Spirit Breaker  Slark","Team A"
"7208923582","15366","21 Jun 2023 12:37","2930","48:50","Team B","x5 Gaming","Witch Doctor  Enigma  Templar Assassin  Techies  Snapfire","noMERCY","Drow Ranger  Mirana  Tidehunter  Undying  Ember Spirit","Team B"
"7208968008","15366","21 Jun 2023 02:03","2710","45:10","Team B","Qhali","Weaver  Spirit Breaker  Keeper of the Light  Timbersaw  Ember Spirit","Lava Esports","Mirana  Storm Spirit  Broodmother  Undying  Medusa","Team B"
"7209366897","15439","21 Jun 2023 12:05","2175","36:15","Team A","BetBoom Team","Juggernaut  Tiny  Pugna  Doom  Shadow Demon","Talon","Mirana  Silencer  Brewmaster  Ember Spirit  Terrorblade","Team B"
"7209585829","14691","21 Jun 2023 03:07","2659","44:19","Team B","Hot Headed Gaming","Faceless Void  Pugna  Magnus  Dark Willow  Pangolier","IVY","Mirana  Windranger  Beastmaster  Shadow Demon  Void Spirit","Team A"
"7209827005","14691","21 Jun 2023 05:44","2313","38:33","Team A","KZ TEAM","Dazzle  Broodmother  Skywrath Mage  Monkey King  Primal Beast","Trouble Makers Reborn","Axe  Mirana  Windranger  Undying  Ember Spirit","Team A"
"7209920459","15352","21 Jun 2023 06:56","2430","40:30","Team A","LEVEL UP","Phantom Lancer  Pugna  Doom  Silencer  Ember Spirit","ITB.Shuffle","Mirana  Morphling  Tidehunter  Batrider  Techies","Team B"
"7210134665","14783","21 Jun 2023 09:59","2968","49:28","Team A","Vivo Keyd Stars","Bloodseeker  Storm Spirit  Medusa  Techies  Mars","NoPing Esports","Mirana  Morphling  Tidehunter  Shadow Demon  Ember Spirit","Team A"
"7210378401","15353","22 Jun 2023 03:51","3241","54:01","Team A","The Cut","Bloodseeker  Death Prophet  Clinkz  Ancient Apparition  Doom","Ravens","Axe  Mirana  Morphling  Timbersaw  Elder Titan","Team A"
"7210889988","15336","22 Jun 2023 02:02","2341","39:01","Team A","Matreshka","Windranger  Dark Seer  Ursa  Techies  Primal Beast","NAVI Junior","Juggernaut  Mirana  Batrider  Magnus  Ember Spirit","Team A"
"7211888999","15375","23 Jun 2023 07:03","1785","29:45","Team A","Myth Avenue Gaming","Storm Spirit  Pugna  Enchantress  Magnus  Monkey King","Geek Slate","Mirana  Clockwerk  Dark Seer  Medusa  Timbersaw","Team B"
