"Match ID","League","Start Date","Duration (s)","Duration (mm:ss)","Radiant Team","Team A","Team A Heroes","Team B","Team B Heroes","Winner"
"7184628014","15350","03 Jun 2023 08:58","2138","35:38","Team B","DogChamp","Windranger  Lich  Techies  Underlord  Pangolier","Shopify Rebellion","Mirana  Shadow Fiend  Batrider  Void Spirit  Mars","Team B"
"7184648065","15335","03 Jun 2023 09:06","2448","40:48","Team B","9Pandas","Bloodseeker  Puck  Enigma  Rubick  Techies","Team Spirit","Storm Spirit  Lich  Pugna  Magnus  Monkey King","Team B"
"7184712188","15350","03 Jun 2023 10:03","2688","44:48","Team A","Shopify Rebellion","Axe  Lich  Templar Assassin  Timbersaw  Techies","DogChamp","Dark Seer  Silencer  Magnus  Dark Willow  Void Spirit","Team B"
"7184788191","15269","03 Jun 2023 11:00","999","16:39","Team B","Universitario eSports","Phantom Lancer  Keeper of the Light  Timbersaw  Techies  Ember Spirit","Thunder Awaken","Windranger  Beastmaster  Huskar  Shadow Demon  Rubick","Team B"
"7184900410","15350","04 Jun 2023 01:21","1822","30:22","Team B","TSM","Pudge  Venomancer  Timbersaw  Techies  Terrorblade","SAND KING GÓMEZ","Mirana  Magnus  Legion Commander  Monkey King  Void Spirit","Team A"
"7184954323","15350","04 Jun 2023 02:55","1359","22:39","Team A","nouns","Omniknight  Batrider  Io  Techies  Monkey King","ALPHA","Queen of Pain  Spirit Breaker  Rubick  Troll Warlord  Underlord","Team A"
"7184984447","15350","04 Jun 2023 03:42","1640","27:20","Team B","ALPHA","Bounty Hunter  Slark  Techies  Ember Spirit  Primal Beast","nouns","Mirana  Enigma  Batrider  Magnus  Void Spirit","Team B"
"7185259218","15383","04 Jun 2023 09:00","2686","44:46","Team A","INVICTUS GAMING","Storm Spirit  Ursa  Silencer  Medusa  Techies","Xtreme Gaming","Lich  Doom  Slark  Phoenix  Void Spirit","Team B"
"7185341586","15383","04 Jun 2023 10:10","2951","49:11","Team A","Xtreme Gaming","Tidehunter  Batrider  Naga Siren  Techies  Ember Spirit","INVICTUS GAMING","Morphling  Venomancer  Timbersaw  Underlord  Dark Willow","Team B"
"7185440420","15383","04 Jun 2023 11:29","2167","36:07","Team A","Xtreme Gaming","Juggernaut  Windranger  Timbersaw  Techies  Void Spirit","INVICTUS GAMING","Queen of Pain  Batrider  Silencer  Brewmaster  Medusa","Team B"
"7185600107","15383","04 Jun 2023 01:25","2079","34:39","Team B","PSG.LGD","Crystal Maiden  Phantom Lancer  Magnus  Techies  Ember Spirit","Team Aster","Morphling  Spirit Breaker  Silencer  Keeper of the Light  Void Spirit","Team A"
"7185698091","15383","04 Jun 2023 02:29","2420","40:20","Team A","PSG.LGD","Windranger  Venomancer  Magnus  Abaddon  Techies","Team Aster","Beastmaster  Silencer  Rubick  Ember Spirit  Monkey King","Team A"
"7185953995","15335","04 Jun 2023 04:59","2062","34:22","Team A","Nemiga Gaming","Juggernaut  Batrider  Spirit Breaker  Techies  Pangolier","BetBoom Team","Tiny  Lich  Keeper of the Light  Troll Warlord  Magnus","Team B"
"7185980523","14691","04 Jun 2023 05:10","1680","28:00","Team A","IVY","Lich  Death Prophet  Timbersaw  Techies  Void Spirit","KZ TEAM","Mirana  Beastmaster  Pugna  Templar Assassin  Rubick","Team B"
"7185981024","15286","04 Jun 2023 05:15","1730","28:50","Team B","nouns","Dark Seer  Spirit Breaker  Timbersaw  Techies  Monkey King","One Move","Death Prophet  Pugna  Magnus  Oracle  Void Spirit","Team B"
"7186058112","14691","04 Jun 2023 06:09","2825","47:05","Team A","KZ TEAM","Doom  Techies  Ember Spirit  Terrorblade  Oracle","IVY","Windranger  Spirit Breaker  Shadow Demon  Visage  Void Spirit","Team A"
"7186065142","15335","04 Jun 2023 06:01","1506","25:06","Team A","Nemiga Gaming","Axe  Windranger  Clinkz  Techies  Void Spirit","BetBoom Team","Enchantress  Disruptor  Magnus  Terrorblade  Pangolier","Team B"
"7186190121","14691","04 Jun 2023 07:27","3691","1:01:31","Team B","KZ TEAM","Juggernaut  Queen of Pain  Lycan  Undying  Techies","IVY","Crystal Maiden  Viper  Batrider  Spirit Breaker  Void Spirit","Team B"
"7186235946","15335","04 Jun 2023 08:07","2395","39:55","Team B","Virtus.pro","Tidehunter  Disruptor  Techies  Ember Spirit  Monkey King","9Pandas","Lich  Doom  Naga Siren  Skywrath Mage  Pangolier","Team A"
"7186254784","15365","04 Jun 2023 08:15","2007","33:27","Team A","Infamous Gaming","Windranger  Treant Protector  Timbersaw  Techies  Muerta","INFINITY","Pugna  Templar Assassin  Magnus  Skywrath Mage  Legion Commander","Team B"
"7186303073","14691","04 Jun 2023 09:00","3705","1:01:45","Team B","IVY","Slark  Timbersaw  Techies  Winter Wyvern  Void Spirit","KZ TEAM","Windranger  Luna  Rubick  Magnus  Primal Beast","Team B"
"7186379101","15351","04 Jun 2023 10:01","2143","35:43","Team A","Luna Galaxy","Lion  Faceless Void  Batrider  Techies  Pangolier","OG","Shadow Demon  Ogre Magi  Medusa  Skywrath Mage  Void Spirit","Team B"
"7186379917","15365","04 Jun 2023 10:03","3281","54:41","Team B","Mad Kings Esports","Morphling  Clinkz  Omniknight  Invoker  Techies","Balrogs Esports™","Dark Seer  Batrider  Spirit Breaker  Slark  Oracle","Team A"
"7186632014","15383","05 Jun 2023 04:00","2732","45:32","Team A","Aster.Aries","Faceless Void  Shadow Demon  Techies  Underlord  Void Spirit","Team Bright","Puck  Venomancer  Spirit Breaker  Disruptor  Naga Siren","Team A"
"7186633019","15350","05 Jun 2023 04:08","1942","32:22","Team A","felt","Chaos Knight  Skywrath Mage  Legion Commander  Techies  Pangolier","B8","Storm Spirit  Beastmaster  Lifestealer  Batrider  Keeper of the Light","Team B"
"7186668925","15383","05 Jun 2023 05:07","2721","45:21","Team B","Aster.Aries","Morphling  Bounty Hunter  Techies  Void Spirit  Primal Beast","Team Bright","Shadow Demon  Naga Siren  Keeper of the Light  Magnus  Pangolier","Team A"
"7186669295","15350","05 Jun 2023 05:09","3229","53:49","Team B","felt","Windranger  Dark Seer  Disruptor  Techies  Void Spirit","B8","Storm Spirit  Sven  Lich  Keeper of the Light  Underlord","Team A"
"7186719990","15383","05 Jun 2023 06:27","3902","1:05:02","Team A","Azure Ray","Phantom Lancer  Shadow Demon  Timbersaw  Techies  Ember Spirit","Xtreme Gaming","Queen of Pain  Batrider  Spirit Breaker  Silencer  Monkey King","Team B"
"7186752483","15374","05 Jun 2023 07:16","1838","30:38","Team B","Blacklist Rivalry","Enchantress  Magnus  Techies  Monkey King  Pangolier","Army Geniuses Mansion","Storm Spirit  Silencer  Naga Siren  Keeper of the Light  Mars","Team A"
"7186778829","15383","05 Jun 2023 08:03","3113","51:53","Team A","Xtreme Gaming","Batrider  Timbersaw  Techies  Terrorblade  Void Spirit","Azure Ray","Storm Spirit  Omniknight  Silencer  Naga Siren  Keeper of the Light","Team B"
"7186887182","15383","05 Jun 2023 10:33","3685","1:01:25","Team B","INVICTUS GAMING","Puck  Brewmaster  Techies  Oracle  Monkey King","Team Aster","Bloodseeker  Windranger  Batrider  Disruptor  Slark","Team A"
"7186923574","15374","05 Jun 2023 11:06","2110","35:10","Team B","Execration","Templar Assassin  Clinkz  Alchemist  Techies  Underlord","Blacklist Rivalry","Enchantress  Doom  Medusa  Pangolier  Snapfire","Team A"
"7186980004","15383","05 Jun 2023 12:06","2518","41:58","Team A","Team Aster","Morphling  Doom  Techies  Phoenix  Void Spirit","INVICTUS GAMING","Lich  Templar Assassin  Shadow Demon  Centaur Warrunner  Monkey King","Team A"
"7186980483","15335","05 Jun 2023 12:03","3329","55:29","Team B","One Move","Axe  Morphling  Queen of Pain  Techies  Oracle","Nemiga Gaming","Puck  Dark Seer  Enchantress  Batrider  Terrorblade","Team A"
"7187064528","15335","05 Jun 2023 01:28","1475","24:35","Team B","Nemiga Gaming","Morphling  Tiny  Undying  Magnus  Techies","HYDRA","Mirana  Pugna  Doom  Arc Warden  Pangolier","Team B"
"7187134629","15335","05 Jun 2023 02:21","3051","50:51","Team B","One Move","Morphling  Windranger  Tidehunter  Rubick  Techies","HYDRA","Mirana  Lich  Magnus  Monkey King  Void Spirit","Team B"
"7187282133","15351","05 Jun 2023 03:56","2070","34:30","Team B","Team Liquid","Nyx Assassin  Slark  Techies  Winter Wyvern  Pangolier","Quest Esports","Mirana  Queen of Pain  Shadow Demon  Medusa  Mars","Team B"
"7187286368","15286","05 Jun 2023 04:00","2378","39:38","Team A","Natus Vincere","Visage  Slark  Techies  Oracle  Pangolier","Nemiga Gaming","Earthshaker  Juggernaut  Enchantress  Batrider  Doom","Team B"
"7187382203","15351","05 Jun 2023 04:57","2486","41:26","Team A","Quest Esports","Templar Assassin  Batrider  Shadow Demon  Timbersaw  Techies","Team Liquid","Puck  Vengeful Spirit  Viper  Oracle  Monkey King","Team A"
"7187397174","15286","05 Jun 2023 05:08","2126","35:26","Team B","Natus Vincere","Bloodseeker  Pugna  Legion Commander  Techies  Pangolier","Nemiga Gaming","Juggernaut  Storm Spirit  Beastmaster  Enchantress  Snapfire","Team B"
"7187514531","15351","05 Jun 2023 06:21","2621","43:41","Team A","Entity","Doom  Disruptor  Magnus  Techies  Ember Spirit","Luna Galaxy","Beastmaster  Wraith King  Batrider  Silencer  Winter Wyvern","Team A"
"7187572530","15286","05 Jun 2023 07:05","2204","36:44","Team B","BetBoom Team","Beastmaster  Undying  Techies  Pangolier  Muerta","cybercats","Windranger  Lich  Batrider  Magnus  Winter Wyvern","Team A"
"7187604512","15351","05 Jun 2023 07:31","1622","27:02","Team B","Entity","Silencer  Legion Commander  Techies  Monkey King  Void Spirit","Luna Galaxy","Juggernaut  Mirana  Beastmaster  Batrider  Ember Spirit","Team B"
"7187649927","15286","05 Jun 2023 08:10","1603","26:43","Team A","BetBoom Team","Shadow Fiend  Disruptor  Magnus  Techies  Void Spirit","cybercats","Bloodseeker  Lich  Templar Assassin  Undying  Terrorblade","Team A"
"7187669754","15351","05 Jun 2023 08:25","2484","41:24","Team A","Luna Galaxy","Ancient Apparition  Chaos Knight  Magnus  Techies  Ember Spirit","Entity","Morphling  Beastmaster  Batrider  Disruptor  Skywrath Mage","Team B"
"7187691539","15350","05 Jun 2023 08:54","2047","34:07","Team A","ALPHA","Storm Spirit  Pugna  Templar Assassin  Techies  Underlord","SAND KING GÓMEZ","Venomancer  Silencer  Monkey King  Dark Willow  Void Spirit","Team A"
"7187777736","15350","05 Jun 2023 10:01","2791","46:31","Team A","ALPHA","Venomancer  Undying  Techies  Ember Spirit  Terrorblade","B8","Crystal Maiden  Storm Spirit  Windranger  Doom  Keeper of the Light","Team B"
"7187907756","15269","06 Jun 2023 12:41","1547","25:47","Team B","noMERCY","Crystal Maiden  Beastmaster  Ursa  Techies  Ember Spirit","Lava Esports","Dark Seer  Enchantress  Batrider  Spirit Breaker  Magnus","Team B"
"7187936390","15269","06 Jun 2023 01:43","2066","34:26","Team B","Acatsuki","Shadow Fiend  Lich  Luna  Techies  Underlord","noMERCY","Juggernaut  Storm Spirit  Spirit Breaker  Rubick  Timbersaw","Team B"
"7187986573","15350","06 Jun 2023 03:27","3754","1:02:34","Team A","B8","Dragon Knight  Batrider  Ursa  Techies  Marci","SAND KING GÓMEZ","Sven  Keeper of the Light  Io  Ember Spirit  Mars","Team B"
"7188003542","15269","06 Jun 2023 03:53","2289","38:09","Team A","noMERCY","Doom  Magnus  Techies  Earth Spirit  Phoenix","Lava Esports","Juggernaut  Enchantress  Rubick  Monkey King  Snapfire","Team B"
"7188099933","15350","06 Jun 2023 06:38","2782","46:22","Team B","B8","Beastmaster  Dragon Knight  Skywrath Mage  Techies  Terrorblade","ALPHA","Bloodseeker  Enchantress  Keeper of the Light  Timbersaw  Ember Spirit","Team A"
"7188158388","15384","06 Jun 2023 08:07","2518","41:58","Team B","Big brain","Morphling  Clockwerk  Batrider  Techies  Monkey King","Limit","Rubick  Magnus  Oracle  Arc Warden  Void Spirit","Team A"
"7188207599","15384","06 Jun 2023 09:30","3053","50:53","Team A","Team Disillusion","Bloodseeker  Shadow Demon  Magnus  Techies  Ember Spirit","Team Zero","Tiny  Beastmaster  Silencer  Keeper of the Light  Arc Warden","Team B"
"7188400366","15286","06 Jun 2023 01:00","1510","25:10","Team A","Nemiga Gaming","Doom  Disruptor  Slark  Techies  Void Spirit","Virtus.pro","Axe  Storm Spirit  Lich  Pugna  Alchemist","Team B"
"7188472502","15286","06 Jun 2023 01:58","2219","36:59","Team B","Virtus.pro","Enchantress  Magnus  Techies  Ember Spirit  Monkey King","Nemiga Gaming","Juggernaut  Doom  Silencer  Skywrath Mage  Pangolier","Team B"
"7188561988","15286","06 Jun 2023 03:00","2004","33:24","Team B","Virtus.pro","Axe  Windranger  Ancient Apparition  Techies  Monkey King","Nemiga Gaming","Morphling  Doom  Silencer  Shadow Demon  Pangolier","Team B"
"7188655924","15336","06 Jun 2023 04:01","1822","30:22","Team A","Matreshka","Lich  Spirit Breaker  Meepo  Slark  Techies","StoRm","Storm Spirit  Doom  Shadow Demon  Skywrath Mage  Terrorblade","Team B"
"7188764102","15336","06 Jun 2023 04:58","3683","1:01:23","Team A","StoRm","Venomancer  Chaos Knight  Magnus  Techies  Pangolier","Matreshka","Windranger  Batrider  Silencer  Earth Spirit  Void Spirit","Team A"
"7189049673","15366","06 Jun 2023 08:27","1737","28:57","Team B","Qhali","Bloodseeker  Juggernaut  Techies  Oracle  Void Spirit","Universitario eSports","Puck  Lich  Keeper of the Light  Medusa  Magnus","Team B"
"7189085468","15286","06 Jun 2023 08:58","2116","35:16","Team B","BetBoom Team","Axe  Death Prophet  Spirit Breaker  Medusa  Techies","Nemiga Gaming","Juggernaut  Doom  Disruptor  Dark Willow  Primal Beast","Team B"
"7189154571","15286","06 Jun 2023 10:01","2988","49:48","Team B","BetBoom Team","Morphling  Tiny  Lich  Magnus  Techies","Nemiga Gaming","Juggernaut  Silencer  Shadow Demon  Pangolier  Mars","Team B"
"7189157925","15269","06 Jun 2023 10:03","2796","46:36","Team B","Acatsuki","Windranger  Doom  Chaos Knight  Rubick  Techies","noMERCY","Clockwerk  Batrider  Spirit Breaker  Magnus  Skywrath Mage","Team A"
"7189212689","15366","06 Jun 2023 10:58","2002","33:22","Team A","Los moticucos","Shadow Fiend  Puck  Tidehunter  Techies  Oracle","Vivo Keyd Stars","Mirana  Kunkka  Batrider  Timbersaw  Monkey King","Team B"
"7189230816","15269","06 Jun 2023 11:21","1228","20:28","Team B","noMERCY","Bane  Bloodseeker  Doom  Legion Commander  Techies","Lava Esports","Templar Assassin  Clockwerk  Batrider  Undying  Ember Spirit","Team B"
"7189256517","15366","06 Jun 2023 11:55","2843","47:23","Team A","Vivo Keyd Stars","Sven  Windranger  Enchantress  Timbersaw  Techies","Los moticucos","Phantom Lancer  Death Prophet  Pugna  Bounty Hunter  Silencer","Team A"
"7189270610","15269","07 Jun 2023 12:18","3508","58:28","Team A","Lava Esports","Enchantress  Alchemist  Magnus  Techies  Ember Spirit","Acatsuki","Crystal Maiden  Templar Assassin  Doom  Rubick  Legion Commander","Team A"
"7189304619","15366","07 Jun 2023 01:24","2403","40:03","Team A","NoPing Esports","Morphling  Magnus  Elder Titan  Techies  Void Spirit","noMERCY","Clockwerk  Spirit Breaker  Visage  Medusa  Earth Spirit","Team B"
"7189806012","15375","07 Jun 2023 01:17","2491","41:31","Team A","SPAWN Team","Windranger  Spirit Breaker  Techies  Terrorblade  Pangolier","Myth Avenue Gaming","Puck  Beastmaster  Faceless Void  Enchantress  Rubick","Team A"
"7189930896","15352","07 Jun 2023 03:00","1515","25:15","Team B","IVY","Queen of Pain  Shadow Demon  Medusa  Techies  Underlord","KZ TEAM","Mirana  Lycan  Rubick  Magnus  Void Spirit","Team B"
"7190211769","15352","07 Jun 2023 05:54","2631","43:51","Team B","LEVEL UP","Puck  Sven  Doom  Skywrath Mage  Techies","Alliance","Storm Spirit  Venomancer  Pugna  Dark Seer  Monkey King","Team A"
"7190308611","15352","07 Jun 2023 07:03","2488","41:28","Team A","Alliance","Crystal Maiden  Magnus  Techies  Monkey King  Void Spirit","LEVEL UP","Storm Spirit  Sven  Tidehunter  Pugna  Silencer","Team B"
"7190444131","15352","07 Jun 2023 08:53","2724","45:24","Team A","ITB.Shuffle","Mirana  Morphling  Legion Commander  Techies  Ember Spirit","Old G","Beastmaster  Enchantress  Shadow Demon  Monkey King  Muerta","Team B"
"7190513366","15269","07 Jun 2023 10:00","1467","24:27","Team B","Vivo Keyd Stars","Storm Spirit  Spirit Breaker  Naga Siren  Visage  Techies","x5 Gaming","Juggernaut  Batrider  Disruptor  Oracle  Void Spirit","Team A"
"7190522768","15352","07 Jun 2023 10:11","1921","32:01","Team B","ITB.Shuffle","Spirit Breaker  Techies  Ember Spirit  Terrorblade  Winter Wyvern","Old G","Phantom Lancer  Beastmaster  Pugna  Enchantress  Magnus","Team B"
"7190662492","15269","08 Jun 2023 01:07","1655","27:35","Team B","Thunder Awaken","Shadow Fiend  Troll Warlord  Techies  Oracle  Monkey King","Lava Esports","Lich  Pugna  Lycan  Magnus  Ember Spirit","Team A"
"7190809289","15384","08 Jun 2023 05:59","1801","30:01","Team A","The last dark","Queen of Pain  Shadow Demon  Magnus  Techies  Void Spirit","Holy Grail","Vengeful Spirit  Spirit Breaker  Silencer  Terrorblade  Pangolier","Team A"
"7190884565","15384","08 Jun 2023 07:46","3277","54:37","Team B","The last dark","Silencer  Timbersaw  Techies  Terrorblade  Pangolier","Holy Grail","Beastmaster  Queen of Pain  Pugna  Alchemist  Dark Willow","Team B"
"7190951678","15384","08 Jun 2023 09:26","1820","30:20","Team A","Supernova","Dark Seer  Magnus  Abaddon  Techies  Ember Spirit","iG.Vitality","Queen of Pain  Batrider  Spirit Breaker  Silencer  Terrorblade","Team A"
"7191147081","15336","08 Jun 2023 01:02","1610","26:50","Team A","Natus Vincere","Venomancer  Ogre Magi  Medusa  Techies  Ember Spirit","NAVI Junior","Juggernaut  Lich  Queen of Pain  Batrider  Timbersaw","Team A"
"7191214837","15336","08 Jun 2023 01:55","2288","38:08","Team B","Natus Vincere","Beastmaster  Pugna  Chaos Knight  Techies  Ember Spirit","NAVI Junior","Mirana  Storm Spirit  Batrider  Doom  Slark","Team B"
"7191302014","15336","08 Jun 2023 03:00","2732","45:32","Team A","NAVI Junior","Bloodseeker  Templar Assassin  Dark Seer  Spirit Breaker  Techies","Natus Vincere","Windranger  Chen  Doom  Shadow Demon  Void Spirit","Team B"
"7191527186","15336","08 Jun 2023 05:24","2706","45:06","Team B","Team Sexy","Batrider  Techies  Underlord  Oracle  Monkey King","Moneymakers","Venomancer  Pugna  Doom  Keeper of the Light  Medusa","Team A"
"7191668704","15366","08 Jun 2023 07:02","2055","34:15","Team B","x5 Gaming","Queen of Pain  Venomancer  Spirit Breaker  Abaddon  Techies","Los moticucos","Morphling  Death Prophet  Clockwerk  Batrider  Timbersaw","Team A"
"7191743800","15366","08 Jun 2023 08:04","2519","41:59","Team A","x5 Gaming","Windranger  Witch Doctor  Batrider  Naga Siren  Techies","Los moticucos","Bloodseeker  Venomancer  Rubick  Monkey King  Void Spirit","Team A"
"7191869047","15366","08 Jun 2023 09:59","2875","47:55","Team B","Universitario eSports","Lich  Leshrac  Spirit Breaker  Slark  Techies","Lava Esports","Beastmaster  Rubick  Magnus  Ember Spirit  Oracle","Team A"
"7191950420","15366","08 Jun 2023 11:24","2106","35:06","Team B","Lava Esports","Beastmaster  Dragon Knight  Enchantress  Techies  Monkey King","Universitario eSports","Queen of Pain  Pugna  Dark Seer  Spirit Breaker  Medusa","Team B"
"7192646349","15352","09 Jun 2023 02:57","2269","37:49","Team A","Nigma Galaxy","Witch Doctor  Beastmaster  Techies  Monkey King  Void Spirit","Ancient Tribe","Bloodseeker  Lich  Necrophos  Pugna  Doom","Team A"
"7192744084","15352","09 Jun 2023 04:04","1458","24:18","Team A","Nigma Galaxy","Beastmaster  Wraith King  Silencer  Keeper of the Light  Techies","Ancient Tribe","Mirana  Tiny  Doom  Shadow Demon  Magnus","Team A"
"7193034115","15352","09 Jun 2023 07:03","2689","44:49","Team B","Old G","Axe  Vengeful Spirit  Queen of Pain  Medusa  Techies","KZ TEAM","Bounty Hunter  Batrider  Doom  Lycan  Shadow Demon","Team A"
"7193354866","15352","09 Jun 2023 11:51","2230","37:10","Team A","Alliance","Doom  Disruptor  Slark  Techies  Pangolier","ITB.Shuffle","Enigma  Pugna  Batrider  Arc Warden  Void Spirit","Team B"
"7193654090","15384","10 Jun 2023 07:13","1927","32:07","Team A","Team Disillusion","Venomancer  Timbersaw  Legion Commander  Techies  Void Spirit","Limit","Vengeful Spirit  Windranger  Luna  Silencer  Visage","Team B"
"7193752574","15384","10 Jun 2023 09:05","2561","42:41","Team B","iG.Vitality","Tiny  Enchantress  Medusa  Timbersaw  Techies","The last dark","Morphling  Beastmaster  Shadow Demon  Skywrath Mage  Earth Spirit","Team B"
"7193817332","15384","10 Jun 2023 10:08","1914","31:54","Team A","iG.Vitality","Faceless Void  Magnus  Techies  Dark Willow  Void Spirit","The last dark","Morphling  Vengeful Spirit  Windranger  Beastmaster  Shadow Demon","Team B"
"7194013477","15336","10 Jun 2023 01:00","2890","48:10","Team B","Matreshka","Templar Assassin  Doom  Rubick  Techies  Void Spirit","Team Sexy","Windranger  Pugna  Abaddon  Underlord  Pangolier","Team A"
"7194108785","15336","10 Jun 2023 02:15","1294","21:34","Team A","Team Sexy","Phantom Lancer  Queen of Pain  Pugna  Techies  Underlord","Matreshka","Clockwerk  Enchantress  Batrider  Timbersaw  Muerta","Team B"
"7194271596","15336","10 Jun 2023 04:01","1946","32:26","Team B","cybercats","Spirit Breaker  Medusa  Techies  Void Spirit  Primal Beast","Sibe Team","Morphling  Windranger  Beastmaster  Enchantress  Skywrath Mage","Team A"
"7194372491","15336","10 Jun 2023 04:59","2520","42:00","Team A","cybercats","Bloodseeker  Phantom Lancer  Puck  Shadow Demon  Techies","Sibe Team","Windranger  Lich  Pugna  Templar Assassin  Doom","Team A"
"7194571754","15366","10 Jun 2023 07:04","2791","46:31","Team A","x5 Gaming","Crystal Maiden  Morphling  Spirit Breaker  Techies  Void Spirit","Lava Esports","Clockwerk  Batrider  Medusa  Timbersaw  Tusk","Team A"
"7194686643","15366","10 Jun 2023 08:20","2148","35:48","Team B","x5 Gaming","Juggernaut  Disruptor  Magnus  Techies  Void Spirit","Lava Esports","Dark Seer  Enchantress  Spirit Breaker  Medusa  Pangolier","Team B"
"7194887447","15366","10 Jun 2023 11:31","2960","49:20","Team A","Universitario eSports","Doom  Ursa  Rubick  Techies  Monkey King","noMERCY","Anti-Mage  Lion  Pugna  Timbersaw  Earth Spirit","Team A"
"7194952283","15366","11 Jun 2023 12:55","2500","41:40","Team B","noMERCY","Juggernaut  Tidehunter  Techies  Ember Spirit  Oracle","Universitario eSports","Pugna  Spirit Breaker  Rubick  Slark  Void Spirit","Team B"
"7195198947","15375","11 Jun 2023 07:00","1908","31:48","Team A","IHC","Bloodseeker  Techies  Underlord  Oracle  Pangolier","Polaris Esports","Windranger  Beastmaster  Venomancer  Terrorblade  Mars","Team A"
"7195515861","15439","11 Jun 2023 11:57","2059","34:19","Team B","Team Secret","Beastmaster  Clockwerk  Magnus  Techies  Muerta","Talon","Batrider  Spirit Breaker  Alchemist  Rubick  Winter Wyvern","Team B"
"7195520394","15439","11 Jun 2023 11:55","1513","25:13","Team B","Tundra Esports","Faceless Void  Dark Seer  Spirit Breaker  Timbersaw  Techies","Team Liquid","Bane  Storm Spirit  Sven  Batrider  Magnus","Team A"
"7195522342","15439","11 Jun 2023 11:57","2123","35:23","Team A","Team Spirit","Juggernaut  Mirana  Storm Spirit  Tidehunter  Techies","TSM","Bloodseeker  Windranger  Lich  Medusa  Skywrath Mage","Team A"
"7195588301","15439","11 Jun 2023 12:52","1657","27:37","Team A","Tundra Esports","Bloodseeker  Batrider  Visage  Techies  Pangolier","Team Liquid","Queen of Pain  Venomancer  Lifestealer  Shadow Demon  Magnus","Team A"
"7195625923","15375","11 Jun 2023 01:12","3211","53:31","Team A","Vision","Bloodseeker  Queen of Pain  Techies  Oracle  Mars","Myth Avenue Gaming","Spirit Breaker  Rubick  Keeper of the Light  Terrorblade  Pangolier","Team A"
"7195637535","15439","11 Jun 2023 01:21","2037","33:57","Team B","Team Spirit","Bloodseeker  Lich  Timbersaw  Techies  Ember Spirit","TSM","Puck  Beastmaster  Rubick  Magnus  Oracle","Team B"
"7195823566","15439","11 Jun 2023 03:37","1875","31:15","Team B","9Pandas","Mirana  Pugna  Medusa  Timbersaw  Techies","Entity","Doom  Invoker  Undying  Skywrath Mage  Monkey King","Team A"
"7195985918","15439","11 Jun 2023 05:21","1755","29:15","Team A","Team Liquid","Luna  Spirit Breaker  Visage  Techies  Void Spirit","Evil Geniuses","Bloodseeker  Death Prophet  Bounty Hunter  Magnus  Skywrath Mage","Team B"
"7195990034","15439","11 Jun 2023 05:23","1758","29:18","Team A","PSG.LGD","Puck  Visage  Techies  Phoenix  Marci","Team Spirit","Storm Spirit  Pugna  Ogre Magi  Rubick  Bristleback","Team B"
"7196102277","15439","11 Jun 2023 06:22","1801","30:01","Team A","Team Liquid","Axe  Bloodseeker  Storm Spirit  Pugna  Techies","Evil Geniuses","Tiny  Lich  Bounty Hunter  Brewmaster  Magnus","Team A"
"7196108192","15439","11 Jun 2023 06:23","3607","1:00:07","Team A","TSM","Templar Assassin  Bounty Hunter  Medusa  Techies  Void Spirit","Team Secret","Phantom Lancer  Chen  Shadow Demon  Magnus  Timbersaw","Team A"
"7196242708","15439","11 Jun 2023 08:04","2192","36:32","Team B","Team Aster","Anti-Mage  Venomancer  Doom  Techies  Ember Spirit","OG","Enchantress  Batrider  Medusa  Arc Warden  Monkey King","Team A"
"7196245796","15439","11 Jun 2023 08:08","2769","46:09","Team A","BetBoom Team","Morphling  Tidehunter  Shadow Demon  Techies  Pangolier","Shopify Rebellion","Juggernaut  Lion  Batrider  Magnus  Timbersaw","Team A"
"7196248646","15352","11 Jun 2023 08:07","2782","46:22","Team A","Nigma Galaxy","Bloodseeker  Doom  Silencer  Techies  Ember Spirit","IVY","Mirana  Undying  Magnus  Abaddon  Void Spirit","Team A"
"7196327649","15439","11 Jun 2023 09:13","2693","44:53","Team A","Team Aster","Venomancer  Magnus  Techies  Void Spirit  Snapfire","OG","Templar Assassin  Batrider  Shadow Demon  Abaddon  Phoenix","Team A"
"7196334944","15352","11 Jun 2023 09:22","2928","48:48","Team A","Nigma Galaxy","Lich  Necrophos  Templar Assassin  Doom  Techies","IVY","Mirana  Naga Siren  Timbersaw  Oracle  Void Spirit","Team B"
"7196492827","15353","11 Jun 2023 11:54","2761","46:01","Team A","TiltedBoys","Mirana  Morphling  Windranger  Legion Commander  Techies","Wildcard","Drow Ranger  Invoker  Rubick  Magnus  Phoenix","Team A"
"7196512086","15352","12 Jun 2023 12:15","3710","1:01:50","Team A","Alliance","Puck  Vengeful Spirit  Dark Seer  Medusa  Techies","KZ TEAM","Juggernaut  Pugna  Rubick  Magnus  Void Spirit","Team B"
