"Match ID","League","Start Date","Duration (s)","Duration (mm:ss)","Radiant Team","Team A","Team A Heroes","Team B","Team B Heroes","Winner"
"7119036519","15128","22 Apr 2023 09:22","2653","44:13","Team A","UD VESSUWAN","Lion  Nature's Prophet  Bounty Hunter  Doom  Pangolier","Outsiders From CN","Queen of Pain  Undying  Rubick  Monkey King  Dawnbreaker","Team B"
"7119588186","15138","22 Apr 2023 03:01","2868","47:48","Team A","NAVI Junior","Mirana  Tiny  Tidehunter  Naga Siren  Techies","UALEIKUMNIHAO","Storm Spirit  Beastmaster  Undying  Rubick  Muerta","Team A"
"7120913705","15141","23 Apr 2023 07:53","2739","45:39","Team B","Supernova","Mirana  Sven  Tusk  Void Spirit  Muerta","Holy Grail","Doom  Ursa  Undying  Earth Spirit  Underlord","Team A"
"7120965232","15126","23 Apr 2023 08:46","2125","35:25","Team A","IHC","Death Prophet  Enchantress  Tusk  Legion Commander  Muerta","Made in Philippines","Batrider  Undying  Rubick  Troll Warlord  Dawnbreaker","Team B"
"7121064365","15126","23 Apr 2023 10:00","2499","41:39","Team A","Myth Avenue Gaming","Riki  Clockwerk  Jakiro  Keeper of the Light  Terrorblade","Vision","Batrider  Undying  Earth Spirit  Arc Warden  Snapfire","Team B"
"7121895328","15196","23 Apr 2023 05:52","2147","35:47","Team A","Team Liquid","Sven  Necrophos  Chen  Rubick  Underlord","Gaimin Gladiators","Mirana  Sniper  Dragon Knight  Undying  Terrorblade","Team A"
"7122142333","14691","23 Apr 2023 08:01","1820","30:20","Team A","IVY","Mirana  Riki  Enchantress  Alchemist  Underlord","Ionut Cercel","Phantom Lancer  Shadow Shaman  Doom  Undying  Void Spirit","Team B"
"7122404291","15267","23 Apr 2023 11:20","3152","52:32","Team A","Balrogs Esports™","Puck  Skywrath Mage  Earth Spirit  Underlord  Muerta","Hokori","Riki  Beastmaster  Undying  Rubick  Slark","Team B"
"7122660772","15128","24 Apr 2023 05:41","1453","24:13","Team A","Team Virgo","Riki  Dragon Knight  Enchantress  Snapfire  Primal Beast","MIRACLE ESPORT","Mirana  Lifestealer  Undying  Timbersaw  Ember Spirit","Team A"
"7123824887","14691","24 Apr 2023 08:35","1677","27:57","Team A","HF","Lich  Dragon Knight  Rubick  Naga Siren  Ember Spirit","Ionut Cercel","Pudge  Shadow Shaman  Doom  Undying  Muerta","Team B"
"7123844647","15087","24 Apr 2023 08:57","1682","28:02","Team A","TiltedBoys","Phantom Lancer  Dragon Knight  Chen  Centaur Warrunner  Skywrath Mage","Ravens","Sand King  Undying  Ember Spirit  Monkey King  Snapfire","Team B"
"7123923335","15087","24 Apr 2023 09:53","4441","1:14:01","Team B","TiltedBoys","Phantom Lancer  Beastmaster  Disruptor  Ember Spirit  Snapfire","Ravens","Storm Spirit  Templar Assassin  Nature's Prophet  Undying  Earth Spirit","Team B"
"7124045912","15087","24 Apr 2023 11:59","2958","49:18","Team B","The Oversight","Mirana  Venomancer  Bounty Hunter  Alchemist  Nyx Assassin","ALPHA","Beastmaster  Undying  Rubick  Naga Siren  Ember Spirit","Team A"
"7125399393","15136","25 Apr 2023 09:11","1348","22:28","Team B","Lava Esports","Sven  Beastmaster  Chen  Tusk  Dark Willow","Mad Kings Esports","Night Stalker  Undying  Slark  Ember Spirit  Snapfire","Team B"
"7125495027","14691","25 Apr 2023 10:36","2191","36:31","Team A","KZ TEAM","Mirana  Chen  Nyx Assassin  Ember Spirit  Muerta","Ionut Cercel","Alchemist  Undying  Rubick  Underlord  Void Spirit","Team A"
"7125542217","15267","25 Apr 2023 11:24","2919","48:39","Team A","Thunder Awaken","Bloodseeker  Storm Spirit  Rubick  Disruptor  Underlord","Hokori","Drow Ranger  Beastmaster  Undying  Tusk  Techies","Team B"
"7125722022","15267","26 Apr 2023 04:45","1903","31:43","Team A","Infamous Gaming","Templar Assassin  Rubick  Elder Titan  Ember Spirit  Underlord","Acatsuki","Mirana  Shadow Fiend  Undying  Centaur Warrunner  Snapfire","Team A"
"7125949168","15126","26 Apr 2023 10:00","1709","28:29","Team B","Vision","Bounty Hunter  Disruptor  Visage  Ember Spirit  Muerta","IHC","Phantom Lancer  Omniknight  Brewmaster  Undying  Rubick","Team B"
"7126027509","15126","26 Apr 2023 11:30","2013","33:33","Team A","Myth Avenue Gaming","Crystal Maiden  Sven  Magnus  Skywrath Mage  Primal Beast","IHC","Broodmother  Undying  Rubick  Ember Spirit  Monkey King","Team A"
"7126118055","15126","26 Apr 2023 01:00","1781","29:41","Team A","Myth Avenue Gaming","Crystal Maiden  Sven  Leshrac  Doom  Skywrath Mage","Vision","Omniknight  Undying  Rubick  Tusk  Arc Warden","Team B"
"7126196223","15126","26 Apr 2023 02:03","2488","41:28","Team A","IHC","Mirana  Batrider  Alchemist  Pangolier  Marci","Vision","Undying  Slark  Tusk  Earth Spirit  Snapfire","Team A"
"7126512031","15251","26 Apr 2023 05:21","2085","34:45","Team B","OG","Beastmaster  Venomancer  Slark  Phoenix  Void Spirit","Team SMG","Morphling  Leshrac  Undying  Rubick  Muerta","Team A"
"7127076062","15087","27 Apr 2023 02:02","2477","41:17","Team B","The Cut","Queen of Pain  Templar Assassin  Clockwerk  Skywrath Mage  Underlord","TiltedBoys","Anti-Mage  Death Prophet  Alchemist  Undying  Techies","Team A"
"7127481717","15251","27 Apr 2023 12:00","2700","45:00","Team A","Gaimin Gladiators","Drow Ranger  Dragon Knight  Enchantress  Doom  Skywrath Mage","BetBoom Team","Storm Spirit  Beastmaster  Pugna  Undying  Terrorblade","Team B"
"7127536763","15251","27 Apr 2023 01:00","2183","36:23","Team A","Evil Geniuses","Luna  Disruptor  Skywrath Mage  Legion Commander  Mars","PSG.LGD","Alchemist  Brewmaster  Undying  Rubick  Terrorblade","Team B"
"7127562163","15251","27 Apr 2023 01:25","1550","25:50","Team A","Team Aster","Bloodseeker  Storm Spirit  Rubick  Io  Terrorblade","Execration","Kunkka  Undying  Disruptor  Underlord  Muerta","Team A"
"7127659623","15251","27 Apr 2023 02:33","1885","31:25","Team B","Team Liquid","Dark Seer  Doom  Alchemist  Slark  Skywrath Mage","BetBoom Team","Pudge  Necrophos  Venomancer  Undying  Terrorblade","Team A"
"7128238477","15251","27 Apr 2023 08:55","1590","26:30","Team B","Team Spirit","Crystal Maiden  Queen of Pain  Silencer  Slark  Primal Beast","INVICTUS GAMING","Bloodseeker  Sven  Enchantress  Undying  Void Spirit","Team A"
"7129558832","14691","28 Apr 2023 07:07","2984","49:44","Team B","Luna Galaxy","Sven  Death Prophet  Silencer  Nyx Assassin  Underlord","Please dont gank my carry","Alchemist  Undying  Disruptor  Timbersaw  Pangolier","Team B"
"7129667054","14691","28 Apr 2023 08:23","2665","44:25","Team A","Luna Galaxy","Anti-Mage  Dark Seer  Bounty Hunter  Silencer  Void Spirit","Please dont gank my carry","Bloodseeker  Tiny  Undying  Rubick  Mars","Team B"
"7130008126","15267","29 Apr 2023 01:56","2890","48:10","Team A","Mad Kings Esports","Crystal Maiden  Bounty Hunter  Skywrath Mage  Ember Spirit  Monkey King","Balrogs Esports™","Riki  Jakiro  Undying  Keeper of the Light  Slark","Team B"
"7131067725","15251","29 Apr 2023 05:39","1286","21:26","Team A","Talon","Pugna  Medusa  Techies  Underlord  Void Spirit","Shopify Rebellion","Tiny  Doom  Undying  Keeper of the Light  Arc Warden","Team A"
"7131394097","15251","29 Apr 2023 09:15","1715","28:35","Team B","Tundra Esports","Crystal Maiden  Windranger  Wraith King  Keeper of the Light  Underlord","beastcoast","Lich  Viper  Doom  Ursa  Undying","Team A"
"7131404269","15251","29 Apr 2023 09:22","2362","39:22","Team B","Shopify Rebellion","Anti-Mage  Beastmaster  Silencer  Rubick  Void Spirit","OG","Storm Spirit  Slardar  Undying  Io  Medusa","Team B"
"7132920181","15251","30 Apr 2023 07:15","2083","34:43","Team B","Team Aster","Crystal Maiden  Windranger  Keeper of the Light  Medusa  Underlord","BetBoom Team","Pudge  Storm Spirit  Ursa  Undying  Snapfire","Team A"
"7134272701","15251","01 May 2023 03:51","2110","35:10","Team A","Team Liquid","Witch Doctor  Alchemist  Skywrath Mage  Underlord  Muerta","OG","Tidehunter  Undying  Keeper of the Light  Terrorblade  Void Spirit","Team B"
"7145678244","15268","08 May 2023 09:59","1902","31:42","Team A","Mad Kings Esports","Sven  Batrider  Keeper of the Light  Underlord  Oracle","Universitario eSports","Templar Assassin  Doom  Undying  Rubick  Ember Spirit","Team B"
"7146039354","15128","09 May 2023 06:12","1734","28:54","Team B","MIRACLE ESPORT","Anti-Mage  Axe  Crystal Maiden  Skywrath Mage  Monkey King","Virgo","Doom  Undying  Keeper of the Light  Medusa  Magnus","Team B"
"7147449612","15268","10 May 2023 02:46","2756","45:56","Team A","Vivo Keyd Stars","Crystal Maiden  Puck  Nature's Prophet  Bounty Hunter  Doom","Balrogs Esports™","Shadow Fiend  Storm Spirit  Undying  Disruptor  Keeper of the Light","Team A"
"7148680651","15268","10 May 2023 10:00","1318","21:58","Team A","Balrogs Esports™","Bloodseeker  Crystal Maiden  Batrider  Rubick  Underlord","Mad Kings Esports","Pugna  Omniknight  Alchemist  Undying  Ember Spirit","Team B"
"7148859820","15268","11 May 2023 02:21","2568","42:48","Team B","Vivo Keyd Stars","Venomancer  Ursa  Rubick  Ember Spirit  Underlord","Universitario eSports","Queen of Pain  Luna  Doom  Undying  Techies","Team B"
"7148953617","15128","11 May 2023 05:12","1578","26:18","Team B","Virgo","Bloodseeker  Storm Spirit  Pugna  Clockwerk  Terrorblade","Outsider From CN","Undying  Rubick  Nyx Assassin  Slark  Ember Spirit","Team A"
"7150150830","15268","11 May 2023 11:00","1777","29:37","Team B","Thunder Awaken","Anti-Mage  Enchantress  Techies  Ember Spirit  Monkey King","Hokori","Storm Spirit  Beastmaster  Undying  Rubick  Medusa","Team A"
"7151598259","15268","12 May 2023 10:15","2436","40:36","Team B","Universitario eSports","Enchantress  Rubick  Slark  Underlord  Void Spirit","Balrogs Esports™","Faceless Void  Doom  Undying  Skywrath Mage  Ember Spirit","Team B"
"7154585505","15335","14 May 2023 05:07","2425","40:25","Team B","One Move","Crystal Maiden  Mirana  Doom  Slark  Timbersaw","UALEIKUMNIHAO","Enigma  Jakiro  Alchemist  Undying  Underlord","Team A"
"7154912193","15365","14 May 2023 08:37","1869","31:09","Team A","INFINITY","Mirana  Beastmaster  Alchemist  Silencer  Monkey King","Acatsuki","Windranger  Templar Assassin  Undying  Rubick  Underlord","Team A"
"7155641532","15333","15 May 2023 01:05","2025","33:45","Team B","Anime Enjoyers","Storm Spirit  Rubick  Disruptor  Underlord  Monkey King","Reverse Measurement","Leshrac  Dark Seer  Spirit Breaker  Undying  Slark","Team A"
"7155641843","15333","15 May 2023 01:05","1415","23:35","Team B","LFT","Crystal Maiden  Venomancer  Leshrac  Alchemist  Io","KillerWhale","Drow Ranger  Dark Seer  Bounty Hunter  Undying  Primal Beast","Team A"
"7155643885","15333","15 May 2023 01:07","2154","35:54","Team A","5 nyashek","Ogre Magi  Disruptor  Keeper of the Light  Ember Spirit  Terrorblade","Amkar Esports","Batrider  Alchemist  Undying  Rubick  Underlord","Team A"
"7155646331","15333","15 May 2023 01:10","992","16:32","Team B","Ka Le","Beastmaster  Queen of Pain  Venomancer  Keeper of the Light  Monkey King","xFinity","Drow Ranger  Storm Spirit  Doom  Undying  Techies","Team A"
"7155714578","15333","15 May 2023 02:08","1098","18:18","Team B","S.W.A.T.","Faceless Void  Batrider  Doom  Rubick  Disruptor","FiveFeeders","Bounty Hunter  Invoker  Undying  Slark  Dawnbreaker","Team A"
"7155815480","14691","15 May 2023 03:24","2904","48:24","Team A","Ancient Tribe","Bloodseeker  Beastmaster  Pugna  Batrider  Skywrath Mage","KZ TEAM","Weaver  Doom  Undying  Techies  Ember Spirit","Team B"
"7155842837","15333","15 May 2023 03:35","3069","51:09","Team B","Ka Le","Dark Seer  Bounty Hunter  Ancient Apparition  Legion Commander  Arc Warden","4u4uwara","Alchemist  Undying  Terrorblade  Phoenix  Void Spirit","Team A"
"7155960316","15333","15 May 2023 04:46","1531","25:31","Team A","Unknown Radiant Team","Venomancer  Luna  Batrider  Rubick  Centaur Warrunner","Nesquick S Pivom","Lion  Sniper  Doom  Undying  Pangolier","Team A"
"7156260357","15351","15 May 2023 08:22","1889","31:29","Team A","Gaimin Gladiators","Sven  Beastmaster  Silencer  Techies  Pangolier","Quest Esports","Drow Ranger  Death Prophet  Undying  Rubick  Timbersaw","Team A"
"7156376059","15268","15 May 2023 09:59","2328","38:48","Team A","Vivo Keyd Stars","Crystal Maiden  Queen of Pain  Underlord  Terrorblade  Monkey King","INFINITY","Shadow Fiend  Dark Seer  Undying  Skywrath Mage  Pangolier","Team B"
"7156491887","15268","16 May 2023 12:25","2443","40:43","Team B","Vivo Keyd Stars","Beastmaster  Enchantress  Batrider  Techies  Monkey King","INFINITY","Undying  Keeper of the Light  Legion Commander  Terrorblade  Pangolier","Team A"
"7156565048","15346","16 May 2023 02:44","2272","37:52","Team B","GateKept","Death Prophet  Pugna  Doom  Chaos Knight  Skywrath Mage","American goons","Crystal Maiden  Alchemist  Undying  Rubick  Pangolier","Team B"
"7156585062","15346","16 May 2023 03:24","1939","32:19","Team B","CDUB ESPORTS ACADEMY","Sven  Tusk  Techies  Ember Spirit  Dawnbreaker","GRIN Esports","Doom  Invoker  Undying  Rubick  Terrorblade","Team B"
"7156674835","15385","16 May 2023 05:59","2209","36:49","Team A","iG.Vitality","Lich  Dragon Knight  Doom  Terrorblade  Hoodwink","dldfans","Morphling  Queen of Pain  Undying  Rubick  Centaur Warrunner","Team B"
"7157004809","14691","16 May 2023 01:10","2260","37:40","Team B","IVY","Bloodseeker  Crystal Maiden  Storm Spirit  Enchantress  Magnus","Ancient Tribe","Tiny  Beastmaster  Undying  Techies  Terrorblade","Team A"
"7157115495","15333","16 May 2023 02:30","1712","28:32","Team B","Not one step back gaming","Shadow Fiend  Beastmaster  Chen  Slark  Snapfire","Storm Strikers","Alchemist  Undying  Rubick  Underlord  Primal Beast","Team A"
"7157486919","15335","16 May 2023 06:28","1875","31:15","Team A","Nemiga Gaming","Phantom Lancer  Vengeful Spirit  Beastmaster  Clinkz  Primal Beast","9Pandas","Doom  Undying  Naga Siren  Keeper of the Light  Pangolier","Team B"
"7157873842","15365","17 May 2023 12:39","2348","39:08","Team B","Mad Kings Esports","Lich  Tinker  Doom  Alchemist  Techies","Acatsuki","Tidehunter  Pugna  Undying  Rubick  Terrorblade","Team A"
"7158127402","15385","17 May 2023 07:55","3319","55:19","Team A","dldfans","Lich  Doom  Rubick  Naga Siren  Ember Spirit","The last dark","Beastmaster  Queen of Pain  Alchemist  Undying  Disruptor","Team B"
"7158411382","15333","17 May 2023 01:19","2267","37:47","Team B","Unity Esports","Storm Spirit  Silencer  Chaos Knight  Underlord  Hoodwink","Sibe Team","Tiny  Batrider  Undying  Skywrath Mage  Muerta","Team B"
"7158414775","15333","17 May 2023 01:22","1230","20:30","Team A","Rising in the Shadows","Phantom Lancer  Bounty Hunter  Skywrath Mage  Abaddon  Ember Spirit","marlerino eSports","Death Prophet  Templar Assassin  Undying  Rubick  Magnus","Team B"
"7158482573","15333","17 May 2023 02:16","1240","20:40","Team B","GALKYNYSH","Phantom Lancer  Pugna  Doom  Rubick  Winter Wyvern","SIBE team","Undying  Keeper of the Light  Magnus  Techies  Muerta","Team B"
"7158487309","15333","17 May 2023 02:19","1365","22:45","Team A","OnlyFans","Crystal Maiden  Windranger  Chaos Knight  Techies  Underlord","FireBloom","Bounty Hunter  Invoker  Undying  Visage  Medusa","Team B"
"7158523594","15333","17 May 2023 02:44","3141","52:21","Team B","Sibe Team","Crystal Maiden  Juggernaut  Skywrath Mage  Ember Spirit  Underlord","Chikara","Bloodseeker  Queen of Pain  Alchemist  Undying  Rubick","Team B"
"7158529974","14691","17 May 2023 02:49","1919","31:59","Team A","IVY","Bloodseeker  Viper  Enchantress  Doom  Oracle","KZ TEAM","Windranger  Templar Assassin  Undying  Rubick  Magnus","Team B"
"7158560741","15333","17 May 2023 03:09","2990","49:50","Team A","SIBE team","Queen of Pain  Venomancer  Rubick  Magnus  Mars","love nut","Windranger  Batrider  Spirit Breaker  Undying  Pangolier","Team A"
"7158655586","15333","17 May 2023 04:06","1730","28:50","Team B","AlexFamily","Crystal Maiden  Windranger  Enigma  Skywrath Mage  Monkey King","Chikara","Riki  Pugna  Bounty Hunter  Undying  Ember Spirit","Team A"
"7158752494","15347","17 May 2023 05:05","1285","21:25","Team B","Gen of Miracles","Beastmaster  Queen of Pain  Faceless Void  Rubick  Snapfire","based team","Puck  Enchantress  Undying  Magnus  Legion Commander","Team B"
"7159023113","15347","17 May 2023 08:16","3561","59:21","Team A","KZ TEAM","Dark Seer  Invoker  Disruptor  Primal Beast  Muerta","based team","Undying  Rubick  Underlord  Terrorblade  Pangolier","Team A"
"7159230776","15350","17 May 2023 11:57","2015","33:35","Team A","felt","Queen of Pain  Spirit Breaker  Rubick  Medusa  Underlord","DogChamp","Storm Spirit  Doom  Ursa  Undying  Skywrath Mage","Team A"
"7159305519","15346","18 May 2023 02:11","2417","40:17","Team A","the xdders","Windranger  Beastmaster  Pugna  Medusa  Void Spirit","Full Chill","Sand King  Storm Spirit  Undying  Magnus  Skywrath Mage","Team A"
"7159338008","15268","18 May 2023 03:24","2266","37:46","Team A","Vivo Keyd Stars","Mirana  Enchantress  Batrider  Doom  Terrorblade","Thunder Awaken","Phantom Lancer  Undying  Keeper of the Light  Oracle  Pangolier","Team B"
"7159359662","15385","18 May 2023 04:08","2150","35:50","Team A","ToLight","Doom  Disruptor  Keeper of the Light  Ember Spirit  Terrorblade","iG.Vitality","Storm Spirit  Ursa  Undying  Centaur Warrunner  Techies","Team A"
"7159424404","15385","18 May 2023 05:51","1924","32:04","Team A","ToLight","Mirana  Nature's Prophet  Doom  Skywrath Mage  Ember Spirit","iG.Vitality","Shadow Fiend  Chaos Knight  Undying  Centaur Warrunner  Techies","Team B"
"7159556572","15385","18 May 2023 09:13","3769","1:02:49","Team B","Arcane","Doom  Keeper of the Light  Medusa  Techies  Void Spirit","dldfans","Undying  Rubick  Slark  Centaur Warrunner  Monkey King","Team A"
"7159591507","14691","18 May 2023 10:00","3501","58:21","Team B","Unity Esports","Enchantress  Keeper of the Light  Medusa  Magnus  Pangolier","Gen of Miracles","Storm Spirit  Sniper  Pugna  Undying  Underlord","Team B"
"7159716062","14691","18 May 2023 12:26","2149","35:49","Team A","Gen of Miracles","Crystal Maiden  Morphling  Queen of Pain  Legion Commander  Techies","Unity Esports","Beastmaster  Undying  Medusa  Skywrath Mage  Void Spirit","Team B"
"7159782438","14691","18 May 2023 01:33","3795","1:03:15","Team B","Ancient Tribe","Juggernaut  Viper  Spirit Breaker  Disruptor  Underlord","RAM SQUAD","Morphling  Windranger  Undying  Techies  Mars","Team A"
"7160110072","15335","18 May 2023 05:08","1988","33:08","Team B","HYDRA","Crystal Maiden  Windranger  Alchemist  Timbersaw  Techies","BetBoom Team","Tidehunter  Enchantress  Undying  Medusa  Void Spirit","Team B"
"7160565594","15365","18 May 2023 11:02","2790","46:30","Team B","beastcoast","Beastmaster  Skywrath Mage  Terrorblade  Phoenix  Pangolier","INFINITY","Shadow Fiend  Dark Seer  Doom  Undying  Techies","Team B"
"7161152252","15333","19 May 2023 01:03","1136","18:56","Team B","Fiery Bubble","Crystal Maiden  Storm Spirit  Clinkz  Ogre Magi  Muerta","SaveTechies","Tinker  Venomancer  Undying  Bristleback  Marci","Team A"
"7161231274","15333","19 May 2023 02:08","1212","20:12","Team B","xFinity","Axe  Phantom Lancer  Riki  Venomancer  Dazzle","MPGU","Queen of Pain  Omniknight  Ursa  Undying  Techies","Team B"
"7161385061","15333","19 May 2023 03:47","1331","22:11","Team A","Wild Pandaz","Juggernaut  Witch Doctor  Doom  Rubick  Pangolier","SIBE team","Tiny  Beastmaster  Pugna  Undying  Muerta","Team B"
"7161480800","15347","19 May 2023 04:42","1759","29:19","Team B","Gen of Miracles","Bloodseeker  Disruptor  Techies  Underlord  Monkey King","Twisted Minds","Earthshaker  Undying  Rubick  Magnus  Ember Spirit","Team B"
"7161498602","15333","19 May 2023 04:52","1511","25:11","Team B","SIBE team","Shadow Fiend  Batrider  Disruptor  Keeper of the Light  Pangolier","MPGU","Windranger  Omniknight  Undying  Rubick  Slark","Team A"
"7161552014","15333","19 May 2023 05:22","1851","30:51","Team B","sQreens squad","Tiny  Clockwerk  Medusa  Magnus  Void Spirit","Sibe Team","Windranger  Spirit Breaker  Undying  Visage  Muerta","Team A"
"7161570580","15347","19 May 2023 05:33","1762","29:22","Team B","HAVU","Batrider  Ancient Apparition  Rubick  Naga Siren  Magnus","Norf","Axe  Undying  Slark  Techies  Void Spirit","Team A"
"7161630752","15351","19 May 2023 06:17","1631","27:11","Team A","Luna Galaxy","Lich  Faceless Void  Clinkz  Underlord  Void Spirit","Team Liquid","Windranger  Venomancer  Templar Assassin  Spirit Breaker  Undying","Team A"
"7162106549","15350","20 May 2023 12:48","2077","34:37","Team B","Shopify Rebellion","Windranger  Lion  Doom  Phoenix  Pangolier","SAND KING GÓMEZ","Puck  Tidehunter  Undying  Rubick  Terrorblade","Team A"
"7162485938","15383","20 May 2023 09:07","3411","56:51","Team A","INVICTUS GAMING","Morphling  Doom  Keeper of the Light  Oracle  Pangolier","Team Bright","Bounty Hunter  Spirit Breaker  Undying  Medusa  Ember Spirit","Team B"
"7162683393","15383","20 May 2023 11:53","2577","42:57","Team B","INVICTUS GAMING","Crystal Maiden  Pudge  Faceless Void  Timbersaw  Ember Spirit","Team Bright","Dark Seer  Bounty Hunter  Undying  Medusa  Void Spirit","Team A"
"7162708105","14691","20 May 2023 12:16","4845","1:20:45","Team A","HAVU","Doom  Disruptor  Naga Siren  Timbersaw  Techies","Gen of Miracles","Queen of Pain  Clinkz  Undying  Legion Commander  Muerta","Team B"
"7162938554","15333","20 May 2023 02:57","2319","38:39","Team B","Storm Strikers","Windranger  Doom  Silencer  Rubick  Terrorblade","SIBE team","Tiny  Batrider  Undying  Oracle  Muerta","Team B"
"7163343399","15335","20 May 2023 07:12","3214","53:34","Team B","Virtus.pro","Luna  Spirit Breaker  Magnus  Skywrath Mage  Pangolier","BetBoom Team","Tiny  Undying  Keeper of the Light  Medusa  Underlord","Team B"
"7163479094","15335","20 May 2023 08:30","2044","34:04","Team A","Virtus.pro","Juggernaut  Shadow Demon  Magnus  Skywrath Mage  Ember Spirit","BetBoom Team","Axe  Tiny  Undying  Keeper of the Light  Terrorblade","Team B"
"7163761837","15350","21 May 2023 12:44","1502","25:02","Team B","ALPHA","Crystal Maiden  Mirana  Batrider  Alchemist  Void Spirit","TSM","Vengeful Spirit  Windranger  Doom  Undying  Medusa","Team B"
"7163884523","15350","21 May 2023 03:58","2580","43:00","Team A","B8","Windranger  Enchantress  Bounty Hunter  Techies  Monkey King","SAND KING GÓMEZ","Mirana  Storm Spirit  Phantom Assassin  Undying  Underlord","Team A"
"7164235672","15349","21 May 2023 10:00","1765","29:25","Team A","IVY","Windranger  Bounty Hunter  Doom  Medusa  Skywrath Mage","Gen of Miracles","Pugna  Undying  Centaur Warrunner  Tusk  Muerta","Team A"
"7164591886","15349","21 May 2023 02:10","2749","45:49","Team A","KZ TEAM","Venomancer  Invoker  Naga Siren  Magnus  Earth Spirit","RAM SQUAD","Morphling  Puck  Beastmaster  Undying  Rubick","Team A"
"7164785407","15335","21 May 2023 04:02","1934","32:14","Team A","One Move","Crystal Maiden  Mirana  Riki  Chaos Knight  Timbersaw","9Pandas","Windranger  Beastmaster  Invoker  Undying  Skywrath Mage","Team B"
"7164887164","15334","21 May 2023 04:53","2936","48:56","Team A","Matreshka","Bloodseeker  Queen of Pain  Clinkz  Jakiro  Doom","SIBE team","Earthshaker  Puck  Undying  Keeper of the Light  Terrorblade","Team A"
"7164909303","15335","21 May 2023 05:04","2156","35:56","Team A","9Pandas","Tinker  Beastmaster  Bounty Hunter  Alchemist  Skywrath Mage","One Move","Undying  Medusa  Techies  Underlord  Primal Beast","Team A"
"7164917112","14691","21 May 2023 05:03","2091","34:51","Team B","RAM SQUAD","Lich  Tinker  Clockwerk  Doom  Slark","Gen of Miracles","Storm Spirit  Pugna  Undying  Terrorblade  Marci","Team B"
"7165371772","15348","21 May 2023 10:24","1465","24:25","Team B","5meow","Ursa  Alchemist  Outworld Devourer  Ogre Magi  Oracle","American goons","Undying  Naga Siren  Magnus  Techies  Void Spirit","Team B"
"7165653736","15377","22 May 2023 05:40","1971","32:51","Team A","TeamKicked","Doom  Disruptor  Naga Siren  Techies  Pangolier","We Own | Carstensz","Windranger  Dark Seer  Undying  Slark  Earth Spirit","Team A"
"7165897272","15334","22 May 2023 11:16","1866","31:06","Team A","Not one step back gaming","Meepo  Timbersaw  Abaddon  Dark Willow  Snapfire","SIBE team","Bloodseeker  Beastmaster  Queen of Pain  Undying  Rubick","Team A"
"7165951732","15334","22 May 2023 12:14","2051","34:11","Team A","Not one step back gaming","Medusa  Timbersaw  Monkey King  Dark Willow  Snapfire","SIBE team","Beastmaster  Undying  Ember Spirit  Terrorblade  Grimstroke","Team A"
"7166299913","15351","22 May 2023 04:21","1343","22:23","Team A","Team Secret","Bloodseeker  Earthshaker  Lich  Leshrac  Techies","OG","Faceless Void  Enchantress  Undying  Skywrath Mage  Void Spirit","Team B"
"7166560470","15348","22 May 2023 07:01","1896","31:36","Team A","CDUB ESPORTS ACADEMY","Lich  Phantom Assassin  Doom  Invoker  Monkey King","CAP","Windranger  Queen of Pain  Huskar  Undying  Skywrath Mage","Team B"
"7166729681","15364","22 May 2023 09:12","2256","37:36","Team B","Pacific","Pugna  Spirit Breaker  Techies  Terrorblade  Pangolier","Chandogs","Alchemist  Undying  Rubick  Magnus  Void Spirit","Team A"
"7166781133","15348","22 May 2023 09:54","2296","38:16","Team A","For Fun","Lich  Spirit Breaker  Legion Commander  Ember Spirit  Muerta","5meow","Phantom Lancer  Windranger  Bounty Hunter  Undying  Techies","Team B"
"7166966416","15350","23 May 2023 02:26","1725","28:45","Team A","TSM","Vengeful Spirit  Windranger  Beastmaster  Magnus  Phoenix","DogChamp","Queen of Pain  Pugna  Doom  Undying  Terrorblade","Team A"
"7167033489","15364","23 May 2023 04:30","2340","39:00","Team A","NoLimitsGaming","Queen of Pain  Lifestealer  Treant Protector  Skywrath Mage  Legion Commander","Team Rocket","Beastmaster  Chaos Knight  Undying  Ember Spirit  Phoenix","Team A"
"7167075890","15364","23 May 2023 05:34","2066","34:26","Team B","NoLimitsGaming","Crystal Maiden  Rubick  Timbersaw  Legion Commander  Terrorblade","Team Rocket","Tidehunter  Alchemist  Undying  Skywrath Mage  Ember Spirit","Team B"
