"Match ID","League","Start Date","Duration (s)","Duration (mm:ss)","Radiant Team","Team A","Team A Heroes","Team B","Team B Heroes","Winner"
"7192426820","15375","09 Jun 2023 11:44","2227","37:07","Team B","Neon Esports","Lich  Faceless Void  Rubick  Magnus  Void Spirit","Myth Avenue Gaming","Enigma  Batrider  Keeper of the Light  Terrorblade  Pangolier","Team B"
"7192646349","15352","09 Jun 2023 02:57","2269","37:49","Team A","Nigma Galaxy","Witch Doctor  Beastmaster  Techies  Monkey King  Void Spirit","Ancient Tribe","Bloodseeker  Lich  Necrophos  Pugna  Doom","Team A"
"7193202445","15352","09 Jun 2023 09:21","2836","47:16","Team A","ITB.Shuffle","Batrider  Terrorblade  Oracle  Winter Wyvern  Void Spirit","Alliance","Beastmaster  Venomancer  Naga Siren  Skywrath Mage  Pangolier","Team A"
"7193283333","15352","09 Jun 2023 10:36","2658","44:18","Team B","ITB.Shuffle","Windranger  Pugna  Spirit Breaker  Winter Wyvern  Void Spirit","Alliance","Puck  Beastmaster  Jakiro  Batrider  Terrorblade","Team B"
"7193354866","15352","09 Jun 2023 11:51","2230","37:10","Team B","ITB.Shuffle","Enigma  Pugna  Batrider  Arc Warden  Void Spirit","Alliance","Doom  Disruptor  Slark  Techies  Pangolier","Team A"
"7193356912","15353","09 Jun 2023 11:55","2491","41:31","Team B","GRIN Esports","Mirana  Wraith King  Magnus  Oracle  Void Spirit","American goons","Bloodseeker  Batrider  Doom  Rubick  Timbersaw","Team B"
"7193405363","15353","10 Jun 2023 01:00","2593","43:13","Team B","American goons","Crystal Maiden  Windranger  Beastmaster  Rubick  Void Spirit","GRIN Esports","Phantom Assassin  Clinkz  Shadow Demon  Magnus  Marci","Team A"
"7193467352","15353","10 Jun 2023 02:54","3878","1:04:38","Team A","CDUB Esports","Brewmaster  Keeper of the Light  Magnus  Oracle  Void Spirit","The Cut","Lich  Beastmaster  Templar Assassin  Timbersaw  Skywrath Mage","Team A"
"7193525088","15353","10 Jun 2023 04:29","1930","32:10","Team A","CDUB Esports","Jakiro  Nyx Assassin  Keeper of the Light  Abaddon  Void Spirit","The Cut","Batrider  Shadow Demon  Medusa  Skywrath Mage  Underlord","Team A"
"7193593971","15384","10 Jun 2023 06:01","2562","42:42","Team B","Team Disillusion","Windranger  Silencer  Abaddon  Earth Spirit  Void Spirit","Limit","Morphling  Pugna  Nyx Assassin  Timbersaw  Pangolier","Team A"
"7193654090","15384","10 Jun 2023 07:13","1927","32:07","Team A","Team Disillusion","Venomancer  Timbersaw  Legion Commander  Techies  Void Spirit","Limit","Vengeful Spirit  Windranger  Luna  Silencer  Visage","Team B"
"7193817332","15384","10 Jun 2023 10:08","1914","31:54","Team A","iG.Vitality","Faceless Void  Magnus  Techies  Dark Willow  Void Spirit","The last dark","Morphling  Vengeful Spirit  Windranger  Beastmaster  Shadow Demon","Team B"
"7194013477","15336","10 Jun 2023 01:00","2890","48:10","Team B","Matreshka","Templar Assassin  Doom  Rubick  Techies  Void Spirit","Team Sexy","Windranger  Pugna  Abaddon  Underlord  Pangolier","Team A"
"7194271596","15336","10 Jun 2023 04:01","1946","32:26","Team B","cybercats","Spirit Breaker  Medusa  Techies  Void Spirit  Primal Beast","Sibe Team","Morphling  Windranger  Beastmaster  Enchantress  Skywrath Mage","Team A"
"7194571754","15366","10 Jun 2023 07:04","2791","46:31","Team A","x5 Gaming","Crystal Maiden  Morphling  Spirit Breaker  Techies  Void Spirit","Lava Esports","Clockwerk  Batrider  Medusa  Timbersaw  Tusk","Team A"
"7194686643","15366","10 Jun 2023 08:20","2148","35:48","Team B","x5 Gaming","Juggernaut  Disruptor  Magnus  Techies  Void Spirit","Lava Esports","Dark Seer  Enchantress  Spirit Breaker  Medusa  Pangolier","Team B"
"7194759905","15366","10 Jun 2023 09:23","1641","27:21","Team B","x5 Gaming","Crystal Maiden  Undying  Keeper of the Light  Bristleback  Void Spirit","Lava Esports","Juggernaut  Rubick  Disruptor  Magnus  Ember Spirit","Team B"
"7194952283","15366","11 Jun 2023 12:55","2500","41:40","Team A","Universitario eSports","Pugna  Spirit Breaker  Rubick  Slark  Void Spirit","noMERCY","Juggernaut  Tidehunter  Techies  Ember Spirit  Oracle","Team A"
"7195154406","15384","11 Jun 2023 06:04","1562","26:02","Team A","The last dark","Vengeful Spirit  Beastmaster  Queen of Pain  Batrider  Void Spirit","Team Disillusion","Viper  Rubick  Magnus  Timbersaw  Skywrath Mage","Team A"
"7195191787","15384","11 Jun 2023 06:53","2089","34:49","Team B","The last dark","Clockwerk  Magnus  Phoenix  Void Spirit  Muerta","Team Disillusion","Morphling  Queen of Pain  Doom  Silencer  Rubick","Team A"
"7195243135","15375","11 Jun 2023 07:55","2541","42:21","Team B","Polaris Esports","Mirana  Venomancer  Doom  Medusa  Void Spirit","IHC","Broodmother  Rubick  Skywrath Mage  Earth Spirit  Underlord","Team A"
"7195310179","15375","11 Jun 2023 09:00","2229","37:09","Team B","Polaris Esports","Mirana  Doom  Alchemist  Oracle  Void Spirit","IHC","Windranger  Venomancer  Phoenix  Monkey King  Pangolier","Team A"
"7195385327","15375","11 Jun 2023 10:01","3012","50:12","Team A","UD VESSUWAN","Silencer  Shadow Demon  Medusa  Underlord  Void Spirit","Geek Slate","Axe  Storm Spirit  Broodmother  Batrider  Skywrath Mage","Team A"
"7195403700","15384","11 Jun 2023 10:21","2307","38:27","Team B","Supernova","Lich  Tinker  Bounty Hunter  Phoenix  Void Spirit","Holy Grail","Beastmaster  Medusa  Ember Spirit  Oracle  Dark Willow","Team B"
"7195467820","15375","11 Jun 2023 11:16","1239","20:39","Team A","UD VESSUWAN","Phantom Lancer  Undying  Magnus  Dark Willow  Void Spirit","Geek Slate","Morphling  Storm Spirit  Vengeful Spirit  Pugna  Dark Seer","Team B"
"7195520227","15439","11 Jun 2023 11:56","2513","41:53","Team A","PSG.LGD","Windranger  Rubick  Winter Wyvern  Void Spirit  Muerta","Evil Geniuses","Lich  Doom  Magnus  Monkey King  Snapfire","Team A"
"7195524575","15384","11 Jun 2023 11:59","1312","21:52","Team A","Big brain","Doom  Alchemist  Silencer  Dark Willow  Void Spirit","Team Zero","Windranger  Venomancer  Spirit Breaker  Timbersaw  Terrorblade","Team B"
"7195583005","15384","11 Jun 2023 12:45","2240","37:20","Team A","Team Zero","Windranger  Lion  Enchantress  Medusa  Void Spirit","Big brain","Beastmaster  Shadow Demon  Rubick  Terrorblade  Winter Wyvern","Team A"
"7195717940","15439","11 Jun 2023 02:25","2220","37:00","Team B","Entity","Lich  Doom  Slark  Skywrath Mage  Void Spirit","9Pandas","Beastmaster  Faceless Void  Undying  Rubick  Magnus","Team B"
"7195722054","15439","11 Jun 2023 02:25","2672","44:32","Team A","BetBoom Team","Undying  Keeper of the Light  Medusa  Legion Commander  Void Spirit","Team Aster","Windranger  Doom  Slark  Phoenix  Winter Wyvern","Team A"
"7195736225","15375","11 Jun 2023 02:33","3276","54:36","Team A","Myth Avenue Gaming","Morphling  Batrider  Disruptor  Magnus  Void Spirit","Vision","Windranger  Dark Seer  Spirit Breaker  Slark  Oracle","Team B"
"7195848924","15439","11 Jun 2023 03:49","2363","39:23","Team A","Gaimin Gladiators","Mirana  Dark Seer  Batrider  Abaddon  Void Spirit","Shopify Rebellion","Earthshaker  Beastmaster  Venomancer  Faceless Void  Shadow Demon","Team B"
"7195932733","15352","11 Jun 2023 04:31","1693","28:13","Team A","Ancient Tribe","Crystal Maiden  Beastmaster  Pugna  Viper  Void Spirit","LEVEL UP","Sven  Sniper  Enchantress  Batrider  Spirit Breaker","Team A"
"7195985918","15439","11 Jun 2023 05:21","1755","29:15","Team A","Team Liquid","Luna  Spirit Breaker  Visage  Techies  Void Spirit","Evil Geniuses","Bloodseeker  Death Prophet  Bounty Hunter  Magnus  Skywrath Mage","Team B"
"7195993121","15439","11 Jun 2023 05:08","2607","43:27","Team A","Team Secret","Bane  Bloodseeker  Spirit Breaker  Shadow Demon  Void Spirit","TSM","Morphling  Witch Doctor  Beastmaster  Keeper of the Light  Magnus","Team A"
"7196108192","15439","11 Jun 2023 06:23","3607","1:00:07","Team A","TSM","Templar Assassin  Bounty Hunter  Medusa  Techies  Void Spirit","Team Secret","Phantom Lancer  Chen  Shadow Demon  Magnus  Timbersaw","Team A"
"7196123980","15439","11 Jun 2023 06:35","2887","48:07","Team B","Talon","Morphling  Windranger  Clockwerk  Rubick  Void Spirit","Tundra Esports","Spirit Breaker  Shadow Demon  Medusa  Terrorblade  Primal Beast","Team A"
"7196148239","15352","11 Jun 2023 06:48","2996","49:56","Team B","IVY","Juggernaut  Mirana  Magnus  Oracle  Void Spirit","Nigma Galaxy","Witch Doctor  Faceless Void  Pugna  Huskar  Timbersaw","Team A"
"7196248646","15352","11 Jun 2023 08:07","2782","46:22","Team B","IVY","Mirana  Undying  Magnus  Abaddon  Void Spirit","Nigma Galaxy","Bloodseeker  Doom  Silencer  Techies  Ember Spirit","Team B"
"7196327649","15439","11 Jun 2023 09:13","2693","44:53","Team A","Team Aster","Venomancer  Magnus  Techies  Void Spirit  Snapfire","OG","Templar Assassin  Batrider  Shadow Demon  Abaddon  Phoenix","Team A"
"7196332045","15439","11 Jun 2023 09:24","2053","34:13","Team B","BetBoom Team","Undying  Keeper of the Light  Magnus  Terrorblade  Void Spirit","Shopify Rebellion","Windranger  Batrider  Doom  Timbersaw  Phoenix","Team A"
"7196334944","15352","11 Jun 2023 09:22","2928","48:48","Team B","IVY","Mirana  Naga Siren  Timbersaw  Oracle  Void Spirit","Nigma Galaxy","Lich  Necrophos  Templar Assassin  Doom  Techies","Team A"
"7196433178","15352","11 Jun 2023 10:48","3284","54:44","Team A","Alliance","Batrider  Silencer  Skywrath Mage  Terrorblade  Void Spirit","KZ TEAM","Bloodseeker  Mirana  Vengeful Spirit  Ursa  Ember Spirit","Team A"
"7196512086","15352","12 Jun 2023 12:15","3710","1:01:50","Team B","KZ TEAM","Juggernaut  Pugna  Rubick  Magnus  Void Spirit","Alliance","Puck  Vengeful Spirit  Dark Seer  Medusa  Techies","Team A"
"7196543727","15353","12 Jun 2023 01:05","2288","38:08","Team B","TiltedBoys","Morphling  Undying  Rubick  Void Spirit  Mars","Wildcard","Juggernaut  Beastmaster  Disruptor  Keeper of the Light  Pangolier","Team B"
"7196570714","15352","12 Jun 2023 01:47","2210","36:50","Team A","Alliance","Morphling  Beastmaster  Jakiro  Rubick  Void Spirit","KZ TEAM","Crystal Maiden  Lycan  Techies  Ember Spirit  Terrorblade","Team B"
"7196703667","15353","12 Jun 2023 05:47","2460","41:00","Team B","GRIN Esports","Pugna  Doom  Rubick  Troll Warlord  Void Spirit","Ravens","Windranger  Spirit Breaker  Silencer  Magnus  Ember Spirit","Team B"
"7197053240","15336","12 Jun 2023 01:00","2629","43:49","Team A","Sibe Team","Bloodseeker  Lich  Batrider  Skywrath Mage  Void Spirit","NAVI Junior","Tidehunter  Magnus  Techies  Terrorblade  Oracle","Team B"
"7197063075","15439","12 Jun 2023 01:07","2041","34:01","Team B","PSG.LGD","Phantom Lancer  Lich  Magnus  Skywrath Mage  Void Spirit","Team Secret","Windranger  Templar Assassin  Spirit Breaker  Rubick  Marci","Team A"
"7197159801","15439","12 Jun 2023 02:26","2558","42:38","Team A","OG","Spirit Breaker  Ogre Magi  Medusa  Techies  Void Spirit","BetBoom Team","Bloodseeker  Lich  Keeper of the Light  Ember Spirit  Underlord","Team A"
"7197161670","15439","12 Jun 2023 02:25","1665","27:45","Team A","Team Aster","Mirana  Doom  Keeper of the Light  Void Spirit  Snapfire","9Pandas","Slardar  Templar Assassin  Enchantress  Disruptor  Timbersaw","Team A"
"7197170408","15336","12 Jun 2023 02:28","1951","32:31","Team A","NAVI Junior","Sven  Pugna  Batrider  Magnus  Void Spirit","Sibe Team","Bloodseeker  Storm Spirit  Spirit Breaker  Silencer  Techies","Team A"
"7197268558","15439","12 Jun 2023 03:41","2317","38:37","Team A","OG","Weaver  Batrider  Doom  Disruptor  Void Spirit","BetBoom Team","Storm Spirit  Pugna  Spirit Breaker  Magnus  Terrorblade","Team B"
"7197269361","15439","12 Jun 2023 03:40","3292","54:52","Team B","Shopify Rebellion","Faceless Void  Enchantress  Shadow Demon  Medusa  Void Spirit","Entity","Bane  Windranger  Beastmaster  Dark Seer  Silencer","Team A"
"7197273151","15439","12 Jun 2023 03:48","1572","26:12","Team B","Gaimin Gladiators","Morphling  Dark Seer  Enchantress  Spirit Breaker  Void Spirit","beastcoast","Doom  Medusa  Grimstroke  Snapfire  Mars","Team A"
"7197402650","15439","12 Jun 2023 05:08","2083","34:43","Team B","Team Spirit","Bloodseeker  Enchantress  Rubick  Winter Wyvern  Void Spirit","Team Liquid","Juggernaut  Silencer  Visage  Techies  Marci","Team B"
"7197422278","15336","12 Jun 2023 05:12","2265","37:45","Team B","Moneymakers","Venomancer  Slark  Timbersaw  Techies  Void Spirit","StoRm","Storm Spirit  Batrider  Shadow Demon  Keeper of the Light  Monkey King","Team B"
"7197440936","15439","12 Jun 2023 05:26","2819","46:59","Team B","Talon","Morphling  Rubick  Magnus  Skywrath Mage  Void Spirit","TSM","Storm Spirit  Pugna  Medusa  Abaddon  Techies","Team B"
"7197508252","15439","12 Jun 2023 06:16","2234","37:14","Team A","Team Liquid","Bloodseeker  Pugna  Abaddon  Techies  Void Spirit","Team Spirit","Lich  Beastmaster  Faceless Void  Rubick  Snapfire","Team B"
"7197522265","15439","12 Jun 2023 06:23","2155","35:55","Team B","Team Secret","Beastmaster  Chen  Slark  Techies  Void Spirit","Evil Geniuses","Windranger  Lich  Death Prophet  Bounty Hunter  Monkey King","Team A"
"7197557486","15439","12 Jun 2023 06:46","1427","23:47","Team B","TSM","Lich  Batrider  Visage  Monkey King  Void Spirit","Talon","Bloodseeker  Doom  Silencer  Techies  Ember Spirit","Team B"
"7197599300","15336","12 Jun 2023 07:18","1463","24:23","Team B","Team Sexy","Enigma  Bounty Hunter  Shadow Demon  Medusa  Void Spirit","cybercats","Windranger  Spirit Breaker  Visage  Techies  Pangolier","Team A"
"7197685988","15439","12 Jun 2023 08:33","2644","44:04","Team A","Shopify Rebellion","Mirana  Doom  Silencer  Medusa  Void Spirit","beastcoast","Earthshaker  Shadow Fiend  Templar Assassin  Enchantress  Timbersaw","Team A"
"7197710610","15439","12 Jun 2023 08:57","1425","23:45","Team A","Gaimin Gladiators","Mirana  Lich  Lifestealer  Magnus  Void Spirit","Team Aster","Bloodseeker  Storm Spirit  Silencer  Io  Legion Commander","Team A"
"7197746276","15439","12 Jun 2023 09:21","2140","35:40","Team A","OG","Venomancer  Faceless Void  Keeper of the Light  Monkey King  Void Spirit","Entity","Windranger  Doom  Shadow Demon  Magnus  Skywrath Mage","Team A"
"7197781999","15353","12 Jun 2023 09:55","1747","29:07","Team B","Nexus Titans","Crystal Maiden  Pugna  Outworld Devourer  Medusa  Void Spirit","CDUB Esports","Anti-Mage  Bloodseeker  Disruptor  Magnus  Timbersaw","Team B"
"7197883505","15353","12 Jun 2023 11:55","3115","51:55","Team B","American goons","Templar Assassin  Silencer  Rubick  Underlord  Void Spirit","The Cut","Bloodseeker  Disruptor  Keeper of the Light  Magnus  Ember Spirit","Team A"
"7198009794","15353","13 Jun 2023 03:43","3200","53:20","Team A","GRIN Esports","Lich  Timbersaw  Abaddon  Hoodwink  Void Spirit","Wildcard","Templar Assassin  Batrider  Spirit Breaker  Techies  Monkey King","Team A"
"7198087629","15384","13 Jun 2023 06:09","3081","51:21","Team A","Team Disillusion","Bloodseeker  Batrider  Skywrath Mage  Underlord  Void Spirit","Supernova","Enchantress  Silencer  Magnus  Terrorblade  Pangolier","Team A"
"7198139853","15384","13 Jun 2023 07:29","2517","41:57","Team A","Supernova","Batrider  Undying  Medusa  Timbersaw  Void Spirit","Team Disillusion","Windranger  Dark Seer  Nyx Assassin  Magnus  Skywrath Mage","Team A"
"7198182727","15384","13 Jun 2023 08:32","3395","56:35","Team A","Team Disillusion","Windranger  Silencer  Medusa  Magnus  Void Spirit","Supernova","Batrider  Doom  Rubick  Slark  Snapfire","Team A"
"7198343539","15439","13 Jun 2023 11:56","2630","43:50","Team A","PSG.LGD","Lifestealer  Silencer  Skywrath Mage  Void Spirit  Mars","Team Liquid","Axe  Bloodseeker  Vengeful Spirit  Timbersaw  Phoenix","Team A"
"7198345469","15439","13 Jun 2023 11:55","2457","40:57","Team A","Team Secret","Anti-Mage  Crystal Maiden  Pugna  Magnus  Void Spirit","Tundra Esports","Doom  Shadow Demon  Medusa  Terrorblade  Marci","Team A"
"7198351405","15439","13 Jun 2023 11:59","2174","36:14","Team A","Evil Geniuses","Anti-Mage  Brewmaster  Skywrath Mage  Techies  Void Spirit","TSM","Templar Assassin  Batrider  Shadow Demon  Medusa  Magnus","Team A"
"7198410033","15439","13 Jun 2023 01:07","2725","45:25","Team B","TSM","Batrider  Disruptor  Magnus  Abaddon  Void Spirit","Evil Geniuses","Morphling  Rubick  Techies  Underlord  Snapfire","Team A"
"7198507568","15439","13 Jun 2023 02:28","2598","43:18","Team A","BetBoom Team","Morphling  Pugna  Doom  Spirit Breaker  Void Spirit","beastcoast","Phantom Lancer  Clockwerk  Batrider  Silencer  Dawnbreaker","Team B"
"7198515116","15439","13 Jun 2023 02:35","1406","23:26","Team A","Gaimin Gladiators","Bloodseeker  Dark Seer  Rubick  Techies  Void Spirit","Entity","Beastmaster  Venomancer  Clockwerk  Lone Druid  Disruptor","Team A"
"7198583881","15439","13 Jun 2023 03:30","2859","47:39","Team B","Gaimin Gladiators","Morphling  Undying  Rubick  Medusa  Void Spirit","Entity","Beastmaster  Venomancer  Bounty Hunter  Disruptor  Muerta","Team A"
"7198619685","15439","13 Jun 2023 03:51","2653","44:13","Team A","Shopify Rebellion","Juggernaut  Beastmaster  Enchantress  Shadow Demon  Void Spirit","Team Aster","Lich  Batrider  Lycan  Magnus  Snapfire","Team A"
"7198642526","15336","13 Jun 2023 04:02","2103","35:03","Team B","NAVI Junior","Enchantress  Shadow Demon  Magnus  Pangolier  Void Spirit","StoRm","Morphling  Beastmaster  Pugna  Spirit Breaker  Snapfire","Team A"
"7198743566","15439","13 Jun 2023 05:09","2279","37:59","Team A","Team Liquid","Bounty Hunter  Silencer  Magnus  Terrorblade  Void Spirit","Team Secret","Tiny  Beastmaster  Undying  Disruptor  Medusa","Team B"
"7198760061","15439","13 Jun 2023 05:27","1895","31:35","Team A","Tundra Esports","Bloodseeker  Mirana  Doom  Silencer  Void Spirit","Team Spirit","Juggernaut  Windranger  Lich  Spirit Breaker  Shadow Demon","Team A"
"7198797837","15439","13 Jun 2023 05:44","2524","42:04","Team A","Evil Geniuses","Morphling  Undying  Techies  Void Spirit  Primal Beast","Talon","Puck  Windranger  Spirit Breaker  Silencer  Naga Siren","Team B"
"7198841043","15439","13 Jun 2023 06:17","2461","41:01","Team A","Team Liquid","Windranger  Timbersaw  Phoenix  Winter Wyvern  Void Spirit","Team Secret","Bane  Magnus  Skywrath Mage  Monkey King  Pangolier","Team A"
"7198866748","15439","13 Jun 2023 06:33","1723","28:43","Team A","Tundra Esports","Bloodseeker  Crystal Maiden  Batrider  Rubick  Void Spirit","Team Spirit","Mirana  Beastmaster  Shadow Demon  Abaddon  Ember Spirit","Team B"
"7198929185","15439","13 Jun 2023 07:26","1706","28:26","Team A","Team Aster","Mirana  Doom  Keeper of the Light  Medusa  Void Spirit","beastcoast","Bloodseeker  Kunkka  Venomancer  Templar Assassin  Skywrath Mage","Team A"
"7199008625","15439","13 Jun 2023 08:26","2099","34:59","Team A","Team Aster","Mirana  Faceless Void  Clinkz  Doom  Void Spirit","beastcoast","Clockwerk  Dark Seer  Enchantress  Medusa  Pangolier","Team B"
"7199022943","15439","13 Jun 2023 08:43","1683","28:03","Team B","Gaimin Gladiators","Morphling  Undying  Rubick  Winter Wyvern  Void Spirit","OG","Windranger  Chen  Visage  Timbersaw  Monkey King","Team B"
"7199069620","15366","13 Jun 2023 09:15","2163","36:03","Team A","x5 Gaming","Juggernaut  Batrider  Skywrath Mage  Oracle  Void Spirit","NoPing Esports","Disruptor  Techies  Ember Spirit  Terrorblade  Pangolier","Team B"
"7199075393","15439","13 Jun 2023 09:33","2496","41:36","Team B","Shopify Rebellion","Bloodseeker  Mirana  Pugna  Lycan  Void Spirit","9Pandas","Windranger  Ogre Magi  Undying  Timbersaw  Skywrath Mage","Team A"
"7199198120","15366","13 Jun 2023 11:35","3574","59:34","Team A","Los moticucos","Mirana  Beastmaster  Pugna  Alchemist  Void Spirit","Universitario eSports","Windranger  Clockwerk  Dark Seer  Techies  Ember Spirit","Team B"
"7199295254","15366","14 Jun 2023 02:45","1947","32:27","Team A","noMERCY","Crystal Maiden  Luna  Timbersaw  Void Spirit  Marci","Vivo Keyd Stars","Morphling  Storm Spirit  Pugna  Bounty Hunter  Visage","Team B"
"7199443523","15375","14 Jun 2023 07:01","2937","48:57","Team A","IHC","Anti-Mage  Silencer  Visage  Dark Willow  Void Spirit","Neon Esports","Storm Spirit  Dark Seer  Batrider  Spirit Breaker  Abaddon","Team B"
"7199489468","15375","14 Jun 2023 08:14","2372","39:32","Team B","IHC","Spirit Breaker  Magnus  Timbersaw  Skywrath Mage  Void Spirit","Neon Esports","Phantom Lancer  Storm Spirit  Batrider  Doom  Rubick","Team A"
"7199528663","15375","14 Jun 2023 09:20","1970","32:50","Team B","IHC","Magnus  Timbersaw  Skywrath Mage  Dark Willow  Void Spirit","Neon Esports","Earthshaker  Storm Spirit  Batrider  Alchemist  Silencer","Team B"
"7199657284","15439","14 Jun 2023 11:55","2800","46:40","Team A","Tundra Esports","Pugna  Doom  Medusa  Techies  Void Spirit","Evil Geniuses","Bloodseeker  Windranger  Centaur Warrunner  Skywrath Mage  Monkey King","Team A"
"7199658825","15439","14 Jun 2023 11:55","3043","50:43","Team A","Team Secret","Windranger  Enchantress  Undying  Magnus  Void Spirit","Team Spirit","Lich  Faceless Void  Batrider  Rubick  Pangolier","Team B"
"7199684963","15375","14 Jun 2023 12:24","3227","53:47","Team A","SPAWN Team","Morphling  Windranger  Clockwerk  Silencer  Void Spirit","Geek Slate","Axe  Alchemist  Disruptor  Skywrath Mage  Ember Spirit","Team B"
"7199711324","15439","14 Jun 2023 01:00","2066","34:26","Team A","PSG.LGD","Crystal Maiden  Lycan  Keeper of the Light  Magnus  Void Spirit","Talon","Puck  Windranger  Beastmaster  Silencer  Abaddon","Team B"
"7199729347","15439","14 Jun 2023 01:14","1866","31:06","Team A","Tundra Esports","Doom  Ursa  Shadow Demon  Techies  Void Spirit","Evil Geniuses","Bloodseeker  Shadow Fiend  Pugna  Skywrath Mage  Dawnbreaker","Team B"
"7199776722","15375","14 Jun 2023 01:51","3282","54:42","Team B","Polaris Esports","Enchantress  Spirit Breaker  Abaddon  Legion Commander  Void Spirit","UD VESSUWAN","Naga Siren  Magnus  Techies  Dark Willow  Pangolier","Team A"
"7199811192","15439","14 Jun 2023 02:28","2578","42:58","Team B","Gaimin Gladiators","Faceless Void  Dark Seer  Batrider  Doom  Void Spirit","BetBoom Team","Tiny  Spirit Breaker  Keeper of the Light  Medusa  Magnus","Team B"
"7199868045","15352","14 Jun 2023 02:58","3147","52:27","Team B","ITB.Shuffle","Juggernaut  Shadow Demon  Rubick  Magnus  Void Spirit","Ancient Tribe","Phantom Lancer  Beastmaster  Silencer  Timbersaw  Techies","Team B"
"7199881709","15375","14 Jun 2023 03:09","1339","22:19","Team A","UD VESSUWAN","Windranger  Huskar  Spirit Breaker  Shadow Demon  Void Spirit","Polaris Esports","Queen of Pain  Dark Seer  Batrider  Alchemist  Dark Willow","Team B"
"7199899209","15439","14 Jun 2023 03:25","2527","42:07","Team B","Team Aster","Anti-Mage  Phantom Lancer  Enchantress  Techies  Void Spirit","Entity","Morphling  Windranger  Queen of Pain  Clockwerk  Undying","Team A"
"7199923587","15439","14 Jun 2023 03:42","2448","40:48","Team A","Gaimin Gladiators","Mirana  Lifestealer  Enchantress  Medusa  Void Spirit","BetBoom Team","Phantom Lancer  Pugna  Doom  Disruptor  Pangolier","Team B"
"7199958992","15439","14 Jun 2023 04:05","2589","43:09","Team B","Shopify Rebellion","Bloodseeker  Enchantress  Visage  Monkey King  Void Spirit","OG","Bane  Morphling  Windranger  Templar Assassin  Undying","Team A"
"7199998014","15352","14 Jun 2023 04:24","2379","39:39","Team B","Ancient Tribe","Venomancer  Death Prophet  Magnus  Skywrath Mage  Void Spirit","ITB.Shuffle","Anti-Mage  Storm Spirit  Batrider  Legion Commander  Oracle","Team B"
"7200008486","15439","14 Jun 2023 04:36","1777","29:37","Team A","Team Aster","Anti-Mage  Mirana  Lich  Doom  Void Spirit","Entity","Beastmaster  Meepo  Rubick  Medusa  Timbersaw","Team A"
"7200099499","15352","14 Jun 2023 05:33","2225","37:05","Team B","Ancient Tribe","Dark Seer  Silencer  Shadow Demon  Ember Spirit  Void Spirit","ITB.Shuffle","Batrider  Undying  Legion Commander  Pangolier  Muerta","Team A"
"7200206787","15352","14 Jun 2023 06:54","2076","34:36","Team B","IVY","Rubick  Timbersaw  Terrorblade  Oracle  Void Spirit","Old G","Tiny  Templar Assassin  Doom  Silencer  Techies","Team A"
"7200283054","15352","14 Jun 2023 07:55","1989","33:09","Team B","Old G","Chen  Spirit Breaker  Keeper of the Light  Medusa  Void Spirit","IVY","Storm Spirit  Pugna  Shadow Demon  Magnus  Abaddon","Team A"
"7200350655","15352","14 Jun 2023 08:56","2524","42:04","Team A","IVY","Juggernaut  Shadow Demon  Magnus  Techies  Void Spirit","Old G","Morphling  Windranger  Tidehunter  Chen  Rubick","Team B"
"7200518793","15353","14 Jun 2023 11:55","2155","35:55","Team B","CDUB Esports","Silencer  Magnus  Skywrath Mage  Legion Commander  Void Spirit","TiltedBoys","Batrider  Spirit Breaker  Undying  Medusa  Ember Spirit","Team B"
"7200557852","15353","15 Jun 2023 12:59","2222","37:02","Team A","CDUB Esports","Sven  Jakiro  Spirit Breaker  Visage  Void Spirit","TiltedBoys","Batrider  Shadow Demon  Naga Siren  Techies  Underlord","Team B"
"7200614759","15353","15 Jun 2023 02:54","1882","31:22","Team B","American goons","Templar Assassin  Doom  Rubick  Disruptor  Void Spirit","Ravens","Mirana  Morphling  Witch Doctor  Magnus  Ember Spirit","Team B"
"7200643100","15353","15 Jun 2023 03:50","1286","21:26","Team A","American goons","Venomancer  Templar Assassin  Rubick  Magnus  Void Spirit","Ravens","Windranger  Spirit Breaker  Silencer  Timbersaw  Abaddon","Team B"
"7200716126","15384","15 Jun 2023 06:01","3415","56:55","Team A","Holy Grail","Silencer  Shadow Demon  Terrorblade  Winter Wyvern  Void Spirit","Limit","Chen  Rubick  Naga Siren  Magnus  Abaddon","Team A"
"7200772154","15384","15 Jun 2023 07:28","1884","31:24","Team B","Limit","Enchantress  Rubick  Slark  Timbersaw  Void Spirit","Holy Grail","Beastmaster  Clinkz  Alchemist  Ember Spirit  Oracle","Team B"
"7200826634","15384","15 Jun 2023 09:00","1913","31:53","Team B","Big brain","Windranger  Venomancer  Dark Seer  Spirit Breaker  Void Spirit","Supernova","Mirana  Batrider  Shadow Demon  Abaddon  Ember Spirit","Team B"
