"Match ID","League","Start Date","Duration (s)","Duration (mm:ss)","Radiant Team","Team A","Team A Heroes","Team B","Team B Heroes","Winner"
"7167707205","14691","23 May 2023 04:04","1818","30:18","Team B","Gen of Miracles","Queen of Pain  Spirit Breaker  Techies  Grimstroke  Void Spirit","Hot Headed Gaming","Tinker  Bounty Hunter  Shadow Demon  Visage  Medusa","Team B"
"7167761620","15335","23 May 2023 04:49","2601","43:21","Team B","Team Spirit","Lich  Beastmaster  Templar Assassin  Batrider  Void Spirit","UALEIKUMNIHAO","Bloodseeker  Enigma  Bounty Hunter  Techies  Pangolier","Team B"
"7167789378","15334","23 May 2023 04:57","1538","25:38","Team B","Sibe Team","Bloodseeker  Vengeful Spirit  Lich  Elder Titan  Void Spirit","Matreshka","Puck  Sand King  Enchantress  Jakiro  Medusa","Team B"
"7167802250","14691","23 May 2023 04:57","2211","36:51","Team A","Gen of Miracles","Anti-Mage  Tidehunter  Dazzle  Clinkz  Void Spirit","Hot Headed Gaming","Bloodseeker  Windranger  Lich  Bounty Hunter  Doom","Team B"
"7167881983","15334","23 May 2023 05:49","2084","34:44","Team B","Matreshka","Windranger  Clinkz  Oracle  Pangolier  Void Spirit","Sibe Team","Queen of Pain  Enchantress  Batrider  Naga Siren  Skywrath Mage","Team B"
"7167989492","14691","23 May 2023 07:03","2449","40:49","Team B","Unity Esports","Faceless Void  Pugna  Magnus  Phoenix  Void Spirit","KZ TEAM","Vengeful Spirit  Batrider  Undying  Techies  Pangolier","Team A"
"7168078303","14691","23 May 2023 08:06","1444","24:04","Team B","Unity Esports","Sven  Beastmaster  Bounty Hunter  Techies  Void Spirit","KZ TEAM","Riki  Templar Assassin  Batrider  Rubick  Underlord","Team B"
"7168081373","15365","23 May 2023 08:08","2451","40:51","Team A","Mad Kings Esports","Beastmaster  Magnus  Elder Titan  Techies  Void Spirit","beastcoast","Tiny  Kunkka  Silencer  Naga Siren  Snapfire","Team A"
"7168137290","15364","23 May 2023 08:59","2043","34:03","Team A","NoLimitsGaming","Disruptor  Magnus  Techies  Monkey King  Void Spirit","Chandogs","Tidehunter  Clinkz  Undying  Slark  Winter Wyvern","Team B"
"7168208633","15365","23 May 2023 09:58","1326","22:06","Team A","INFINITY","Spirit Breaker  Alchemist  Disruptor  Visage  Void Spirit","Evil Geniuses","Shadow Fiend  Bounty Hunter  Chaos Knight  Magnus  Oracle","Team B"
"7168267739","15348","23 May 2023 10:57","1916","31:56","Team B","CAP","Juggernaut  Pugna  Timbersaw  Techies  Void Spirit","GateKept","Beastmaster  Queen of Pain  Dragon Knight  Silencer  Keeper of the Light","Team B"
"7168403683","15348","24 May 2023 02:58","2610","43:30","Team B","GRIN Esports","Pugna  Enchantress  Ursa  Magnus  Void Spirit","American goons","Sven  Beastmaster  Silencer  Rubick  Pangolier","Team A"
"7168556067","15377","24 May 2023 07:05","3379","56:19","Team B","TeamKicked","Windranger  Doom  Silencer  Medusa  Void Spirit","Team Tough","Enchantress  Alchemist  Magnus  Techies  Earth Spirit","Team A"
"7168616515","15377","24 May 2023 08:32","1888","31:28","Team A","TeamKicked","Pugna  Doom  Ursa  Silencer  Void Spirit","Team Tough","Windranger  Bounty Hunter  Alchemist  Magnus  Techies","Team A"
"7168645545","15374","24 May 2023 09:15","3324","55:24","Team B","Execration","Clockwerk  Enchantress  Doom  Void Spirit  Muerta","Army Geniuses Mansion","Bloodseeker  Dragon Knight  Clinkz  Magnus  Techies","Team A"
"7168686447","15377","24 May 2023 10:01","1816","30:16","Team A","TeamKicked","Pugna  Spirit Breaker  Silencer  Terrorblade  Void Spirit","Neon Esports","Night Stalker  Alchemist  Disruptor  Ember Spirit  Dark Willow","Team A"
"7168716109","15374","24 May 2023 10:44","2659","44:19","Team B","Talon","Lich  Beastmaster  Slark  Dark Willow  Void Spirit","Made in Philippines","Spirit Breaker  Timbersaw  Ember Spirit  Phoenix  Muerta","Team A"
"7168742145","15377","24 May 2023 11:03","2788","46:28","Team A","Neon Esports","Axe  Terrorblade  Oracle  Dark Willow  Void Spirit","TeamKicked","Storm Spirit  Faceless Void  Pugna  Spirit Breaker  Techies","Team A"
"7168789296","15374","24 May 2023 11:55","1566","26:06","Team A","Talon","Lich  Beastmaster  Slark  Techies  Void Spirit","Made in Philippines","Doom  Undying  Ember Spirit  Terrorblade  Winter Wyvern","Team A"
"7168843646","15377","24 May 2023 12:45","2866","47:46","Team A","TeamKicked","Windranger  Lifestealer  Spirit Breaker  Techies  Void Spirit","Neon Esports","Bloodseeker  Enigma  Enchantress  Alchemist  Oracle","Team B"
"7168932637","15334","24 May 2023 02:04","1552","25:52","Team B","Not one step back gaming","Axe  Faceless Void  Enchantress  Dark Willow  Void Spirit","Bald Dynasty","Puck  Windranger  Silencer  Legion Commander  Techies","Team A"
"7169115499","15351","24 May 2023 04:00","3673","1:01:13","Team B","Quest Esports","Mirana  Templar Assassin  Phoenix  Void Spirit  Mars","Tundra Esports","Ursa  Spirit Breaker  Visage  Oracle  Dark Willow","Team A"
"7169118122","15334","24 May 2023 04:02","2653","44:13","Team B","Matreshka","Enchantress  Ogre Magi  Medusa  Elder Titan  Void Spirit","Not one step back gaming","Axe  Windranger  Meepo  Dark Willow  Snapfire","Team B"
"7169626992","15348","24 May 2023 10:02","2508","41:48","Team B","GateKept","Morphling  Disruptor  Legion Commander  Techies  Void Spirit","Fart Studios","Dragon Knight  Clockwerk  Clinkz  Batrider  Pangolier","Team B"
"7169630376","15351","24 May 2023 09:56","1658","27:38","Team A","Gaimin Gladiators","Bloodseeker  Lich  Dark Seer  Techies  Void Spirit","Entity","Windranger  Queen of Pain  Spirit Breaker  Silencer  Medusa","Team A"
"7169730942","15350","24 May 2023 11:56","2146","35:46","Team A","TSM","Clinkz  Broodmother  Rubick  Magnus  Void Spirit","felt","Storm Spirit  Enigma  Bounty Hunter  Naga Siren  Skywrath Mage","Team A"
"7169735879","15351","25 May 2023 12:00","1582","26:22","Team A","Team Secret","Venomancer  Spirit Breaker  Medusa  Techies  Void Spirit","Luna Galaxy","Juggernaut  Keeper of the Light  Skywrath Mage  Underlord  Pangolier","Team A"
"7169770541","15350","25 May 2023 01:01","2683","44:43","Team A","TSM","Venomancer  Rubick  Magnus  Techies  Void Spirit","felt","Axe  Mirana  Storm Spirit  Pugna  Terrorblade","Team A"
"7169773678","15348","25 May 2023 01:08","1988","33:08","Team A","American goons","Spirit Breaker  Visage  Techies  Terrorblade  Void Spirit","GateKept","Queen of Pain  Rubick  Troll Warlord  Magnus  Phoenix","Team A"
"7169801364","15348","25 May 2023 02:05","1505","25:05","Team B","American goons","Crystal Maiden  Naga Siren  Magnus  Skywrath Mage  Void Spirit","GateKept","Spirit Breaker  Silencer  Visage  Ember Spirit  Terrorblade","Team A"
"7169826225","15350","25 May 2023 02:55","2203","36:43","Team B","Shopify Rebellion","Mirana  Templar Assassin  Doom  Shadow Demon  Void Spirit","B8","Vengeful Spirit  Windranger  Queen of Pain  Spirit Breaker  Phoenix","Team A"
"7169862028","15350","25 May 2023 03:58","1588","26:28","Team B","Shopify Rebellion","Mirana  Clockwerk  Medusa  Void Spirit  Mars","B8","Phantom Lancer  Vengeful Spirit  Windranger  Spirit Breaker  Winter Wyvern","Team A"
"7170114740","14691","25 May 2023 10:05","3035","50:35","Team A","Unity Esports","Pugna  Clinkz  Ursa  Spirit Breaker  Void Spirit","IVY","Riki  Huskar  Doom  Techies  Oracle","Team B"
"7170181086","14691","25 May 2023 11:14","2133","35:33","Team A","Unity Esports","Faceless Void  Bounty Hunter  Chen  Medusa  Void Spirit","IVY","Windranger  Batrider  Nyx Assassin  Keeper of the Light  Pangolier","Team B"
"7170288284","14691","25 May 2023 01:05","2646","44:06","Team B","Ancient Tribe","Puck  Pugna  Techies  Winter Wyvern  Void Spirit","HAVU","Crystal Maiden  Invoker  Rubick  Naga Siren  Magnus","Team A"
"7170542480","15335","25 May 2023 04:00","1496","24:56","Team B","Virtus.pro","Beastmaster  Silencer  Chaos Knight  Keeper of the Light  Void Spirit","Team Spirit","Storm Spirit  Pugna  Doom  Monkey King  Snapfire","Team A"
"7170642030","15335","25 May 2023 04:52","2504","41:44","Team A","Virtus.pro","Beastmaster  Pugna  Enchantress  Terrorblade  Void Spirit","Team Spirit","Bloodseeker  Techies  Oracle  Pangolier  Primal Beast","Team B"
"7170649918","14691","25 May 2023 04:52","1833","30:33","Team A","IVY","Windranger  Batrider  Spirit Breaker  Winter Wyvern  Void Spirit","HAVU","Bloodseeker  Storm Spirit  Lich  Beastmaster  Techies","Team A"
"7170762957","15364","25 May 2023 06:05","2491","41:31","Team A","Los moticucos","Morphling  Death Prophet  Spirit Breaker  Techies  Void Spirit","Universitario eSports","Tidehunter  Clinkz  Ancient Apparition  Magnus  Timbersaw","Team A"
"7170856526","15364","25 May 2023 07:10","2202","36:42","Team B","Los moticucos","Shadow Fiend  Rubick  Medusa  Void Spirit  Dawnbreaker","Universitario eSports","Crystal Maiden  Invoker  Keeper of the Light  Slark  Pangolier","Team A"
"7170938464","15365","25 May 2023 08:12","2384","39:44","Team B","INFINITY","Phantom Assassin  Spirit Breaker  Disruptor  Visage  Void Spirit","Balrogs Esports™","Medusa  Techies  Oracle  Monkey King  Mars","Team A"
"7171251472","15365","26 May 2023 02:18","1663","27:43","Team A","Thunder Awaken","Sven  Doom  Rubick  Winter Wyvern  Void Spirit","beastcoast","Disruptor  Magnus  Timbersaw  Skywrath Mage  Pangolier","Team B"
"7171630543","15374","26 May 2023 11:17","1984","33:04","Team B","Team SMG","Bane  Venomancer  Batrider  Naga Siren  Void Spirit","Blacklist Rivalry","Windranger  Doom  Abaddon  Terrorblade  Pangolier","Team B"
"7171812457","15374","26 May 2023 01:56","2247","37:27","Team B","Talon","Lich  Beastmaster  Slark  Techies  Void Spirit","Army Geniuses Mansion","Windranger  Undying  Magnus  Ember Spirit  Oracle","Team A"
"7171904083","15351","26 May 2023 03:00","1996","33:16","Team B","OG","Ursa  Undying  Rubick  Keeper of the Light  Void Spirit","Team Liquid","Bloodseeker  Lich  Magnus  Techies  Ember Spirit","Team B"
"7172013587","15351","26 May 2023 04:01","2379","39:39","Team B","Team Liquid","Doom  Slark  Oracle  Winter Wyvern  Void Spirit","OG","Mirana  Lich  Enigma  Earth Spirit  Monkey King","Team A"
"7172026213","14691","26 May 2023 04:07","978","16:18","Team B","Hot Headed Gaming","Axe  Lich  Medusa  Hoodwink  Void Spirit","KZ TEAM","Windranger  Beastmaster  Queen of Pain  Pugna  Bounty Hunter","Team B"
"7172096463","14691","26 May 2023 04:44","1556","25:56","Team B","KZ TEAM","Dark Seer  Spirit Breaker  Shadow Demon  Terrorblade  Void Spirit","Hot Headed Gaming","Bloodseeker  Storm Spirit  Windranger  Beastmaster  Keeper of the Light","Team A"
"7172211273","15351","26 May 2023 05:54","2556","42:36","Team A","Team Secret","Mirana  Spirit Breaker  Medusa  Oracle  Void Spirit","Entity","Morphling  Dark Seer  Batrider  Shadow Demon  Undying","Team B"
"7172322582","15351","26 May 2023 07:02","2101","35:01","Team B","Team Secret","Venomancer  Templar Assassin  Doom  Skywrath Mage  Void Spirit","Entity","Phantom Lancer  Windranger  Undying  Techies  Pangolier","Team B"
"7172478697","15351","26 May 2023 08:55","1697","28:17","Team A","Luna Galaxy","Doom  Spirit Breaker  Visage  Medusa  Void Spirit","Quest Esports","Mirana  Morphling  Tiny  Silencer  Magnus","Team A"
"7172551321","15351","26 May 2023 09:52","2345","39:05","Team A","Luna Galaxy","Dark Seer  Shadow Demon  Medusa  Techies  Void Spirit","Quest Esports","Spirit Breaker  Slark  Terrorblade  Phoenix  Pangolier","Team B"
"7172625564","15351","26 May 2023 10:58","2916","48:36","Team A","Luna Galaxy","Mirana  Dark Seer  Spirit Breaker  Medusa  Void Spirit","Quest Esports","Morphling  Silencer  Timbersaw  Techies  Pangolier","Team A"
"7172754470","15350","27 May 2023 01:51","2635","43:55","Team A","TSM","Bounty Hunter  Batrider  Silencer  Medusa  Void Spirit","nouns","Morphling  Storm Spirit  Spirit Breaker  Keeper of the Light  Techies","Team B"
"7172797063","15350","27 May 2023 03:11","2130","35:30","Team A","DogChamp","Lich  Clinkz  Doom  Magnus  Void Spirit","ALPHA","Crystal Maiden  Puck  Undying  Timbersaw  Terrorblade","Team A"
"7172899103","15350","27 May 2023 05:29","2193","36:33","Team A","DogChamp","Doom  Magnus  Phoenix  Oracle  Void Spirit","ALPHA","Bloodseeker  Disruptor  Timbersaw  Techies  Underlord","Team A"
"7172936045","15383","27 May 2023 06:08","2871","47:51","Team B","PSG.LGD","Doom  Ogre Magi  Medusa  Skywrath Mage  Void Spirit","Team Bright","Spirit Breaker  Undying  Rubick  Winter Wyvern  Arc Warden","Team A"
"7173170319","14691","27 May 2023 10:04","1457","24:17","Team A","Hot Headed Gaming","Mirana  Beastmaster  Silencer  Slark  Void Spirit","Unity Esports","Batrider  Chen  Spirit Breaker  Naga Siren  Techies","Team B"
"7173232703","15286","27 May 2023 10:58","1995","33:15","Team A","StoRm","Beastmaster  Shadow Demon  Magnus  Techies  Void Spirit","Bald Dynasty","Faceless Void  Clinkz  Spirit Breaker  Silencer  Pangolier","Team A"
"7173427255","15383","27 May 2023 01:25","2017","33:37","Team B","Azure Ray","Lich  Faceless Void  Batrider  Timbersaw  Void Spirit","INVICTUS GAMING","Windranger  Luna  Spirit Breaker  Silencer  Primal Beast","Team A"
"7173476442","15335","27 May 2023 02:04","2219","36:59","Team A","Nemiga Gaming","Rubick  Magnus  Timbersaw  Techies  Void Spirit","Team Spirit","Juggernaut  Batrider  Spirit Breaker  Silencer  Phoenix","Team B"
"7173486301","14691","27 May 2023 02:06","3626","1:00:26","Team B","KZ TEAM","Vengeful Spirit  Windranger  Bounty Hunter  Magnus  Void Spirit","Gen of Miracles","Mirana  Naga Siren  Phoenix  Marci  Muerta","Team B"
"7173612321","14691","27 May 2023 03:27","2428","40:28","Team A","KZ TEAM","Windranger  Bounty Hunter  Chen  Medusa  Void Spirit","Gen of Miracles","Queen of Pain  Shadow Demon  Techies  Terrorblade  Marci","Team B"
"7173716377","15335","27 May 2023 04:28","1347","22:27","Team A","UALEIKUMNIHAO","Bloodseeker  Death Prophet  Bounty Hunter  Techies  Void Spirit","HYDRA","Beastmaster  Faceless Void  Pugna  Batrider  Rubick","Team B"
"7173751392","14691","27 May 2023 04:40","1666","27:46","Team B","HAVU","Beastmaster  Spirit Breaker  Silencer  Medusa  Void Spirit","RAM SQUAD","Shadow Demon  Rubick  Slark  Magnus  Ember Spirit","Team B"
"7173811393","15286","27 May 2023 05:19","2856","47:36","Team B","Not one step back gaming","Windranger  Enchantress  Brewmaster  Void Spirit  Snapfire","Moneymakers","Crystal Maiden  Beastmaster  Queen of Pain  Pugna  Medusa","Team B"
"7174096907","15335","27 May 2023 08:14","1371","22:51","Team B","BetBoom Team","Bloodseeker  Tidehunter  Lich  Enchantress  Void Spirit","9Pandas","Beastmaster  Jakiro  Alchemist  Invoker  Skywrath Mage","Team A"
"7174152761","15350","27 May 2023 08:58","2319","38:39","Team A","nouns","Morphling  Undying  Keeper of the Light  Void Spirit  Primal Beast","felt","Mirana  Windranger  Enigma  Spirit Breaker  Pangolier","Team A"
"7174243062","15350","27 May 2023 10:04","2024","33:44","Team B","felt","Windranger  Batrider  Spirit Breaker  Naga Siren  Void Spirit","nouns","Morphling  Omniknight  Ogre Magi  Disruptor  Keeper of the Light","Team B"
"7174360474","15350","27 May 2023 11:56","2975","49:35","Team A","DogChamp","Morphling  Lich  Doom  Skywrath Mage  Void Spirit","SAND KING GÓMEZ","Storm Spirit  Undying  Centaur Warrunner  Techies  Terrorblade","Team A"
"7174420822","15350","28 May 2023 01:11","1599","26:39","Team B","SAND KING GÓMEZ","Pugna  Dark Seer  Nyx Assassin  Magnus  Void Spirit","DogChamp","Beastmaster  Silencer  Medusa  Techies  Pangolier","Team B"
"7174606719","15350","28 May 2023 05:42","2420","40:20","Team A","B8","Beastmaster  Clinkz  Slark  Techies  Void Spirit","ALPHA","Storm Spirit  Ursa  Undying  Magnus  Skywrath Mage","Team B"
"7174697496","15383","28 May 2023 07:20","1628","27:08","Team B","INVICTUS GAMING","Faceless Void  Spirit Breaker  Visage  Skywrath Mage  Void Spirit","Aster.Aries","Crystal Maiden  Morphling  Windranger  Magnus  Phoenix","Team A"
"7174996664","15286","28 May 2023 11:36","2729","45:29","Team B","HAVU","Crystal Maiden  Ogre Magi  Techies  Void Spirit  Muerta","sQreens squad","Windranger  Tidehunter  Queen of Pain  Clockwerk  Enchantress","Team B"
"7175114480","15286","28 May 2023 12:59","2118","35:18","Team B","Gen of Miracles","Undying  Magnus  Techies  Terrorblade  Void Spirit","nouns","Storm Spirit  Pugna  Batrider  Doom  Medusa","Team B"
"7175401143","15286","28 May 2023 03:59","2286","38:06","Team B","Unity Esports","Beastmaster  Pugna  Slark  Phoenix  Void Spirit","ITB.Shuffle","Axe  Enchantress  Huskar  Techies  Terrorblade","Team B"
"7175533035","15286","28 May 2023 05:05","2737","45:37","Team B","ITB.Shuffle","Dark Seer  Rubick  Techies  Monkey King  Void Spirit","Unity Esports","Mirana  Storm Spirit  Pugna  Batrider  Io","Team A"
"7175537812","15335","28 May 2023 05:10","1776","29:36","Team A","Team Spirit","Morphling  Chen  Visage  Techies  Void Spirit","HYDRA","Crystal Maiden  Beastmaster  Batrider  Rubick  Naga Siren","Team B"
"7175718914","14691","28 May 2023 07:00","2215","36:55","Team B","IVY","Riki  Enchantress  Magnus  Techies  Void Spirit","RAM SQUAD","Morphling  Pugna  Batrider  Spirit Breaker  Rubick","Team A"
"7175895592","14691","28 May 2023 09:11","2251","37:31","Team B","RAM SQUAD","Venomancer  Rubick  Naga Siren  Centaur Warrunner  Void Spirit","IVY","Mirana  Storm Spirit  Windranger  Batrider  Undying","Team B"
"7175974137","15365","28 May 2023 10:30","1337","22:17","Team B","Mad Kings Esports","Puck  Death Prophet  Shadow Demon  Earth Spirit  Void Spirit","INFINITY","Shadow Fiend  Sven  Dark Seer  Spirit Breaker  Disruptor","Team B"
"7176325454","15374","29 May 2023 07:03","2412","40:12","Team A","BOOM Esports","Lich  Brewmaster  Techies  Monkey King  Void Spirit","Army Geniuses Mansion","Morphling  Beastmaster  Faceless Void  Silencer  Keeper of the Light","Team B"
"7176530992","15286","29 May 2023 11:17","1539","25:39","Team B","DerzhaWin","Phantom Lancer  Venomancer  Spirit Breaker  Winter Wyvern  Void Spirit","Sibe Team","Pugna  Enchantress  Medusa  Magnus  Ember Spirit","Team B"
"7176584342","15374","29 May 2023 12:06","3685","1:01:25","Team A","BLEED","Batrider  Silencer  Slark  Magnus  Void Spirit","Blacklist Rivalry","Windranger  Tidehunter  Venomancer  Faceless Void  Pangolier","Team B"
"7176645327","14691","29 May 2023 01:03","2024","33:44","Team B","Ancient Tribe","Morphling  Venomancer  Magnus  Techies  Void Spirit","KZ TEAM","Batrider  Undying  Underlord  Terrorblade  Primal Beast","Team A"
"7176761619","15286","29 May 2023 02:26","1640","27:20","Team B","LEVEL UP","Phantom Lancer  Venomancer  Rubick  Magnus  Void Spirit","Comeback","Drow Ranger  Queen of Pain  Pugna  Batrider  Spirit Breaker","Team A"
"7176895315","14691","29 May 2023 03:51","2332","38:52","Team A","Ancient Tribe","Viper  Dark Seer  Spirit Breaker  Phoenix  Void Spirit","KZ TEAM","Mirana  Windranger  Batrider  Underlord  Oracle","Team B"
"7176911092","15351","29 May 2023 04:00","2340","39:00","Team B","Team Liquid","Faceless Void  Pugna  Disruptor  Medusa  Void Spirit","Tundra Esports","Bloodseeker  Lich  Enigma  Batrider  Timbersaw","Team A"
"7177041090","14691","29 May 2023 05:20","1488","24:48","Team B","Ancient Tribe","Venomancer  Shadow Demon  Magnus  Ember Spirit  Void Spirit","Unity Esports","Batrider  Spirit Breaker  Undying  Terrorblade  Pangolier","Team A"
"7177172840","15351","29 May 2023 06:45","1558","25:58","Team B","Gaimin Gladiators","Beastmaster  Enchantress  Disruptor  Magnus  Void Spirit","OG","Tiny  Batrider  Slark  Abaddon  Techies","Team A"
"7177226267","15286","29 May 2023 07:15","2440","40:40","Team B","NAVI Junior","Anti-Mage  Enchantress  Techies  Underlord  Void Spirit","Wildcard","Shadow Fiend  Storm Spirit  Pugna  Silencer  Legion Commander","Team A"
"7177230096","14691","29 May 2023 07:22","2541","42:21","Team B","Ancient Tribe","Crystal Maiden  Tidehunter  Techies  Terrorblade  Void Spirit","Unity Esports","Bloodseeker  Clinkz  Magnus  Underlord  Oracle","Team B"
"7177253113","15351","29 May 2023 07:38","1602","26:42","Team B","Gaimin Gladiators","Bloodseeker  Batrider  Skywrath Mage  Underlord  Void Spirit","OG","Storm Spirit  Tidehunter  Techies  Terrorblade  Oracle","Team A"
"7177428096","15269","29 May 2023 10:00","819","13:39","Team A","x5 Gaming","Witch Doctor  Doom  Skywrath Mage  Terrorblade  Void Spirit","Balrogs Esports™","Phantom Lancer  Beastmaster  Venomancer  Rubick  Ember Spirit","Team A"
"7177455255","15351","29 May 2023 10:29","1403","23:23","Team A","Quest Esports","Beastmaster  Templar Assassin  Silencer  Techies  Void Spirit","Team Secret","Storm Spirit  Pugna  Enchantress  Batrider  Chaos Knight","Team A"
"7177505195","15351","29 May 2023 11:21","2194","36:34","Team B","Quest Esports","Anti-Mage  Undying  Techies  Terrorblade  Void Spirit","Team Secret","Clinkz  Spirit Breaker  Medusa  Magnus  Timbersaw","Team A"
"7177566409","15350","30 May 2023 12:46","1967","32:47","Team B","Shopify Rebellion","Mirana  Batrider  Doom  Legion Commander  Void Spirit","felt","Vengeful Spirit  Windranger  Dark Seer  Spirit Breaker  Pangolier","Team A"
"7177616796","15269","30 May 2023 02:20","2589","43:09","Team B","Acatsuki","Viper  Rubick  Troll Warlord  Centaur Warrunner  Void Spirit","Lava Esports","Bloodseeker  Lycan  Undying  Techies  Monkey King","Team B"
"7177740887","15383","30 May 2023 06:00","1803","30:03","Team B","Piggy Killer","Crystal Maiden  Phantom Lancer  Shadow Demon  Timbersaw  Void Spirit","Aster.Aries","Juggernaut  Venomancer  Enchantress  Spirit Breaker  Ember Spirit","Team A"
"7177776382","15383","30 May 2023 06:54","2262","37:42","Team B","Aster.Aries","Tidehunter  Silencer  Shadow Demon  Medusa  Void Spirit","Piggy Killer","Juggernaut  Storm Spirit  Windranger  Beastmaster  Skywrath Mage","Team B"
"7177858324","15383","30 May 2023 09:00","2417","40:17","Team B","Azure Ray","Undying  Medusa  Magnus  Techies  Void Spirit","Team Bright","Morphling  Doom  Silencer  Shadow Demon  Pangolier","Team B"
"7177917735","15383","30 May 2023 10:01","2226","37:06","Team A","Team Bright","Faceless Void  Silencer  Rubick  Legion Commander  Void Spirit","Azure Ray","Crystal Maiden  Dragon Knight  Batrider  Lone Druid  Magnus","Team A"
"7178089588","15286","30 May 2023 12:59","1540","25:40","Team A","Alliance","Bloodseeker  Silencer  Techies  Monkey King  Void Spirit","BAZA eSports","Storm Spirit  Keeper of the Light  Slark  Underlord  Oracle","Team A"
"7178161384","15286","30 May 2023 01:52","1752","29:12","Team A","BAZA eSports","Bloodseeker  Bounty Hunter  Legion Commander  Oracle  Void Spirit","Alliance","Venomancer  Spirit Breaker  Visage  Medusa  Winter Wyvern","Team B"
"7178353007","15335","30 May 2023 04:00","2302","38:22","Team A","BetBoom Team","Enchantress  Chaos Knight  Disruptor  Magnus  Void Spirit","Team Spirit","Tidehunter  Lich  Batrider  Troll Warlord  Techies","Team B"
"7178476311","15335","30 May 2023 05:10","1845","30:45","Team B","Team Spirit","Morphling  Tidehunter  Lich  Skywrath Mage  Void Spirit","BetBoom Team","Bloodseeker  Templar Assassin  Enchantress  Doom  Oracle","Team B"
"7178566993","15335","30 May 2023 06:07","1941","32:21","Team A","BetBoom Team","Bloodseeker  Enchantress  Spirit Breaker  Oracle  Void Spirit","Team Spirit","Lich  Rubick  Magnus  Monkey King  Pangolier","Team B"
"7178636521","15286","30 May 2023 06:59","3441","57:21","Team B","SAND KING GÓMEZ","Earthshaker  Shadow Demon  Medusa  Void Spirit  Dawnbreaker","Trouble Makers Reborn","Axe  Crystal Maiden  Keeper of the Light  Ember Spirit  Monkey King","Team B"
"7178746725","14691","30 May 2023 08:16","2566","42:46","Team A","IVY","Crystal Maiden  Windranger  Timbersaw  Techies  Void Spirit","nouns","Bloodseeker  Omniknight  Batrider  Doom  Disruptor","Team A"
"7178868041","15269","30 May 2023 10:00","1609","26:49","Team B","x5 Gaming","Witch Doctor  Magnus  Bristleback  Dark Willow  Void Spirit","Universitario eSports","Juggernaut  Beastmaster  Templar Assassin  Rubick  Disruptor","Team A"
"7178925011","15269","30 May 2023 10:55","2267","37:47","Team B","Universitario eSports","Clinkz  Silencer  Medusa  Underlord  Void Spirit","x5 Gaming","Bane  Juggernaut  Spirit Breaker  Disruptor  Ember Spirit","Team B"
"7179006959","15269","31 May 2023 01:01","1505","25:05","Team A","Lava Esports","Bloodseeker  Brewmaster  Undying  Techies  Void Spirit","noMERCY","Juggernaut  Beastmaster  Clockwerk  Skywrath Mage  Ember Spirit","Team B"
"7179309709","15374","31 May 2023 09:18","3413","56:53","Team A","Execration","Bane  Templar Assassin  Rubick  Underlord  Void Spirit","Team SMG","Bloodseeker  Beastmaster  Venomancer  Keeper of the Light  Pangolier","Team A"
"7179345657","15286","31 May 2023 10:00","2148","35:48","Team B","IVY","Mirana  Queen of Pain  Magnus  Winter Wyvern  Void Spirit","KZ TEAM","Storm Spirit  Pugna  Rubick  Medusa  Underlord","Team A"
"7179395678","15374","31 May 2023 10:51","1801","30:01","Team B","Talon","Pugna  Templar Assassin  Doom  Spirit Breaker  Void Spirit","BOOM Esports","Bloodseeker  Death Prophet  Techies  Oracle  Pangolier","Team A"
"7179445507","15374","31 May 2023 11:48","2517","41:57","Team A","Talon","Windranger  Faceless Void  Pugna  Spirit Breaker  Void Spirit","BOOM Esports","Clockwerk  Medusa  Techies  Ember Spirit  Pangolier","Team B"
"7179513968","15374","31 May 2023 12:55","2560","42:40","Team A","Talon","Enchantress  Doom  Shadow Demon  Terrorblade  Void Spirit","BOOM Esports","Mirana  Kunkka  Naga Siren  Medusa  Techies","Team B"
"7179523844","15286","31 May 2023 01:00","3808","1:03:28","Team A","cybercats","Lifestealer  Silencer  Magnus  Techies  Void Spirit","LEVEL UP","Pugna  Enchantress  Ember Spirit  Terrorblade  Primal Beast","Team A"
"7179582844","14691","31 May 2023 01:45","2595","43:15","Team A","KZ TEAM","Crystal Maiden  Mirana  Batrider  Void Spirit  Primal Beast","UALEIKUMNIHAO","Storm Spirit  Enigma  Lifestealer  Enchantress  Spirit Breaker","Team A"
